"No.","Time","Source","Destination","Protocol","Length","Info"
"1","0.000000","192.168.4.113","192.168.4.1","DNS","78","Standard query 0x8a1e A capi.grammarly.com"
"2","0.004042","192.168.4.1","192.168.4.113","DNS","206","Standard query response 0x8a1e A capi.grammarly.com A 54.210.124.124 A 52.207.160.114 A 3.232.12.1 A 52.5.62.219 A 34.232.27.103 A 35.172.249.209 A 3.213.27.86 A 44.215.185.198"
"3","0.014722","192.168.4.113","54.210.124.124","TCP","66","56183  >  443 [SYN] Seq=0 Win=64240 Len=0 MSS=1460 WS=256 SACK_PERM"
"4","0.322784","54.210.124.124","192.168.4.113","TCP","66","443  >  56183 [SYN, ACK] Seq=0 Ack=1 Win=26883 Len=0 MSS=1440 SACK_PERM WS=256"
"5","0.322937","192.168.4.113","54.210.124.124","TCP","54","56183  >  443 [ACK] Seq=1 Ack=1 Win=132352 Len=0"
"6","0.323860","192.168.4.113","54.210.124.124","TLSv1.2","365","Client Hello (SNI=capi.grammarly.com)"
"7","0.630234","54.210.124.124","192.168.4.113","TCP","54","443  >  56183 [ACK] Seq=1 Ack=312 Win=28160 Len=0"
"8","0.630234","54.210.124.124","192.168.4.113","TLSv1.2","1494","Server Hello"
"9","0.630234","54.210.124.124","192.168.4.113","TCP","1494","443  >  56183 [ACK] Seq=1441 Ack=312 Win=28160 Len=1440 [TCP segment of a reassembled PDU]"
"10","0.630382","192.168.4.113","54.210.124.124","TCP","54","56183  >  443 [ACK] Seq=312 Ack=2881 Win=132352 Len=0"
"11","0.630560","54.210.124.124","192.168.4.113","TCP","1494","443  >  56183 [ACK] Seq=2881 Ack=312 Win=28160 Len=1440 [TCP segment of a reassembled PDU]"
"12","0.630560","54.210.124.124","192.168.4.113","TLSv1.2","1167","Certificate, Server Key Exchange, Server Hello Done"
"13","0.630667","192.168.4.113","54.210.124.124","TCP","54","56183  >  443 [ACK] Seq=312 Ack=5434 Win=132352 Len=0"
"14","0.649275","192.168.4.113","54.210.124.124","TLSv1.2","180","Client Key Exchange, Change Cipher Spec, Encrypted Handshake Message"
"15","0.937687","54.210.124.124","192.168.4.113","TCP","54","443  >  56183 [ACK] Seq=5434 Ack=438 Win=28160 Len=0"
"16","0.937687","54.210.124.124","192.168.4.113","TLSv1.2","225","New Session Ticket, Change Cipher Spec, Encrypted Handshake Message"
"17","0.951858","192.168.4.113","54.210.124.124","TLSv1.2","1443","Application Data"
"18","1.244595","54.210.124.124","192.168.4.113","TLSv1.2","1164","Application Data"
"19","1.268883","192.168.4.113","54.210.124.124","TLSv1.2","796","Application Data"
"20","1.349119","192.168.4.113","192.168.4.1","DNS","78","Standard query 0x3330 A gnar.grammarly.com"
"21","1.352405","192.168.4.1","192.168.4.113","DNS","206","Standard query response 0x3330 A gnar.grammarly.com A 44.209.51.97 A 34.239.230.199 A 54.92.197.120 A 52.2.233.171 A 44.199.104.227 A 50.16.217.34 A 3.209.147.228 A 3.223.77.234"
"22","1.353744","192.168.4.113","44.209.51.97","TCP","66","56184  >  443 [SYN] Seq=0 Win=64240 Len=0 MSS=1460 WS=256 SACK_PERM"
"23","1.551349","54.210.124.124","192.168.4.113","TLSv1.2","379","Application Data"
"24","1.570335","44.209.51.97","192.168.4.113","TCP","66","443  >  56184 [SYN, ACK] Seq=0 Ack=1 Win=26883 Len=0 MSS=1440 SACK_PERM WS=256"
"25","1.570545","192.168.4.113","44.209.51.97","TCP","54","56184  >  443 [ACK] Seq=1 Ack=1 Win=132352 Len=0"
"26","1.571463","192.168.4.113","44.209.51.97","TLSv1.2","365","Client Hello (SNI=gnar.grammarly.com)"
"27","1.596177","192.168.4.113","54.210.124.124","TCP","54","56183  >  443 [ACK] Seq=2569 Ack=7040 Win=132352 Len=0"
"28","1.863413","44.209.51.97","192.168.4.113","TCP","54","443  >  56184 [ACK] Seq=1 Ack=312 Win=28160 Len=0"
"29","1.863413","44.209.51.97","192.168.4.113","TLSv1.2","1494","Server Hello"
"30","1.863413","44.209.51.97","192.168.4.113","TCP","1494","443  >  56184 [ACK] Seq=1441 Ack=312 Win=28160 Len=1440 [TCP segment of a reassembled PDU]"
"31","1.863413","44.209.51.97","192.168.4.113","TCP","1494","443  >  56184 [ACK] Seq=2881 Ack=312 Win=28160 Len=1440 [TCP segment of a reassembled PDU]"
"32","1.863413","44.209.51.97","192.168.4.113","TLSv1.2","1144","Certificate, Server Key Exchange, Server Hello Done"
"33","1.863622","192.168.4.113","44.209.51.97","TCP","54","56184  >  443 [ACK] Seq=312 Ack=5411 Win=132352 Len=0"
"34","1.878532","192.168.4.113","44.209.51.97","TLSv1.2","180","Client Key Exchange, Change Cipher Spec, Encrypted Handshake Message"
"35","2.000079","192.168.4.113","142.250.195.74","UDP","71","63503  >  443 Len=29"
"36","2.011391","142.250.195.74","192.168.4.113","UDP","68","443  >  63503 Len=26"
"37","2.088068","192.168.4.1","224.0.0.1","IGMPv2","46","Membership Query, general"
"38","2.093891","44.209.51.97","192.168.4.113","TCP","54","443  >  56184 [ACK] Seq=5411 Ack=438 Win=28160 Len=0"
"39","2.093891","44.209.51.97","192.168.4.113","TLSv1.2","225","New Session Ticket, Change Cipher Spec, Encrypted Handshake Message"
"40","2.106563","192.168.4.113","44.209.51.97","TLSv1.2","388","Application Data"
"41","2.108518","192.168.4.113","224.0.0.252","IGMPv2","46","Membership Report group 224.0.0.252"
"42","2.108659","192.168.4.113","224.0.0.251","IGMPv2","46","Membership Report group 224.0.0.251"
"43","2.108742","192.168.4.113","239.255.255.250","IGMPv2","46","Membership Report group 239.255.255.250"
"44","2.200652","192.168.4.101","224.0.0.251","IGMPv2","46","Membership Report group 224.0.0.251"
"45","2.374904","44.209.51.97","192.168.4.113","TLSv1.2","108","Application Data"
"46","2.375305","192.168.4.113","44.209.51.97","TLSv1.2","1020","Application Data"
"47","2.678292","44.209.51.97","192.168.4.113","TCP","54","443  >  56184 [ACK] Seq=5636 Ack=1738 Win=30976 Len=0"
"48","2.883036","44.209.51.97","192.168.4.113","TLSv1.2","512","Application Data"
"49","2.934830","192.168.4.113","44.209.51.97","TCP","54","56184  >  443 [ACK] Seq=1738 Ack=6094 Win=131584 Len=0"
"50","4.640210","192.168.4.113","106.51.42.35","TCP","54","55832  >  443 [RST, ACK] Seq=1 Ack=1 Win=0 Len=0"
"51","6.262433","142.250.77.138","192.168.4.113","TLSv1.2","123","Application Data"
"52","6.311367","192.168.4.113","142.250.77.138","TCP","54","54688  >  443 [ACK] Seq=1 Ack=70 Win=511 Len=0"
"53","6.382469","192.168.4.113","192.168.4.1","DNS","96","Standard query 0x43b3 A win-extension.femetrics.grammarly.io"
"54","6.385308","192.168.4.1","192.168.4.113","DNS","192","Standard query response 0x43b3 A win-extension.femetrics.grammarly.io A 3.219.151.71 A 44.195.193.2 A 3.225.74.6 A 3.232.146.13 A 34.200.66.81 A 3.208.42.254"
"55","6.386117","192.168.4.113","3.219.151.71","TCP","66","56185  >  443 [SYN] Seq=0 Win=64240 Len=0 MSS=1460 WS=256 SACK_PERM"
"56","6.675219","3.219.151.71","192.168.4.113","TCP","66","443  >  56185 [SYN, ACK] Seq=0 Ack=1 Win=26883 Len=0 MSS=1440 SACK_PERM WS=256"
"57","6.675369","192.168.4.113","3.219.151.71","TCP","54","56185  >  443 [ACK] Seq=1 Ack=1 Win=132352 Len=0"
"58","6.676101","192.168.4.113","3.219.151.71","TLSv1.2","383","Client Hello (SNI=win-extension.femetrics.grammarly.io)"
"59","6.979287","3.219.151.71","192.168.4.113","TCP","54","443  >  56185 [ACK] Seq=1 Ack=330 Win=28160 Len=0"
"60","6.979287","3.219.151.71","192.168.4.113","TLSv1.2","1494","Server Hello"
"61","6.979287","3.219.151.71","192.168.4.113","TCP","1494","443  >  56185 [ACK] Seq=1441 Ack=330 Win=28160 Len=1440 [TCP segment of a reassembled PDU]"
"62","6.979425","192.168.4.113","3.219.151.71","TCP","54","56185  >  443 [ACK] Seq=330 Ack=2881 Win=132352 Len=0"
"63","6.980106","3.219.151.71","192.168.4.113","TCP","1494","443  >  56185 [ACK] Seq=2881 Ack=330 Win=28160 Len=1440 [TCP segment of a reassembled PDU]"
"64","6.980106","3.219.151.71","192.168.4.113","TLSv1.2","1176","Certificate, Server Key Exchange, Server Hello Done"
"65","6.980238","192.168.4.113","3.219.151.71","TCP","54","56185  >  443 [ACK] Seq=330 Ack=5443 Win=132352 Len=0"
"66","6.995919","192.168.4.113","3.219.151.71","TLSv1.2","180","Client Key Exchange, Change Cipher Spec, Encrypted Handshake Message"
"67","7.286393","3.219.151.71","192.168.4.113","TCP","54","443  >  56185 [ACK] Seq=5443 Ack=456 Win=28160 Len=0"
"68","7.286393","3.219.151.71","192.168.4.113","TLSv1.2","225","New Session Ticket, Change Cipher Spec, Encrypted Handshake Message"
"69","7.286625","142.250.195.74","192.168.4.113","UDP","201","443  >  63503 Len=159"
"70","7.293828","192.168.4.113","3.219.151.71","TLSv1.2","249","Application Data"
"71","7.294358","192.168.4.113","142.250.195.74","UDP","75","63503  >  443 Len=33"
"72","7.297273","142.250.195.74","192.168.4.113","UDP","201","443  >  63503 Len=159"
"73","7.297623","192.168.4.113","142.250.195.74","UDP","76","63503  >  443 Len=34"
"74","7.593611","3.219.151.71","192.168.4.113","TLSv1.2","108","Application Data"
"75","7.594074","192.168.4.113","3.219.151.71","TLSv1.2","502","Application Data"
"76","7.900820","3.219.151.71","192.168.4.113","TLSv1.2","608","Application Data"
"77","7.949474","192.168.4.113","3.219.151.71","TCP","54","56185  >  443 [ACK] Seq=1099 Ack=6222 Win=131584 Len=0"
"78","7.957015","192.168.4.113","216.58.196.174","UDP","1286","64344  >  443 Len=1244"
"79","7.957243","192.168.4.113","216.58.196.174","UDP","444","64344  >  443 Len=402"
"80","7.973562","216.58.196.174","192.168.4.113","UDP","69","443  >  64344 Len=27"
"81","8.012233","216.58.196.174","192.168.4.113","UDP","110","443  >  64344 Len=68"
"82","8.012233","216.58.196.174","192.168.4.113","UDP","63","443  >  64344 Len=21"
"83","8.012878","192.168.4.113","216.58.196.174","UDP","78","64344  >  443 Len=36"
"84","8.043119","192.168.4.113","216.58.196.174","UDP","75","64344  >  443 Len=33"
"85","8.046970","216.58.196.174","192.168.4.113","UDP","66","443  >  64344 Len=24"
"86","8.609271","192.168.4.113","142.250.182.78","UDP","403","61040  >  443 Len=361"
"87","8.619615","192.168.4.113","142.250.182.78","UDP","749","61040  >  443 Len=707"
"88","8.626784","142.250.182.78","192.168.4.113","UDP","75","443  >  61040 Len=33"
"89","8.628687","192.168.4.113","142.250.182.78","UDP","1285","61040  >  443 Len=1243"
"90","8.628974","192.168.4.113","142.250.182.78","UDP","1130","61040  >  443 Len=1088"
"91","8.629876","142.250.182.78","192.168.4.113","UDP","75","443  >  61040 Len=33"
"92","8.629904","192.168.4.113","192.168.4.1","DNS","86","Standard query 0x8883 A waa-pa.clients6.google.com"
"93","8.632791","192.168.4.1","192.168.4.113","DNS","102","Standard query response 0x8883 A waa-pa.clients6.google.com A 142.250.205.234"
"94","8.633109","192.168.4.113","142.250.182.78","UDP","75","61040  >  443 Len=33"
"95","8.635026","192.168.4.113","142.250.205.234","QUIC","1292","Initial, DCID=cc566147ea12441b, PKN: 1, CRYPTO"
"96","8.635130","192.168.4.113","142.250.205.234","QUIC","1292","Initial, DCID=cc566147ea12441b, PKN: 2, CRYPTO"
"97","8.635171","192.168.4.113","142.250.205.234","QUIC","1292","Initial, DCID=cc566147ea12441b, PKN: 3, CRYPTO, CRYPTO, PADDING"
"98","8.635409","192.168.4.113","142.250.205.234","QUIC","123","0-RTT, DCID=cc566147ea12441b"
"99","8.638899","142.250.182.78","192.168.4.113","UDP","74","443  >  61040 Len=32"
"100","8.641436","192.168.4.113","142.250.182.78","UDP","75","61040  >  443 Len=33"
"101","8.643170","192.168.4.113","142.250.195.74","UDP","364","63503  >  443 Len=322"
"102","8.645844","142.250.205.234","192.168.4.113","QUIC","1292","Initial, SCID=ec566147ea12441b, PKN: 1, ACK, PADDING"
"103","8.645844","142.250.205.234","192.168.4.113","QUIC","1292","Initial, SCID=ec566147ea12441b, PKN: 2, ACK, PADDING"
"104","8.652179","192.168.4.113","142.250.205.234","QUIC","1292","Initial, DCID=ec566147ea12441b, PKN: 6, PADDING, PING, PADDING"
"105","8.653074","142.250.195.74","192.168.4.113","UDP","75","443  >  63503 Len=33"
"106","8.662144","142.250.205.234","192.168.4.113","QUIC","1292","Initial, SCID=ec566147ea12441b, PKN: 3, ACK, PADDING"
"107","8.662550","192.168.4.113","142.250.195.74","UDP","75","63503  >  443 Len=33"
"108","8.678720","142.250.205.234","192.168.4.113","QUIC","1292","Initial, SCID=ec566147ea12441b, PKN: 4, CRYPTO, PADDING"
"109","8.678720","142.250.205.234","192.168.4.113","QUIC","348","Protected Payload (KP0)"
"110","8.678720","142.250.205.234","192.168.4.113","QUIC","986","Protected Payload (KP0)"
"111","8.678720","142.250.205.234","192.168.4.113","QUIC","87","Protected Payload (KP0)"
"112","8.678720","142.250.205.234","192.168.4.113","QUIC","66","Protected Payload (KP0)"
"113","8.680087","192.168.4.113","142.250.205.234","QUIC","1292","Handshake, DCID=ec566147ea12441b"
"114","8.680317","192.168.4.113","142.250.205.234","QUIC","73","Protected Payload (KP0), DCID=ec566147ea12441b"
"115","8.681049","192.168.4.113","142.250.205.234","QUIC","1288","Protected Payload (KP0), DCID=ec566147ea12441b"
"116","8.681218","192.168.4.113","142.250.205.234","QUIC","1292","Protected Payload (KP0), DCID=ec566147ea12441b"
"117","8.681285","192.168.4.113","142.250.205.234","QUIC","1288","Protected Payload (KP0), DCID=ec566147ea12441b"
"118","8.681335","192.168.4.113","142.250.205.234","QUIC","878","Protected Payload (KP0), DCID=ec566147ea12441b"
"119","8.689910","142.250.205.234","192.168.4.113","QUIC","162","Protected Payload (KP0)"
"120","8.690496","142.250.205.234","192.168.4.113","QUIC","67","Protected Payload (KP0)"
"121","8.690642","142.250.205.234","192.168.4.113","QUIC","67","Protected Payload (KP0)"
"122","8.692517","142.250.205.234","192.168.4.113","QUIC","71","Protected Payload (KP0)"
"123","8.692858","192.168.4.113","142.250.205.234","QUIC","74","Protected Payload (KP0), DCID=ec566147ea12441b"
"124","8.717248","142.250.205.234","192.168.4.113","QUIC","66","Protected Payload (KP0)"
"125","8.722806","142.250.182.78","192.168.4.113","UDP","733","443  >  61040 Len=691"
"126","8.723909","142.250.182.78","192.168.4.113","UDP","684","443  >  61040 Len=642"
"127","8.724517","142.250.182.78","192.168.4.113","UDP","276","443  >  61040 Len=234"
"128","8.726079","142.250.182.78","192.168.4.113","UDP","102","443  >  61040 Len=60"
"129","8.726204","192.168.4.113","142.250.182.78","UDP","84","61040  >  443 Len=42"
"130","8.730089","192.168.4.113","142.250.182.78","UDP","75","61040  >  443 Len=33"
"131","8.736192","142.250.182.78","192.168.4.113","UDP","68","443  >  61040 Len=26"
"132","8.739032","142.250.205.234","192.168.4.113","QUIC","1283","Protected Payload (KP0)"
"133","8.739032","142.250.205.234","192.168.4.113","QUIC","84","Protected Payload (KP0)"
"134","8.739727","192.168.4.113","142.250.205.234","QUIC","77","Protected Payload (KP0), DCID=ec566147ea12441b"
"135","8.774783","142.250.205.234","192.168.4.113","QUIC","66","Protected Payload (KP0)"
"136","8.821158","142.250.182.78","192.168.4.113","UDP","126","443  >  61040 Len=84"
"137","8.823539","192.168.4.113","142.250.182.78","UDP","82","61040  >  443 Len=40"
"138","8.824240","142.250.182.78","192.168.4.113","UDP","132","443  >  61040 Len=90"
"139","8.834338","142.250.182.78","192.168.4.113","UDP","68","443  >  61040 Len=26"
"140","8.834622","192.168.4.113","142.250.182.78","UDP","74","61040  >  443 Len=32"
"141","8.854454","142.250.195.74","192.168.4.113","UDP","1046","443  >  63503 Len=1004"
"142","8.854454","142.250.195.74","192.168.4.113","UDP","65","443  >  63503 Len=23"
"143","8.857995","192.168.4.113","142.250.195.74","UDP","82","63503  >  443 Len=40"
"144","8.870101","142.250.195.74","192.168.4.113","UDP","68","443  >  63503 Len=26"
"145","9.277457","192.168.4.113","74.125.200.188","TCP","55","56156  >  5228 [ACK] Seq=1 Ack=1 Win=510 Len=1"
"146","9.318902","74.125.200.188","192.168.4.113","TCP","66","5228  >  56156 [ACK] Seq=1 Ack=2 Win=290 Len=0 SLE=1 SRE=2"
"147","9.433707","192.168.4.113","44.209.51.97","TLSv1.2","364","Application Data"
"148","9.744318","44.209.51.97","192.168.4.113","TCP","54","443  >  56184 [ACK] Seq=6094 Ack=2048 Win=33024 Len=0"
"149","9.744318","44.209.51.97","192.168.4.113","TLSv1.2","108","Application Data"
"150","9.745012","192.168.4.113","44.209.51.97","TLSv1.2","1073","Application Data"
"151","9.825670","192.168.4.113","106.51.42.25","TLSv1.2","2345","Application Data"
"152","9.830752","106.51.42.25","192.168.4.113","TCP","54","443  >  56177 [ACK] Seq=1 Ack=1385 Win=701 Len=0"
"153","9.830752","106.51.42.25","192.168.4.113","TCP","54","443  >  56177 [ACK] Seq=1 Ack=2292 Win=723 Len=0"
"154","10.051294","106.51.42.25","192.168.4.113","TLSv1.2","580","Application Data"
"155","10.051294","106.51.42.25","192.168.4.113","TCP","1494","443  >  56177 [ACK] Seq=527 Ack=2292 Win=723 Len=1440 [TCP segment of a reassembled PDU]"
"156","10.051294","106.51.42.25","192.168.4.113","TLSv1.2","199","Application Data"
"157","10.051294","106.51.42.25","192.168.4.113","TCP","199","[TCP Retransmission] 443  >  56177 [PSH, ACK] Seq=1967 Ack=2292 Win=723 Len=145 [TCP segment of a reassembled PDU]"
"158","10.051401","192.168.4.113","106.51.42.25","TCP","66","56177  >  443 [ACK] Seq=2292 Ack=2112 Win=1024 Len=0 SLE=1967 SRE=2112"
"159","10.051503","44.209.51.97","192.168.4.113","TCP","54","443  >  56184 [ACK] Seq=6148 Ack=3067 Win=50944 Len=0"
"160","10.094646","44.209.51.97","192.168.4.113","TLSv1.2","512","Application Data"
"161","10.141146","192.168.4.113","44.209.51.97","TCP","54","56184  >  443 [ACK] Seq=3067 Ack=6606 Win=131072 Len=0"
"162","10.204435","192.168.4.113","74.125.200.188","TCP","55","56157  >  5228 [ACK] Seq=1 Ack=1 Win=509 Len=1"
"163","10.228712","192.168.4.113","106.51.42.25","TLSv1.2","455","Application Data"
"164","10.253758","106.51.42.25","192.168.4.113","TCP","54","443  >  56177 [ACK] Seq=2112 Ack=2693 Win=744 Len=0"
"165","10.253919","74.125.200.188","192.168.4.113","TCP","66","5228  >  56157 [ACK] Seq=1 Ack=2 Win=290 Len=0 SLE=1 SRE=2"
"166","10.389430","192.168.4.113","106.51.42.25","TLSv1.2","2368","Application Data"
"167","10.398407","106.51.42.25","192.168.4.113","TCP","54","443  >  56177 [ACK] Seq=2112 Ack=5007 Win=780 Len=0"
"168","10.588748","192.168.4.113","106.51.42.25","TLSv1.2","457","Application Data"
"169","10.591201","106.51.42.25","192.168.4.113","TLSv1.2","741","Application Data"
"170","10.591201","106.51.42.25","192.168.4.113","TLSv1.2","741","Application Data"
"171","10.591201","106.51.42.25","192.168.4.113","TCP","1494","443  >  56177 [ACK] Seq=3486 Ack=5007 Win=780 Len=1440 [TCP segment of a reassembled PDU]"
"172","10.591388","192.168.4.113","106.51.42.25","TCP","54","56177  >  443 [ACK] Seq=5410 Ack=4926 Win=1024 Len=0"
"173","10.592084","106.51.42.25","192.168.4.113","TLSv1.2","348","Application Data"
"174","10.592084","106.51.42.25","192.168.4.113","TCP","1494","443  >  56177 [ACK] Seq=5220 Ack=5007 Win=780 Len=1440 [TCP segment of a reassembled PDU]"
"175","10.592084","106.51.42.25","192.168.4.113","TLSv1.2","709","Application Data"
"176","10.592180","192.168.4.113","106.51.42.25","TCP","54","56177  >  443 [ACK] Seq=5410 Ack=7315 Win=1024 Len=0"
"177","10.599298","106.51.42.25","192.168.4.113","TCP","709","[TCP Spurious Retransmission] 443  >  56177 [PSH, ACK] Seq=6660 Ack=5007 Win=780 Len=655 [TCP segment of a reassembled PDU]"
"178","10.599298","106.51.42.25","192.168.4.113","TCP","54","443  >  56177 [ACK] Seq=7315 Ack=5410 Win=802 Len=0"
"179","10.599361","192.168.4.113","106.51.42.25","TCP","66","[TCP Dup ACK 176#1] 56177  >  443 [ACK] Seq=5410 Ack=7315 Win=1024 Len=0 SLE=6660 SRE=7315"
"180","10.829045","192.168.4.113","192.168.4.1","DNS","91","Standard query 0x482b A browser.pipe.aria.microsoft.com"
"181","10.831470","106.51.42.25","192.168.4.113","TLSv1.2","741","Application Data"
"182","10.831470","106.51.42.25","192.168.4.113","TCP","1494","443  >  56177 [ACK] Seq=8002 Ack=5410 Win=802 Len=1440 [TCP segment of a reassembled PDU]"
"183","10.831470","106.51.42.25","192.168.4.113","TLSv1.2","454","Application Data"
"184","10.831470","106.51.42.25","192.168.4.113","TCP","454","[TCP Retransmission] 443  >  56177 [PSH, ACK] Seq=9442 Ack=5410 Win=802 Len=400 [TCP segment of a reassembled PDU]"
"185","10.831590","192.168.4.113","106.51.42.25","TCP","66","56177  >  443 [ACK] Seq=5410 Ack=9842 Win=1024 Len=0 SLE=9442 SRE=9842"
"186","10.833385","192.168.4.1","192.168.4.113","DNS","212","Standard query response 0x482b A browser.pipe.aria.microsoft.com CNAME browser.events.data.trafficmanager.net CNAME onedscolprdwus07.westus.cloudapp.azure.com A 20.189.173.8"
"187","10.834292","192.168.4.113","20.189.173.8","TCP","66","56186  >  443 [SYN] Seq=0 Win=65535 Len=0 MSS=1460 WS=256 SACK_PERM"
"188","10.953420","192.168.4.113","106.51.42.25","TLSv1.2","2313","Application Data"
"189","10.953641","192.168.4.113","106.51.42.25","TLSv1.2","16411","Application Data"
"190","10.953750","192.168.4.113","106.51.42.25","TLSv1.2","16411","Application Data"
"191","10.953843","192.168.4.113","106.51.42.25","TLSv1.2","16411","Application Data"
"192","10.953919","192.168.4.113","106.51.42.25","TLSv1.2","16411","Application Data"
"193","10.953972","192.168.4.113","106.51.42.25","TLSv1.2","307","Application Data"
"194","10.975205","192.168.4.113","106.51.42.25","TCP","1438","[TCP Retransmission] 56177  >  443 [PSH, ACK] Seq=71966 Ack=9842 Win=1024 Len=1384"
"195","10.975402","106.51.42.25","192.168.4.113","TCP","54","443  >  56177 [ACK] Seq=9842 Ack=6794 Win=825 Len=0"
"196","10.975402","106.51.42.25","192.168.4.113","TCP","54","443  >  56177 [ACK] Seq=9842 Ack=7669 Win=847 Len=0"
"197","10.975402","106.51.42.25","192.168.4.113","TCP","54","443  >  56177 [ACK] Seq=9842 Ack=9053 Win=869 Len=0"
"198","10.975402","106.51.42.25","192.168.4.113","TCP","54","443  >  56177 [ACK] Seq=9842 Ack=10437 Win=892 Len=0"
"199","10.975402","106.51.42.25","192.168.4.113","TCP","54","443  >  56177 [ACK] Seq=9842 Ack=11821 Win=915 Len=0"
"200","10.975402","106.51.42.25","192.168.4.113","TCP","54","443  >  56177 [ACK] Seq=9842 Ack=13205 Win=938 Len=0"
"201","10.975402","106.51.42.25","192.168.4.113","TCP","54","443  >  56177 [ACK] Seq=9842 Ack=14589 Win=961 Len=0"
"202","10.975402","106.51.42.25","192.168.4.113","TCP","54","443  >  56177 [ACK] Seq=9842 Ack=15973 Win=983 Len=0"
"203","10.975402","106.51.42.25","192.168.4.113","TCP","54","443  >  56177 [ACK] Seq=9842 Ack=17357 Win=1006 Len=0"
"204","10.975402","106.51.42.25","192.168.4.113","TCP","54","443  >  56177 [ACK] Seq=9842 Ack=18741 Win=1029 Len=0"
"205","10.975402","106.51.42.25","192.168.4.113","TCP","54","443  >  56177 [ACK] Seq=9842 Ack=20125 Win=1052 Len=0"
"206","10.975402","106.51.42.25","192.168.4.113","TCP","54","443  >  56177 [ACK] Seq=9842 Ack=21509 Win=1075 Len=0"
"207","10.975402","106.51.42.25","192.168.4.113","TCP","54","443  >  56177 [ACK] Seq=9842 Ack=24026 Win=1114 Len=0"
"208","10.975402","106.51.42.25","192.168.4.113","TCP","54","443  >  56177 [ACK] Seq=9842 Ack=25410 Win=1137 Len=0"
"209","10.975402","106.51.42.25","192.168.4.113","TCP","54","443  >  56177 [ACK] Seq=9842 Ack=26794 Win=1160 Len=0"
"210","10.975402","106.51.42.25","192.168.4.113","TCP","54","443  >  56177 [ACK] Seq=9842 Ack=28178 Win=1182 Len=0"
"211","10.975402","106.51.42.25","192.168.4.113","TCP","54","443  >  56177 [ACK] Seq=9842 Ack=30946 Win=1226 Len=0"
"212","10.975402","106.51.42.25","192.168.4.113","TCP","54","443  >  56177 [ACK] Seq=9842 Ack=32330 Win=1249 Len=0"
"213","10.975402","106.51.42.25","192.168.4.113","TCP","54","443  >  56177 [ACK] Seq=9842 Ack=33714 Win=1271 Len=0"
"214","10.975402","106.51.42.25","192.168.4.113","TCP","54","443  >  56177 [ACK] Seq=9842 Ack=36482 Win=1315 Len=0"
"215","10.975402","106.51.42.25","192.168.4.113","TCP","54","443  >  56177 [ACK] Seq=9842 Ack=37866 Win=1337 Len=0"
"216","10.975402","106.51.42.25","192.168.4.113","TCP","54","443  >  56177 [ACK] Seq=9842 Ack=39250 Win=1360 Len=0"
"217","10.975402","106.51.42.25","192.168.4.113","TCP","54","443  >  56177 [ACK] Seq=9842 Ack=40383 Win=1382 Len=0"
"218","10.975402","106.51.42.25","192.168.4.113","TCP","54","443  >  56177 [ACK] Seq=9842 Ack=41767 Win=1405 Len=0"
"219","10.975402","106.51.42.25","192.168.4.113","TCP","54","443  >  56177 [ACK] Seq=9842 Ack=43151 Win=1427 Len=0"
"220","10.975402","106.51.42.25","192.168.4.113","TCP","54","443  >  56177 [ACK] Seq=9842 Ack=44535 Win=1450 Len=0"
"221","10.975402","106.51.42.25","192.168.4.113","TCP","54","443  >  56177 [ACK] Seq=9842 Ack=45919 Win=1473 Len=0"
"222","10.975402","106.51.42.25","192.168.4.113","TCP","54","443  >  56177 [ACK] Seq=9842 Ack=48687 Win=1516 Len=0"
"223","10.975402","106.51.42.25","192.168.4.113","TCP","54","443  >  56177 [ACK] Seq=9842 Ack=50071 Win=1539 Len=0"
"224","10.975402","106.51.42.25","192.168.4.113","TCP","54","443  >  56177 [ACK] Seq=9842 Ack=51455 Win=1562 Len=0"
"225","10.975402","106.51.42.25","192.168.4.113","TCP","54","443  >  56177 [ACK] Seq=9842 Ack=52839 Win=1585 Len=0"
"226","10.975402","106.51.42.25","192.168.4.113","TCP","54","443  >  56177 [ACK] Seq=9842 Ack=54223 Win=1608 Len=0"
"227","10.975402","106.51.42.25","192.168.4.113","TCP","54","443  >  56177 [ACK] Seq=9842 Ack=55607 Win=1630 Len=0"
"228","10.975402","106.51.42.25","192.168.4.113","TCP","54","443  >  56177 [ACK] Seq=9842 Ack=56740 Win=1652 Len=0"
"229","10.975402","106.51.42.25","192.168.4.113","TCP","54","443  >  56177 [ACK] Seq=9842 Ack=58124 Win=1675 Len=0"
"230","10.975402","106.51.42.25","192.168.4.113","TCP","54","443  >  56177 [ACK] Seq=9842 Ack=59508 Win=1698 Len=0"
"231","10.975402","106.51.42.25","192.168.4.113","TCP","54","443  >  56177 [ACK] Seq=9842 Ack=60892 Win=1720 Len=0"
"232","10.975402","106.51.42.25","192.168.4.113","TCP","54","443  >  56177 [ACK] Seq=9842 Ack=62276 Win=1743 Len=0"
"233","10.975402","106.51.42.25","192.168.4.113","TCP","54","443  >  56177 [ACK] Seq=9842 Ack=63660 Win=1766 Len=0"
"234","10.975402","106.51.42.25","192.168.4.113","TCP","54","443  >  56177 [ACK] Seq=9842 Ack=65044 Win=1789 Len=0"
"235","10.975402","106.51.42.25","192.168.4.113","TCP","54","443  >  56177 [ACK] Seq=9842 Ack=66428 Win=1812 Len=0"
"236","10.975402","106.51.42.25","192.168.4.113","TCP","54","443  >  56177 [ACK] Seq=9842 Ack=67812 Win=1835 Len=0"
"237","10.975402","106.51.42.25","192.168.4.113","TCP","54","443  >  56177 [ACK] Seq=9842 Ack=69196 Win=1857 Len=0"
"238","10.975402","106.51.42.25","192.168.4.113","TCP","54","443  >  56177 [ACK] Seq=9842 Ack=70580 Win=1880 Len=0"
"239","10.975402","106.51.42.25","192.168.4.113","TCP","54","443  >  56177 [ACK] Seq=9842 Ack=71964 Win=1903 Len=0"
"240","10.975402","106.51.42.25","192.168.4.113","TCP","54","443  >  56177 [ACK] Seq=9842 Ack=73097 Win=1925 Len=0"
"241","10.975402","106.51.42.25","192.168.4.113","TCP","54","443  >  56177 [ACK] Seq=9842 Ack=73350 Win=1946 Len=0"
"242","10.991217","106.51.42.25","192.168.4.113","TCP","66","[TCP Dup ACK 241#1] 443  >  56177 [ACK] Seq=9842 Ack=73350 Win=1946 Len=0 SLE=71966 SRE=73350"
"243","11.023000","106.51.42.25","192.168.4.113","TLSv1.2","89","Application Data"
"244","11.023000","106.51.42.25","192.168.4.113","TLSv1.2","89","Application Data"
"245","11.023000","106.51.42.25","192.168.4.113","TCP","89","[TCP Retransmission] 443  >  56177 [PSH, ACK] Seq=9877 Ack=73350 Win=1946 Len=35"
"246","11.023081","192.168.4.113","106.51.42.25","TCP","66","56177  >  443 [ACK] Seq=73350 Ack=9912 Win=1023 Len=0 SLE=9877 SRE=9912"
"247","11.023214","192.168.4.113","106.51.42.25","TLSv1.2","16411","Application Data"
"248","11.023335","192.168.4.113","106.51.42.25","TLSv1.2","16411","Application Data"
"249","11.023390","192.168.4.113","106.51.42.25","TLSv1.2","1206","Application Data"
"250","11.023478","192.168.4.113","106.51.42.25","TLSv1.2","85","Application Data"
"251","11.034972","106.51.42.25","192.168.4.113","TCP","54","443  >  56177 [ACK] Seq=9912 Ack=74734 Win=1969 Len=0"
"252","11.034972","106.51.42.25","192.168.4.113","TCP","54","443  >  56177 [ACK] Seq=9912 Ack=76118 Win=1992 Len=0"
"253","11.034972","106.51.42.25","192.168.4.113","TCP","54","443  >  56177 [ACK] Seq=9912 Ack=77502 Win=2015 Len=0"
"254","11.034972","106.51.42.25","192.168.4.113","TCP","54","443  >  56177 [ACK] Seq=9912 Ack=78886 Win=2037 Len=0"
"255","11.034972","106.51.42.25","192.168.4.113","TCP","54","443  >  56177 [ACK] Seq=9912 Ack=80270 Win=2060 Len=0"
"256","11.034972","106.51.42.25","192.168.4.113","TCP","54","443  >  56177 [ACK] Seq=9912 Ack=81654 Win=2083 Len=0"
"257","11.034972","106.51.42.25","192.168.4.113","TCP","54","443  >  56177 [ACK] Seq=9912 Ack=83038 Win=2106 Len=0"
"258","11.034972","106.51.42.25","192.168.4.113","TCP","54","443  >  56177 [ACK] Seq=9912 Ack=84422 Win=2129 Len=0"
"259","11.034972","106.51.42.25","192.168.4.113","TCP","54","443  >  56177 [ACK] Seq=9912 Ack=85806 Win=2152 Len=0"
"260","11.034972","106.51.42.25","192.168.4.113","TCP","54","443  >  56177 [ACK] Seq=9912 Ack=87190 Win=2174 Len=0"
"261","11.034972","106.51.42.25","192.168.4.113","TCP","54","443  >  56177 [ACK] Seq=9912 Ack=88574 Win=2197 Len=0"
"262","11.034972","106.51.42.25","192.168.4.113","TCP","54","443  >  56177 [ACK] Seq=9912 Ack=89707 Win=2219 Len=0"
"263","11.034972","106.51.42.25","192.168.4.113","TCP","54","443  >  56177 [ACK] Seq=9912 Ack=91091 Win=2242 Len=0"
"264","11.034972","106.51.42.25","192.168.4.113","TCP","54","443  >  56177 [ACK] Seq=9912 Ack=92475 Win=2264 Len=0"
"265","11.034972","106.51.42.25","192.168.4.113","TCP","54","443  >  56177 [ACK] Seq=9912 Ack=93859 Win=2287 Len=0"
"266","11.034972","106.51.42.25","192.168.4.113","TCP","54","443  >  56177 [ACK] Seq=9912 Ack=95243 Win=2310 Len=0"
"267","11.034972","106.51.42.25","192.168.4.113","TCP","54","443  >  56177 [ACK] Seq=9912 Ack=96627 Win=2333 Len=0"
"268","11.034972","106.51.42.25","192.168.4.113","TCP","54","443  >  56177 [ACK] Seq=9912 Ack=98011 Win=2356 Len=0"
"269","11.034972","106.51.42.25","192.168.4.113","TCP","54","443  >  56177 [ACK] Seq=9912 Ack=99395 Win=2378 Len=0"
"270","11.034972","106.51.42.25","192.168.4.113","TCP","54","443  >  56177 [ACK] Seq=9912 Ack=100779 Win=2401 Len=0"
"271","11.034972","106.51.42.25","192.168.4.113","TCP","54","443  >  56177 [ACK] Seq=9912 Ack=102163 Win=2424 Len=0"
"272","11.034972","106.51.42.25","192.168.4.113","TCP","54","443  >  56177 [ACK] Seq=9912 Ack=103547 Win=2447 Len=0"
"273","11.034972","106.51.42.25","192.168.4.113","TCP","54","443  >  56177 [ACK] Seq=9912 Ack=104931 Win=2470 Len=0"
"274","11.034972","106.51.42.25","192.168.4.113","TCP","54","443  >  56177 [ACK] Seq=9912 Ack=106064 Win=2491 Len=0"
"275","11.034972","106.51.42.25","192.168.4.113","TCP","54","443  >  56177 [ACK] Seq=9912 Ack=107216 Win=2514 Len=0"
"276","11.034972","106.51.42.25","192.168.4.113","TCP","54","443  >  56177 [ACK] Seq=9912 Ack=107247 Win=2514 Len=0"
"277","11.042039","20.189.173.8","192.168.4.113","TCP","66","443  >  56186 [SYN, ACK] Seq=0 Ack=1 Win=65535 Len=0 MSS=1440 WS=256 SACK_PERM"
"278","11.042128","192.168.4.113","20.189.173.8","TCP","54","56186  >  443 [ACK] Seq=1 Ack=1 Win=262144 Len=0"
"279","11.043443","192.168.4.113","20.189.173.8","TLSv1.3","454","Client Hello (SNI=browser.pipe.aria.microsoft.com)"
"280","11.053662","106.51.42.25","192.168.4.113","TLSv1.2","89","Application Data"
"281","11.053737","192.168.4.113","106.51.42.25","TCP","54","56177  >  443 [ACK] Seq=107247 Ack=9947 Win=1023 Len=0"
"282","11.284428","106.51.42.25","192.168.4.113","TLSv1.2","394","Application Data"
"283","11.284428","106.51.42.25","192.168.4.113","TLSv1.2","85","Application Data"
"284","11.284428","106.51.42.25","192.168.4.113","TCP","85","[TCP Retransmission] 443  >  56177 [PSH, ACK] Seq=10287 Ack=107247 Win=2514 Len=31"
"285","11.284526","192.168.4.113","106.51.42.25","TCP","66","56177  >  443 [ACK] Seq=107247 Ack=10318 Win=1022 Len=0 SLE=10287 SRE=10318"
"286","11.284637","20.189.173.8","192.168.4.113","TLSv1.3","153","Hello Retry Request, Change Cipher Spec"
"287","11.284696","192.168.4.113","20.189.173.8","TCP","54","56186  >  443 [ACK] Seq=401 Ack=100 Win=261888 Len=0"
"288","11.296914","192.168.4.113","20.189.173.8","TLSv1.3","525","Change Cipher Spec, Client Hello (SNI=browser.pipe.aria.microsoft.com)"
"289","11.587486","20.189.173.8","192.168.4.113","TLSv1.3","1494","Server Hello"
"290","11.587486","20.189.173.8","192.168.4.113","TCP","1494","443  >  56186 [ACK] Seq=1540 Ack=872 Win=4193792 Len=1440 [TCP segment of a reassembled PDU]"
"291","11.587486","20.189.173.8","192.168.4.113","TCP","1494","443  >  56186 [ACK] Seq=2980 Ack=872 Win=4193792 Len=1440 [TCP segment of a reassembled PDU]"
"292","11.587486","20.189.173.8","192.168.4.113","TCP","1494","443  >  56186 [ACK] Seq=4420 Ack=872 Win=4193792 Len=1440 [TCP segment of a reassembled PDU]"
"293","11.587486","20.189.173.8","192.168.4.113","TLSv1.3","624","Application Data"
"294","11.587627","192.168.4.113","20.189.173.8","TCP","54","56186  >  443 [ACK] Seq=872 Ack=6430 Win=262144 Len=0"
"295","11.593754","192.168.4.113","20.189.173.8","TLSv1.3","128","Application Data"
"296","11.594098","192.168.4.113","20.189.173.8","TLSv1.3","134","Application Data"
"297","11.594174","192.168.4.113","20.189.173.8","TLSv1.3","496","Application Data"
"298","11.594305","192.168.4.113","20.189.173.8","TLSv1.3","1126","Application Data"
"299","11.594370","192.168.4.113","20.189.173.8","TLSv1.3","85","Application Data"
"300","11.894260","20.189.173.8","192.168.4.113","TLSv1.3","157","Application Data"
"301","11.894260","20.189.173.8","192.168.4.113","TLSv1.3","116","Application Data"
"302","11.894260","20.189.173.8","192.168.4.113","TLSv1.3","85","Application Data"
"303","11.894329","192.168.4.113","20.189.173.8","TCP","54","56186  >  443 [ACK] Seq=2571 Ack=6626 Win=261888 Len=0"
"304","11.894469","20.189.173.8","192.168.4.113","TCP","54","443  >  56186 [ACK] Seq=6626 Ack=2571 Win=4193536 Len=0"
"305","11.895608","192.168.4.113","20.189.173.8","TCP","54","56186  >  443 [FIN, ACK] Seq=2571 Ack=6626 Win=261888 Len=0"
"306","12.202161","20.189.173.8","192.168.4.113","TLSv1.3","336","Application Data"
"307","12.202161","20.189.173.8","192.168.4.113","TLSv1.3","89","Application Data"
"308","12.202161","20.189.173.8","192.168.4.113","TCP","54","443  >  56186 [FIN, ACK] Seq=6943 Ack=2572 Win=4193536 Len=0"
"309","12.202257","192.168.4.113","20.189.173.8","TCP","54","56186  >  443 [RST, ACK] Seq=2572 Ack=6908 Win=0 Len=0"
"310","12.601259","192.168.4.113","216.58.196.174","UDP","1286","64344  >  443 Len=1244"
"311","12.601433","192.168.4.113","216.58.196.174","UDP","704","64344  >  443 Len=662"
"312","12.613821","216.58.196.174","192.168.4.113","UDP","70","443  >  64344 Len=28"
"313","12.650027","192.168.4.113","216.58.196.174","UDP","75","64344  >  443 Len=33"
"314","12.703656","216.58.196.174","192.168.4.113","UDP","110","443  >  64344 Len=68"
"315","12.704694","216.58.196.174","192.168.4.113","UDP","63","443  >  64344 Len=21"
"316","12.704976","192.168.4.113","216.58.196.174","UDP","78","64344  >  443 Len=36"
"317","12.747604","216.58.196.174","192.168.4.113","UDP","67","443  >  64344 Len=25"
"318","13.431002","192.168.4.113","150.171.69.254","TLSv1.2","129","Application Data"
"319","13.441510","150.171.69.254","192.168.4.113","TCP","54","443  >  56179 [ACK] Seq=1 Ack=76 Win=16383 Len=0"
"320","13.443153","150.171.69.254","192.168.4.113","TLSv1.2","249","Application Data"
"321","13.443153","150.171.69.254","192.168.4.113","TLSv1.2","85","Application Data"
"322","13.443268","192.168.4.113","150.171.69.254","TCP","54","56179  >  443 [ACK] Seq=76 Ack=227 Win=1024 Len=0"
"323","13.449886","192.168.4.113","150.171.69.254","TLSv1.2","129","Application Data"
"324","13.458499","150.171.69.254","192.168.4.113","TCP","54","443  >  56179 [ACK] Seq=227 Ack=151 Win=16382 Len=0"
"325","13.460496","150.171.69.254","192.168.4.113","TLSv1.2","249","Application Data"
"326","13.460496","150.171.69.254","192.168.4.113","TLSv1.2","85","Application Data"
"327","13.460607","192.168.4.113","150.171.69.254","TCP","54","56179  >  443 [ACK] Seq=151 Ack=453 Win=1023 Len=0"
"328","13.471484","192.168.4.113","192.168.4.1","DNS","113","Standard query 0xcb4f A e2aea33c6c2c3463a731c1ea40b932ab.clo.footprintdns.com"
"329","13.482404","192.168.4.1","192.168.4.113","DNS","262","Standard query response 0xcb4f No such name A e2aea33c6c2c3463a731c1ea40b932ab.clo.footprintdns.com CNAME geo.trafficmanager.net CNAME bm1prdapp01-canary.cloudapp.net SOA ns1-201.azure-dns.com"
"330","13.494745","192.168.4.113","192.168.4.1","DNS","81","Standard query 0x73e3 A static-ecst.licdn.com"
"331","13.497229","192.168.4.1","192.168.4.113","DNS","136","Standard query response 0x73e3 A static-ecst.licdn.com CNAME cs1404.wpc.epsiloncdn.net A 152.199.43.62"
"332","13.498155","192.168.4.113","152.199.43.62","TCP","66","56187  >  443 [SYN] Seq=0 Win=65535 Len=0 MSS=1460 WS=256 SACK_PERM"
"333","13.506543","152.199.43.62","192.168.4.113","TCP","66","443  >  56187 [SYN, ACK] Seq=0 Ack=1 Win=65535 Len=0 MSS=1440 SACK_PERM WS=512"
"334","13.506695","192.168.4.113","152.199.43.62","TCP","54","56187  >  443 [ACK] Seq=1 Ack=1 Win=262144 Len=0"
"335","13.509452","192.168.4.113","152.199.43.62","TLSv1.3","349","Client Hello (SNI=static-ecst.licdn.com)"
"336","13.516852","152.199.43.62","192.168.4.113","TCP","54","443  >  56187 [ACK] Seq=1 Ack=296 Win=67072 Len=0"
"337","13.516852","152.199.43.62","192.168.4.113","TLSv1.3","153","Hello Retry Request, Change Cipher Spec"
"338","13.516980","192.168.4.113","152.199.43.62","TCP","54","56187  >  443 [ACK] Seq=296 Ack=100 Win=261888 Len=0"
"339","13.520809","192.168.4.113","152.199.43.62","TLSv1.3","388","Change Cipher Spec, Client Hello (SNI=static-ecst.licdn.com)"
"340","13.529153","152.199.43.62","192.168.4.113","TLSv1.3","1494","Server Hello, Application Data"
"341","13.529153","152.199.43.62","192.168.4.113","TCP","1494","443  >  56187 [ACK] Seq=1540 Ack=630 Win=68096 Len=1440 [TCP segment of a reassembled PDU]"
"342","13.529153","152.199.43.62","192.168.4.113","TCP","1270","443  >  56187 [PSH, ACK] Seq=2980 Ack=630 Win=68096 Len=1216 [TCP segment of a reassembled PDU]"
"343","13.529274","192.168.4.113","152.199.43.62","TCP","54","56187  >  443 [ACK] Seq=630 Ack=4196 Win=262144 Len=0"
"344","13.529485","152.199.43.62","192.168.4.113","TLSv1.3","972","Application Data, Application Data, Application Data"
"345","13.529540","192.168.4.113","152.199.43.62","TCP","54","56187  >  443 [ACK] Seq=630 Ack=5114 Win=261120 Len=0"
"346","13.542641","192.168.4.113","152.199.43.62","TLSv1.3","128","Application Data"
"347","13.550851","152.199.43.62","192.168.4.113","TLSv1.3","309","Application Data"
"348","13.550851","152.199.43.62","192.168.4.113","TLSv1.3","309","Application Data"
"349","13.550851","152.199.43.62","192.168.4.113","TLSv1.3","162","Application Data, Application Data"
"350","13.550931","192.168.4.113","152.199.43.62","TCP","54","56187  >  443 [ACK] Seq=704 Ack=5732 Win=262144 Len=0"
"351","13.567934","192.168.4.113","152.199.43.62","TLSv1.3","134","Application Data"
"352","13.569184","192.168.4.113","152.199.43.62","TLSv1.3","360","Application Data"
"353","13.570423","192.168.4.113","152.199.43.62","TLSv1.3","85","Application Data"
"354","13.575481","152.199.43.62","192.168.4.113","TLSv1.3","85","Application Data"
"355","13.575589","192.168.4.113","152.199.43.62","TCP","54","56187  >  443 [ACK] Seq=1121 Ack=5763 Win=261888 Len=0"
"356","13.577593","152.199.43.62","192.168.4.113","TCP","54","443  >  56187 [ACK] Seq=5763 Ack=1121 Win=69120 Len=0"
"357","13.578192","152.199.43.62","192.168.4.113","TLSv1.3","765","Application Data, Application Data, Application Data"
"358","13.578295","192.168.4.113","152.199.43.62","TCP","54","56187  >  443 [ACK] Seq=1121 Ack=6474 Win=261376 Len=0"
"359","13.586452","192.168.4.113","152.199.43.62","TLSv1.3","133","Application Data"
"360","13.595093","152.199.43.62","192.168.4.113","TLSv1.3","215","Application Data, Application Data, Application Data"
"361","13.595201","192.168.4.113","152.199.43.62","TCP","54","56187  >  443 [ACK] Seq=1200 Ack=6635 Win=261120 Len=0"
"362","13.601301","192.168.4.113","204.79.197.222","TLSv1.2","624","Application Data"
"363","13.609618","204.79.197.222","192.168.4.113","TCP","54","443  >  56178 [ACK] Seq=1 Ack=571 Win=16385 Len=0"
"364","13.611696","204.79.197.222","192.168.4.113","TLSv1.2","201","Application Data"
"365","13.611696","204.79.197.222","192.168.4.113","TLSv1.2","85","Application Data"
"366","13.611754","192.168.4.113","204.79.197.222","TCP","54","56178  >  443 [ACK] Seq=571 Ack=179 Win=1022 Len=0"
