"No.","Time","Source","Destination","Protocol","Length","Info"
"1","0.000000","127.0.0.1","127.0.0.1","TCP","45","49711  >  49712 [PSH, ACK] Seq=1 Ack=1 Win=8442 Len=1"
"2","0.000051","127.0.0.1","127.0.0.1","TCP","44","49712  >  49711 [ACK] Seq=1 Ack=2 Win=8198 Len=0"
"3","0.000497","127.0.0.1","127.0.0.1","TCP","45","49722  >  49721 [PSH, ACK] Seq=1 Ack=1 Win=8442 Len=1"
"4","0.000548","127.0.0.1","127.0.0.1","TCP","44","49721  >  49722 [ACK] Seq=1 Ack=2 Win=8198 Len=0"
"5","0.000942","127.0.0.1","127.0.0.1","TCP","45","49711  >  49712 [PSH, ACK] Seq=2 Ack=1 Win=8442 Len=1"
"6","0.000959","127.0.0.1","127.0.0.1","TCP","45","49722  >  49721 [PSH, ACK] Seq=2 Ack=1 Win=8442 Len=1"
"7","0.000960","127.0.0.1","127.0.0.1","TCP","44","49712  >  49711 [ACK] Seq=1 Ack=3 Win=8198 Len=0"
"8","0.000972","127.0.0.1","127.0.0.1","TCP","44","49721  >  49722 [ACK] Seq=1 Ack=3 Win=8198 Len=0"
"9","0.001076","127.0.0.1","127.0.0.1","TCP","45","49722  >  49721 [PSH, ACK] Seq=3 Ack=1 Win=8442 Len=1"
"10","0.001086","127.0.0.1","127.0.0.1","TCP","44","49721  >  49722 [ACK] Seq=1 Ack=4 Win=8198 Len=0"
"11","0.001245","127.0.0.1","127.0.0.1","TCP","45","49711  >  49712 [PSH, ACK] Seq=3 Ack=1 Win=8442 Len=1"
"12","0.001256","127.0.0.1","127.0.0.1","TCP","44","49712  >  49711 [ACK] Seq=1 Ack=4 Win=8198 Len=0"
"13","0.001483","127.0.0.1","127.0.0.1","TCP","45","49722  >  49721 [PSH, ACK] Seq=4 Ack=1 Win=8442 Len=1"
"14","0.001529","127.0.0.1","127.0.0.1","TCP","44","49721  >  49722 [ACK] Seq=1 Ack=5 Win=8198 Len=0"
"15","0.001911","127.0.0.1","127.0.0.1","TCP","45","49711  >  49712 [PSH, ACK] Seq=4 Ack=1 Win=8442 Len=1"
"16","0.001921","127.0.0.1","127.0.0.1","TCP","44","49712  >  49711 [ACK] Seq=1 Ack=5 Win=8198 Len=0"
"17","0.001993","127.0.0.1","127.0.0.1","TCP","45","49722  >  49721 [PSH, ACK] Seq=5 Ack=1 Win=8442 Len=1"
"18","0.002000","127.0.0.1","127.0.0.1","TCP","44","49721  >  49722 [ACK] Seq=1 Ack=6 Win=8198 Len=0"
"19","0.002078","127.0.0.1","127.0.0.1","TCP","45","49711  >  49712 [PSH, ACK] Seq=5 Ack=1 Win=8442 Len=1"
"20","0.002084","127.0.0.1","127.0.0.1","TCP","44","49712  >  49711 [ACK] Seq=1 Ack=6 Win=8198 Len=0"
"21","0.002262","127.0.0.1","127.0.0.1","TCP","45","49722  >  49721 [PSH, ACK] Seq=6 Ack=1 Win=8442 Len=1"
"22","0.002280","127.0.0.1","127.0.0.1","TCP","44","49721  >  49722 [ACK] Seq=1 Ack=7 Win=8198 Len=0"
"23","0.002530","127.0.0.1","127.0.0.1","TCP","45","49711  >  49712 [PSH, ACK] Seq=6 Ack=1 Win=8442 Len=1"
"24","0.002540","127.0.0.1","127.0.0.1","TCP","44","49712  >  49711 [ACK] Seq=1 Ack=7 Win=8198 Len=0"
"25","0.002703","127.0.0.1","127.0.0.1","TCP","45","49722  >  49721 [PSH, ACK] Seq=7 Ack=1 Win=8442 Len=1"
"26","0.002758","127.0.0.1","127.0.0.1","TCP","44","49721  >  49722 [ACK] Seq=1 Ack=8 Win=8198 Len=0"
"27","0.003141","127.0.0.1","127.0.0.1","TCP","45","49711  >  49712 [PSH, ACK] Seq=7 Ack=1 Win=8442 Len=1"
"28","0.003151","127.0.0.1","127.0.0.1","TCP","44","49712  >  49711 [ACK] Seq=1 Ack=8 Win=8198 Len=0"
"29","0.003313","127.0.0.1","127.0.0.1","TCP","45","49722  >  49721 [PSH, ACK] Seq=8 Ack=1 Win=8442 Len=1"
"30","0.003351","127.0.0.1","127.0.0.1","TCP","44","49721  >  49722 [ACK] Seq=1 Ack=9 Win=8198 Len=0"
"31","0.003568","127.0.0.1","127.0.0.1","TCP","45","49711  >  49712 [PSH, ACK] Seq=8 Ack=1 Win=8442 Len=1"
"32","0.003578","127.0.0.1","127.0.0.1","TCP","44","49712  >  49711 [ACK] Seq=1 Ack=9 Win=8198 Len=0"
"33","0.003755","127.0.0.1","127.0.0.1","TCP","45","49722  >  49721 [PSH, ACK] Seq=9 Ack=1 Win=8442 Len=1"
"34","0.003765","127.0.0.1","127.0.0.1","TCP","44","49721  >  49722 [ACK] Seq=1 Ack=10 Win=8198 Len=0"
"35","0.003998","127.0.0.1","127.0.0.1","TCP","45","49711  >  49712 [PSH, ACK] Seq=9 Ack=1 Win=8442 Len=1"
"36","0.004010","127.0.0.1","127.0.0.1","TCP","44","49712  >  49711 [ACK] Seq=1 Ack=10 Win=8198 Len=0"
"37","0.004198","127.0.0.1","127.0.0.1","TCP","45","49722  >  49721 [PSH, ACK] Seq=10 Ack=1 Win=8442 Len=1"
"38","0.004237","127.0.0.1","127.0.0.1","TCP","44","49721  >  49722 [ACK] Seq=1 Ack=11 Win=8198 Len=0"
"39","0.004592","127.0.0.1","127.0.0.1","TCP","45","49711  >  49712 [PSH, ACK] Seq=10 Ack=1 Win=8442 Len=1"
"40","0.004603","127.0.0.1","127.0.0.1","TCP","44","49712  >  49711 [ACK] Seq=1 Ack=11 Win=8198 Len=0"
"41","0.004773","127.0.0.1","127.0.0.1","TCP","45","49722  >  49721 [PSH, ACK] Seq=11 Ack=1 Win=8442 Len=1"
"42","0.004785","127.0.0.1","127.0.0.1","TCP","44","49721  >  49722 [ACK] Seq=1 Ack=12 Win=8198 Len=0"
"43","0.005028","127.0.0.1","127.0.0.1","TCP","45","49711  >  49712 [PSH, ACK] Seq=11 Ack=1 Win=8442 Len=1"
"44","0.005039","127.0.0.1","127.0.0.1","TCP","44","49712  >  49711 [ACK] Seq=1 Ack=12 Win=8198 Len=0"
"45","0.005234","127.0.0.1","127.0.0.1","TCP","45","49722  >  49721 [PSH, ACK] Seq=12 Ack=1 Win=8442 Len=1"
"46","0.005265","127.0.0.1","127.0.0.1","TCP","44","49721  >  49722 [ACK] Seq=1 Ack=13 Win=8198 Len=0"
"47","0.005349","127.0.0.1","127.0.0.1","TCP","45","49711  >  49712 [PSH, ACK] Seq=12 Ack=1 Win=8442 Len=1"
"48","0.005356","127.0.0.1","127.0.0.1","TCP","44","49712  >  49711 [ACK] Seq=1 Ack=13 Win=8198 Len=0"
"49","0.005547","127.0.0.1","127.0.0.1","TCP","45","49722  >  49721 [PSH, ACK] Seq=13 Ack=1 Win=8442 Len=1"
"50","0.005556","127.0.0.1","127.0.0.1","TCP","44","49721  >  49722 [ACK] Seq=1 Ack=14 Win=8198 Len=0"
"51","0.005606","127.0.0.1","127.0.0.1","TCP","45","49711  >  49712 [PSH, ACK] Seq=13 Ack=1 Win=8442 Len=1"
"52","0.005612","127.0.0.1","127.0.0.1","TCP","44","49712  >  49711 [ACK] Seq=1 Ack=14 Win=8198 Len=0"
"53","0.005830","127.0.0.1","127.0.0.1","TCP","45","49722  >  49721 [PSH, ACK] Seq=14 Ack=1 Win=8442 Len=1"
"54","0.005853","127.0.0.1","127.0.0.1","TCP","44","49721  >  49722 [ACK] Seq=1 Ack=15 Win=8198 Len=0"
"55","0.005934","127.0.0.1","127.0.0.1","TCP","45","49711  >  49712 [PSH, ACK] Seq=14 Ack=1 Win=8442 Len=1"
"56","0.005941","127.0.0.1","127.0.0.1","TCP","44","49712  >  49711 [ACK] Seq=1 Ack=15 Win=8198 Len=0"
"57","0.006153","127.0.0.1","127.0.0.1","TCP","45","49722  >  49721 [PSH, ACK] Seq=15 Ack=1 Win=8442 Len=1"
"58","0.006161","127.0.0.1","127.0.0.1","TCP","44","49721  >  49722 [ACK] Seq=1 Ack=16 Win=8198 Len=0"
"59","0.006212","127.0.0.1","127.0.0.1","TCP","45","49711  >  49712 [PSH, ACK] Seq=15 Ack=1 Win=8442 Len=1"
"60","0.006218","127.0.0.1","127.0.0.1","TCP","44","49712  >  49711 [ACK] Seq=1 Ack=16 Win=8198 Len=0"
"61","0.006408","127.0.0.1","127.0.0.1","TCP","45","49722  >  49721 [PSH, ACK] Seq=16 Ack=1 Win=8442 Len=1"
"62","0.006416","127.0.0.1","127.0.0.1","TCP","44","49721  >  49722 [ACK] Seq=1 Ack=17 Win=8198 Len=0"
"63","0.006491","127.0.0.1","127.0.0.1","TCP","45","49711  >  49712 [PSH, ACK] Seq=16 Ack=1 Win=8442 Len=1"
"64","0.006497","127.0.0.1","127.0.0.1","TCP","44","49712  >  49711 [ACK] Seq=1 Ack=17 Win=8198 Len=0"
"65","0.006691","127.0.0.1","127.0.0.1","TCP","45","49722  >  49721 [PSH, ACK] Seq=17 Ack=1 Win=8442 Len=1"
"66","0.006699","127.0.0.1","127.0.0.1","TCP","44","49721  >  49722 [ACK] Seq=1 Ack=18 Win=8198 Len=0"
"67","0.006751","127.0.0.1","127.0.0.1","TCP","45","49711  >  49712 [PSH, ACK] Seq=17 Ack=1 Win=8442 Len=1"
"68","0.006758","127.0.0.1","127.0.0.1","TCP","44","49712  >  49711 [ACK] Seq=1 Ack=18 Win=8198 Len=0"
"69","0.006916","127.0.0.1","127.0.0.1","TCP","45","49722  >  49721 [PSH, ACK] Seq=18 Ack=1 Win=8442 Len=1"
"70","0.006924","127.0.0.1","127.0.0.1","TCP","44","49721  >  49722 [ACK] Seq=1 Ack=19 Win=8198 Len=0"
"71","0.006987","127.0.0.1","127.0.0.1","TCP","45","49711  >  49712 [PSH, ACK] Seq=18 Ack=1 Win=8442 Len=1"
"72","0.006994","127.0.0.1","127.0.0.1","TCP","44","49712  >  49711 [ACK] Seq=1 Ack=19 Win=8198 Len=0"
"73","0.007214","127.0.0.1","127.0.0.1","TCP","45","49722  >  49721 [PSH, ACK] Seq=19 Ack=1 Win=8442 Len=1"
"74","0.007228","127.0.0.1","127.0.0.1","TCP","44","49721  >  49722 [ACK] Seq=1 Ack=20 Win=8198 Len=0"
"75","0.007451","127.0.0.1","127.0.0.1","TCP","45","49711  >  49712 [PSH, ACK] Seq=19 Ack=1 Win=8442 Len=1"
"76","0.007461","127.0.0.1","127.0.0.1","TCP","44","49712  >  49711 [ACK] Seq=1 Ack=20 Win=8198 Len=0"
"77","0.007708","127.0.0.1","127.0.0.1","TCP","45","49722  >  49721 [PSH, ACK] Seq=20 Ack=1 Win=8442 Len=1"
"78","0.007747","127.0.0.1","127.0.0.1","TCP","44","49721  >  49722 [ACK] Seq=1 Ack=21 Win=8198 Len=0"
"79","0.009427","127.0.0.1","127.0.0.1","TCP","45","49711  >  49712 [PSH, ACK] Seq=20 Ack=1 Win=8442 Len=1"
"80","0.009439","127.0.0.1","127.0.0.1","TCP","44","49712  >  49711 [ACK] Seq=1 Ack=21 Win=8198 Len=0"
"81","0.009601","127.0.0.1","127.0.0.1","TCP","45","49722  >  49721 [PSH, ACK] Seq=21 Ack=1 Win=8442 Len=1"
"82","0.009631","127.0.0.1","127.0.0.1","TCP","44","49721  >  49722 [ACK] Seq=1 Ack=22 Win=8198 Len=0"
"83","0.026876","127.0.0.1","127.0.0.1","TCP","45","49711  >  49712 [PSH, ACK] Seq=21 Ack=1 Win=8442 Len=1"
"84","0.026896","127.0.0.1","127.0.0.1","TCP","44","49712  >  49711 [ACK] Seq=1 Ack=22 Win=8198 Len=0"
"85","0.349863","127.0.0.1","127.0.0.1","TCP","45","49722  >  49721 [PSH, ACK] Seq=22 Ack=1 Win=8442 Len=1"
"86","0.349927","127.0.0.1","127.0.0.1","TCP","44","49721  >  49722 [ACK] Seq=1 Ack=23 Win=8198 Len=0"
"87","0.350271","127.0.0.1","127.0.0.1","TCP","45","49711  >  49712 [PSH, ACK] Seq=22 Ack=1 Win=8442 Len=1"
"88","0.350307","127.0.0.1","127.0.0.1","TCP","44","49712  >  49711 [ACK] Seq=1 Ack=23 Win=8198 Len=0"
"89","0.350579","127.0.0.1","127.0.0.1","TCP","45","49711  >  49712 [PSH, ACK] Seq=23 Ack=1 Win=8442 Len=1"
"90","0.350596","127.0.0.1","127.0.0.1","TCP","44","49712  >  49711 [ACK] Seq=1 Ack=24 Win=8198 Len=0"
"91","0.350896","127.0.0.1","127.0.0.1","TCP","45","49722  >  49721 [PSH, ACK] Seq=23 Ack=1 Win=8442 Len=1"
"92","0.350922","127.0.0.1","127.0.0.1","TCP","44","49721  >  49722 [ACK] Seq=1 Ack=24 Win=8198 Len=0"
"93","0.351107","127.0.0.1","127.0.0.1","TCP","45","49722  >  49721 [PSH, ACK] Seq=24 Ack=1 Win=8442 Len=1"
"94","0.351128","127.0.0.1","127.0.0.1","TCP","44","49721  >  49722 [ACK] Seq=1 Ack=25 Win=8198 Len=0"
"95","0.351454","127.0.0.1","127.0.0.1","TCP","45","49711  >  49712 [PSH, ACK] Seq=24 Ack=1 Win=8442 Len=1"
"96","0.351477","127.0.0.1","127.0.0.1","TCP","44","49712  >  49711 [ACK] Seq=1 Ack=25 Win=8198 Len=0"
"97","0.351852","127.0.0.1","127.0.0.1","TCP","45","49722  >  49721 [PSH, ACK] Seq=25 Ack=1 Win=8442 Len=1"
"98","0.351891","127.0.0.1","127.0.0.1","TCP","44","49721  >  49722 [ACK] Seq=1 Ack=26 Win=8198 Len=0"
"99","0.352368","127.0.0.1","127.0.0.1","TCP","45","49711  >  49712 [PSH, ACK] Seq=25 Ack=1 Win=8442 Len=1"
"100","0.352400","127.0.0.1","127.0.0.1","TCP","44","49712  >  49711 [ACK] Seq=1 Ack=26 Win=8198 Len=0"
"101","0.353423","127.0.0.1","127.0.0.1","TCP","45","49722  >  49721 [PSH, ACK] Seq=26 Ack=1 Win=8442 Len=1"
"102","0.353464","127.0.0.1","127.0.0.1","TCP","44","49721  >  49722 [ACK] Seq=1 Ack=27 Win=8198 Len=0"
"103","0.354493","127.0.0.1","127.0.0.1","TCP","45","49711  >  49712 [PSH, ACK] Seq=26 Ack=1 Win=8442 Len=1"
"104","0.354533","127.0.0.1","127.0.0.1","TCP","44","49712  >  49711 [ACK] Seq=1 Ack=27 Win=8198 Len=0"
"105","0.354983","127.0.0.1","127.0.0.1","TCP","45","49722  >  49721 [PSH, ACK] Seq=27 Ack=1 Win=8442 Len=1"
"106","0.355017","127.0.0.1","127.0.0.1","TCP","44","49721  >  49722 [ACK] Seq=1 Ack=28 Win=8198 Len=0"
"107","0.355647","127.0.0.1","127.0.0.1","TCP","45","49711  >  49712 [PSH, ACK] Seq=27 Ack=1 Win=8442 Len=1"
"108","0.355690","127.0.0.1","127.0.0.1","TCP","44","49712  >  49711 [ACK] Seq=1 Ack=28 Win=8198 Len=0"
"109","1.353142","127.0.0.1","127.0.0.1","TCP","45","49711  >  49712 [PSH, ACK] Seq=28 Ack=1 Win=8442 Len=1"
"110","1.353167","127.0.0.1","127.0.0.1","TCP","44","49712  >  49711 [ACK] Seq=1 Ack=29 Win=8197 Len=0"
"111","1.353428","127.0.0.1","127.0.0.1","TCP","45","49722  >  49721 [PSH, ACK] Seq=28 Ack=1 Win=8442 Len=1"
"112","1.353468","127.0.0.1","127.0.0.1","TCP","44","49721  >  49722 [ACK] Seq=1 Ack=29 Win=8198 Len=0"
"113","1.368676","127.0.0.1","127.0.0.1","TCP","45","49722  >  49721 [PSH, ACK] Seq=29 Ack=1 Win=8442 Len=1"
"114","1.368711","127.0.0.1","127.0.0.1","TCP","44","49721  >  49722 [ACK] Seq=1 Ack=30 Win=8198 Len=0"
"115","1.368917","127.0.0.1","127.0.0.1","TCP","45","49711  >  49712 [PSH, ACK] Seq=29 Ack=1 Win=8442 Len=1"
"116","1.368928","127.0.0.1","127.0.0.1","TCP","44","49712  >  49711 [ACK] Seq=1 Ack=30 Win=8197 Len=0"
"117","1.369157","127.0.0.1","127.0.0.1","TCP","45","49722  >  49721 [PSH, ACK] Seq=30 Ack=1 Win=8442 Len=1"
"118","1.369192","127.0.0.1","127.0.0.1","TCP","44","49721  >  49722 [ACK] Seq=1 Ack=31 Win=8198 Len=0"
"119","1.369350","127.0.0.1","127.0.0.1","TCP","45","49711  >  49712 [PSH, ACK] Seq=30 Ack=1 Win=8442 Len=1"
"120","1.369359","127.0.0.1","127.0.0.1","TCP","44","49712  >  49711 [ACK] Seq=1 Ack=31 Win=8197 Len=0"
"121","1.369549","127.0.0.1","127.0.0.1","TCP","45","49722  >  49721 [PSH, ACK] Seq=31 Ack=1 Win=8442 Len=1"
"122","1.369560","127.0.0.1","127.0.0.1","TCP","44","49721  >  49722 [ACK] Seq=1 Ack=32 Win=8198 Len=0"
"123","1.369656","127.0.0.1","127.0.0.1","TCP","45","49711  >  49712 [PSH, ACK] Seq=31 Ack=1 Win=8442 Len=1"
"124","1.369664","127.0.0.1","127.0.0.1","TCP","44","49712  >  49711 [ACK] Seq=1 Ack=32 Win=8197 Len=0"
"125","1.369873","127.0.0.1","127.0.0.1","TCP","45","49722  >  49721 [PSH, ACK] Seq=32 Ack=1 Win=8442 Len=1"
"126","1.369900","127.0.0.1","127.0.0.1","TCP","44","49721  >  49722 [ACK] Seq=1 Ack=33 Win=8198 Len=0"
"127","1.370018","127.0.0.1","127.0.0.1","TCP","45","49711  >  49712 [PSH, ACK] Seq=32 Ack=1 Win=8442 Len=1"
"128","1.370026","127.0.0.1","127.0.0.1","TCP","44","49712  >  49711 [ACK] Seq=1 Ack=33 Win=8197 Len=0"
"129","1.370238","127.0.0.1","127.0.0.1","TCP","45","49722  >  49721 [PSH, ACK] Seq=33 Ack=1 Win=8442 Len=1"
"130","1.370250","127.0.0.1","127.0.0.1","TCP","44","49721  >  49722 [ACK] Seq=1 Ack=34 Win=8198 Len=0"
"131","1.370461","127.0.0.1","127.0.0.1","TCP","45","49711  >  49712 [PSH, ACK] Seq=33 Ack=1 Win=8442 Len=1"
"132","1.370471","127.0.0.1","127.0.0.1","TCP","44","49712  >  49711 [ACK] Seq=1 Ack=34 Win=8197 Len=0"
"133","2.354293","127.0.0.1","127.0.0.1","TCP","45","49711  >  49712 [PSH, ACK] Seq=34 Ack=1 Win=8442 Len=1"
"134","2.354351","127.0.0.1","127.0.0.1","TCP","44","49712  >  49711 [ACK] Seq=1 Ack=35 Win=8197 Len=0"
"135","2.355827","127.0.0.1","127.0.0.1","TCP","45","49722  >  49721 [PSH, ACK] Seq=34 Ack=1 Win=8442 Len=1"
"136","2.355861","127.0.0.1","127.0.0.1","TCP","44","49721  >  49722 [ACK] Seq=1 Ack=35 Win=8198 Len=0"
"137","2.370222","127.0.0.1","127.0.0.1","TCP","45","49722  >  49721 [PSH, ACK] Seq=35 Ack=1 Win=8442 Len=1"
"138","2.370275","127.0.0.1","127.0.0.1","TCP","44","49721  >  49722 [ACK] Seq=1 Ack=36 Win=8198 Len=0"
"139","2.371101","127.0.0.1","127.0.0.1","TCP","45","49711  >  49712 [PSH, ACK] Seq=35 Ack=1 Win=8442 Len=1"
"140","2.371133","127.0.0.1","127.0.0.1","TCP","44","49712  >  49711 [ACK] Seq=1 Ack=36 Win=8197 Len=0"
"141","2.371747","127.0.0.1","127.0.0.1","TCP","45","49722  >  49721 [PSH, ACK] Seq=36 Ack=1 Win=8442 Len=1"
"142","2.371773","127.0.0.1","127.0.0.1","TCP","44","49721  >  49722 [ACK] Seq=1 Ack=37 Win=8198 Len=0"
"143","2.372362","127.0.0.1","127.0.0.1","TCP","45","49711  >  49712 [PSH, ACK] Seq=36 Ack=1 Win=8442 Len=1"
"144","2.372388","127.0.0.1","127.0.0.1","TCP","44","49712  >  49711 [ACK] Seq=1 Ack=37 Win=8197 Len=0"
"145","2.372910","127.0.0.1","127.0.0.1","TCP","45","49722  >  49721 [PSH, ACK] Seq=37 Ack=1 Win=8442 Len=1"
"146","2.372935","127.0.0.1","127.0.0.1","TCP","44","49721  >  49722 [ACK] Seq=1 Ack=38 Win=8198 Len=0"
"147","2.374133","127.0.0.1","127.0.0.1","TCP","45","49711  >  49712 [PSH, ACK] Seq=37 Ack=1 Win=8442 Len=1"
"148","2.374157","127.0.0.1","127.0.0.1","TCP","44","49712  >  49711 [ACK] Seq=1 Ack=38 Win=8197 Len=0"
"149","2.374674","127.0.0.1","127.0.0.1","TCP","45","49722  >  49721 [PSH, ACK] Seq=38 Ack=1 Win=8442 Len=1"
"150","2.374699","127.0.0.1","127.0.0.1","TCP","44","49721  >  49722 [ACK] Seq=1 Ack=39 Win=8198 Len=0"
"151","2.375641","127.0.0.1","127.0.0.1","TCP","45","49711  >  49712 [PSH, ACK] Seq=38 Ack=1 Win=8442 Len=1"
"152","2.375665","127.0.0.1","127.0.0.1","TCP","44","49712  >  49711 [ACK] Seq=1 Ack=39 Win=8197 Len=0"
"153","2.376155","127.0.0.1","127.0.0.1","TCP","45","49722  >  49721 [PSH, ACK] Seq=39 Ack=1 Win=8442 Len=1"
"154","2.376180","127.0.0.1","127.0.0.1","TCP","44","49721  >  49722 [ACK] Seq=1 Ack=40 Win=8198 Len=0"
"155","2.376815","127.0.0.1","127.0.0.1","TCP","45","49711  >  49712 [PSH, ACK] Seq=39 Ack=1 Win=8442 Len=1"
"156","2.376837","127.0.0.1","127.0.0.1","TCP","44","49712  >  49711 [ACK] Seq=1 Ack=40 Win=8197 Len=0"
"157","2.377413","127.0.0.1","127.0.0.1","TCP","45","49722  >  49721 [PSH, ACK] Seq=40 Ack=1 Win=8442 Len=1"
"158","2.377440","127.0.0.1","127.0.0.1","TCP","44","49721  >  49722 [ACK] Seq=1 Ack=41 Win=8198 Len=0"
"159","2.377909","127.0.0.1","127.0.0.1","TCP","45","49711  >  49712 [PSH, ACK] Seq=40 Ack=1 Win=8442 Len=1"
"160","2.377930","127.0.0.1","127.0.0.1","TCP","44","49712  >  49711 [ACK] Seq=1 Ack=41 Win=8197 Len=0"
"161","2.378363","127.0.0.1","127.0.0.1","TCP","45","49722  >  49721 [PSH, ACK] Seq=41 Ack=1 Win=8442 Len=1"
"162","2.378388","127.0.0.1","127.0.0.1","TCP","44","49721  >  49722 [ACK] Seq=1 Ack=42 Win=8198 Len=0"
"163","2.378843","127.0.0.1","127.0.0.1","TCP","45","49711  >  49712 [PSH, ACK] Seq=41 Ack=1 Win=8442 Len=1"
"164","2.378864","127.0.0.1","127.0.0.1","TCP","44","49712  >  49711 [ACK] Seq=1 Ack=42 Win=8197 Len=0"
"165","2.379294","127.0.0.1","127.0.0.1","TCP","45","49722  >  49721 [PSH, ACK] Seq=42 Ack=1 Win=8442 Len=1"
"166","2.379319","127.0.0.1","127.0.0.1","TCP","44","49721  >  49722 [ACK] Seq=1 Ack=43 Win=8198 Len=0"
"167","2.379734","127.0.0.1","127.0.0.1","TCP","45","49711  >  49712 [PSH, ACK] Seq=42 Ack=1 Win=8442 Len=1"
"168","2.379753","127.0.0.1","127.0.0.1","TCP","44","49712  >  49711 [ACK] Seq=1 Ack=43 Win=8197 Len=0"
"169","2.380200","127.0.0.1","127.0.0.1","TCP","45","49722  >  49721 [PSH, ACK] Seq=43 Ack=1 Win=8442 Len=1"
"170","2.380224","127.0.0.1","127.0.0.1","TCP","44","49721  >  49722 [ACK] Seq=1 Ack=44 Win=8198 Len=0"
"171","2.381357","127.0.0.1","127.0.0.1","TCP","45","49711  >  49712 [PSH, ACK] Seq=43 Ack=1 Win=8442 Len=1"
"172","2.381378","127.0.0.1","127.0.0.1","TCP","44","49712  >  49711 [ACK] Seq=1 Ack=44 Win=8197 Len=0"
"173","2.381838","127.0.0.1","127.0.0.1","TCP","45","49722  >  49721 [PSH, ACK] Seq=44 Ack=1 Win=8442 Len=1"
"174","2.381864","127.0.0.1","127.0.0.1","TCP","44","49721  >  49722 [ACK] Seq=1 Ack=45 Win=8198 Len=0"
"175","2.382731","127.0.0.1","127.0.0.1","TCP","45","49711  >  49712 [PSH, ACK] Seq=44 Ack=1 Win=8442 Len=1"
"176","2.382753","127.0.0.1","127.0.0.1","TCP","44","49712  >  49711 [ACK] Seq=1 Ack=45 Win=8197 Len=0"
"177","3.357151","127.0.0.1","127.0.0.1","TCP","45","49711  >  49712 [PSH, ACK] Seq=45 Ack=1 Win=8442 Len=1"
"178","3.357182","127.0.0.1","127.0.0.1","TCP","44","49712  >  49711 [ACK] Seq=1 Ack=46 Win=8197 Len=0"
"179","3.357410","127.0.0.1","127.0.0.1","TCP","45","49722  >  49721 [PSH, ACK] Seq=45 Ack=1 Win=8442 Len=1"
"180","3.357453","127.0.0.1","127.0.0.1","TCP","44","49721  >  49722 [ACK] Seq=1 Ack=46 Win=8198 Len=0"
"181","3.357515","127.0.0.1","127.0.0.1","TCP","45","49722  >  49721 [PSH, ACK] Seq=46 Ack=1 Win=8442 Len=1"
"182","3.357555","127.0.0.1","127.0.0.1","TCP","44","49721  >  49722 [ACK] Seq=1 Ack=47 Win=8198 Len=0"
"183","3.357850","127.0.0.1","127.0.0.1","TCP","45","49711  >  49712 [PSH, ACK] Seq=46 Ack=1 Win=8442 Len=1"
"184","3.357866","127.0.0.1","127.0.0.1","TCP","44","49712  >  49711 [ACK] Seq=1 Ack=47 Win=8197 Len=0"
"185","3.357944","127.0.0.1","127.0.0.1","TCP","45","49722  >  49721 [PSH, ACK] Seq=47 Ack=1 Win=8442 Len=1"
"186","3.357954","127.0.0.1","127.0.0.1","TCP","44","49721  >  49722 [ACK] Seq=1 Ack=48 Win=8198 Len=0"
"187","3.358175","127.0.0.1","127.0.0.1","TCP","45","49711  >  49712 [PSH, ACK] Seq=47 Ack=1 Win=8442 Len=1"
"188","3.358189","127.0.0.1","127.0.0.1","TCP","44","49712  >  49711 [ACK] Seq=1 Ack=48 Win=8197 Len=0"
"189","3.358257","127.0.0.1","127.0.0.1","TCP","45","49722  >  49721 [PSH, ACK] Seq=48 Ack=1 Win=8442 Len=1"
"190","3.358277","127.0.0.1","127.0.0.1","TCP","44","49721  >  49722 [ACK] Seq=1 Ack=49 Win=8198 Len=0"
"191","3.358375","127.0.0.1","127.0.0.1","TCP","45","49711  >  49712 [PSH, ACK] Seq=48 Ack=1 Win=8442 Len=1"
"192","3.358382","127.0.0.1","127.0.0.1","TCP","44","49712  >  49711 [ACK] Seq=1 Ack=49 Win=8197 Len=0"
"193","3.358552","127.0.0.1","127.0.0.1","TCP","45","49722  >  49721 [PSH, ACK] Seq=49 Ack=1 Win=8442 Len=1"
"194","3.358567","127.0.0.1","127.0.0.1","TCP","44","49721  >  49722 [ACK] Seq=1 Ack=50 Win=8198 Len=0"
"195","3.358663","127.0.0.1","127.0.0.1","TCP","45","49711  >  49712 [PSH, ACK] Seq=49 Ack=1 Win=8442 Len=1"
"196","3.358671","127.0.0.1","127.0.0.1","TCP","44","49712  >  49711 [ACK] Seq=1 Ack=50 Win=8197 Len=0"
"197","3.358874","127.0.0.1","127.0.0.1","TCP","45","49722  >  49721 [PSH, ACK] Seq=50 Ack=1 Win=8442 Len=1"
"198","3.358914","127.0.0.1","127.0.0.1","TCP","44","49721  >  49722 [ACK] Seq=1 Ack=51 Win=8198 Len=0"
"199","3.359444","127.0.0.1","127.0.0.1","TCP","45","49711  >  49712 [PSH, ACK] Seq=50 Ack=1 Win=8442 Len=1"
"200","3.359460","127.0.0.1","127.0.0.1","TCP","44","49712  >  49711 [ACK] Seq=1 Ack=51 Win=8197 Len=0"
"201","4.258673","127.0.0.1","127.0.0.1","TCP","45","49711  >  49712 [PSH, ACK] Seq=51 Ack=1 Win=8442 Len=1"
"202","4.258717","127.0.0.1","127.0.0.1","TCP","44","49712  >  49711 [ACK] Seq=1 Ack=52 Win=8197 Len=0"
"203","4.262022","127.0.0.1","127.0.0.1","TCP","45","49722  >  49721 [PSH, ACK] Seq=51 Ack=1 Win=8442 Len=1"
"204","4.262059","127.0.0.1","127.0.0.1","TCP","44","49721  >  49722 [ACK] Seq=1 Ack=52 Win=8198 Len=0"
"205","4.262834","127.0.0.1","127.0.0.1","TCP","45","49722  >  49721 [PSH, ACK] Seq=52 Ack=1 Win=8442 Len=1"
"206","4.262873","127.0.0.1","127.0.0.1","TCP","44","49721  >  49722 [ACK] Seq=1 Ack=53 Win=8198 Len=0"
"207","4.263069","127.0.0.1","127.0.0.1","TCP","45","49711  >  49712 [PSH, ACK] Seq=52 Ack=1 Win=8442 Len=1"
"208","4.263081","127.0.0.1","127.0.0.1","TCP","44","49712  >  49711 [ACK] Seq=1 Ack=53 Win=8197 Len=0"
"209","4.263277","127.0.0.1","127.0.0.1","TCP","45","49722  >  49721 [PSH, ACK] Seq=53 Ack=1 Win=8442 Len=1"
"210","4.263289","127.0.0.1","127.0.0.1","TCP","44","49721  >  49722 [ACK] Seq=1 Ack=54 Win=8198 Len=0"
"211","4.263419","127.0.0.1","127.0.0.1","TCP","45","49711  >  49712 [PSH, ACK] Seq=53 Ack=1 Win=8442 Len=1"
"212","4.263429","127.0.0.1","127.0.0.1","TCP","44","49712  >  49711 [ACK] Seq=1 Ack=54 Win=8197 Len=0"
"213","4.263749","127.0.0.1","127.0.0.1","TCP","45","49722  >  49721 [PSH, ACK] Seq=54 Ack=1 Win=8442 Len=1"
"214","4.263774","127.0.0.1","127.0.0.1","TCP","44","49721  >  49722 [ACK] Seq=1 Ack=55 Win=8198 Len=0"
"215","4.264055","127.0.0.1","127.0.0.1","TCP","45","49711  >  49712 [PSH, ACK] Seq=54 Ack=1 Win=8442 Len=1"
"216","4.264064","127.0.0.1","127.0.0.1","TCP","44","49712  >  49711 [ACK] Seq=1 Ack=55 Win=8197 Len=0"
"217","4.264243","127.0.0.1","127.0.0.1","TCP","45","49722  >  49721 [PSH, ACK] Seq=55 Ack=1 Win=8442 Len=1"
"218","4.264251","127.0.0.1","127.0.0.1","TCP","44","49721  >  49722 [ACK] Seq=1 Ack=56 Win=8198 Len=0"
"219","4.264412","127.0.0.1","127.0.0.1","TCP","45","49711  >  49712 [PSH, ACK] Seq=55 Ack=1 Win=8442 Len=1"
"220","4.264419","127.0.0.1","127.0.0.1","TCP","44","49712  >  49711 [ACK] Seq=1 Ack=56 Win=8197 Len=0"
"221","4.264590","127.0.0.1","127.0.0.1","TCP","45","49722  >  49721 [PSH, ACK] Seq=56 Ack=1 Win=8442 Len=1"
"222","4.264601","127.0.0.1","127.0.0.1","TCP","44","49721  >  49722 [ACK] Seq=1 Ack=57 Win=8198 Len=0"
"223","4.264806","127.0.0.1","127.0.0.1","TCP","45","49711  >  49712 [PSH, ACK] Seq=56 Ack=1 Win=8442 Len=1"
"224","4.264814","127.0.0.1","127.0.0.1","TCP","44","49712  >  49711 [ACK] Seq=1 Ack=57 Win=8197 Len=0"
"225","4.264975","127.0.0.1","127.0.0.1","TCP","45","49722  >  49721 [PSH, ACK] Seq=57 Ack=1 Win=8442 Len=1"
"226","4.264982","127.0.0.1","127.0.0.1","TCP","44","49721  >  49722 [ACK] Seq=1 Ack=58 Win=8198 Len=0"
"227","4.265135","127.0.0.1","127.0.0.1","TCP","45","49711  >  49712 [PSH, ACK] Seq=57 Ack=1 Win=8442 Len=1"
"228","4.265142","127.0.0.1","127.0.0.1","TCP","44","49712  >  49711 [ACK] Seq=1 Ack=58 Win=8197 Len=0"
"229","4.265306","127.0.0.1","127.0.0.1","TCP","45","49722  >  49721 [PSH, ACK] Seq=58 Ack=1 Win=8442 Len=1"
"230","4.265313","127.0.0.1","127.0.0.1","TCP","44","49721  >  49722 [ACK] Seq=1 Ack=59 Win=8198 Len=0"
"231","4.265486","127.0.0.1","127.0.0.1","TCP","45","49711  >  49712 [PSH, ACK] Seq=58 Ack=1 Win=8442 Len=1"
"232","4.265493","127.0.0.1","127.0.0.1","TCP","44","49712  >  49711 [ACK] Seq=1 Ack=59 Win=8197 Len=0"
"233","4.265677","127.0.0.1","127.0.0.1","TCP","45","49722  >  49721 [PSH, ACK] Seq=59 Ack=1 Win=8442 Len=1"
"234","4.265684","127.0.0.1","127.0.0.1","TCP","44","49721  >  49722 [ACK] Seq=1 Ack=60 Win=8198 Len=0"
"235","4.265834","127.0.0.1","127.0.0.1","TCP","45","49711  >  49712 [PSH, ACK] Seq=59 Ack=1 Win=8442 Len=1"
"236","4.265841","127.0.0.1","127.0.0.1","TCP","44","49712  >  49711 [ACK] Seq=1 Ack=60 Win=8197 Len=0"
"237","4.266021","127.0.0.1","127.0.0.1","TCP","45","49722  >  49721 [PSH, ACK] Seq=60 Ack=1 Win=8442 Len=1"
"238","4.266041","127.0.0.1","127.0.0.1","TCP","44","49721  >  49722 [ACK] Seq=1 Ack=61 Win=8198 Len=0"
"239","4.266236","127.0.0.1","127.0.0.1","TCP","45","49711  >  49712 [PSH, ACK] Seq=60 Ack=1 Win=8442 Len=1"
"240","4.266243","127.0.0.1","127.0.0.1","TCP","44","49712  >  49711 [ACK] Seq=1 Ack=61 Win=8197 Len=0"
"241","4.266405","127.0.0.1","127.0.0.1","TCP","45","49722  >  49721 [PSH, ACK] Seq=61 Ack=1 Win=8442 Len=1"
"242","4.266412","127.0.0.1","127.0.0.1","TCP","44","49721  >  49722 [ACK] Seq=1 Ack=62 Win=8198 Len=0"
"243","4.266559","127.0.0.1","127.0.0.1","TCP","45","49711  >  49712 [PSH, ACK] Seq=61 Ack=1 Win=8442 Len=1"
"244","4.266566","127.0.0.1","127.0.0.1","TCP","44","49712  >  49711 [ACK] Seq=1 Ack=62 Win=8197 Len=0"
"245","4.267447","127.0.0.1","127.0.0.1","TCP","45","49722  >  49721 [PSH, ACK] Seq=62 Ack=1 Win=8442 Len=1"
"246","4.267482","127.0.0.1","127.0.0.1","TCP","44","49721  >  49722 [ACK] Seq=1 Ack=63 Win=8198 Len=0"
"247","4.267684","127.0.0.1","127.0.0.1","TCP","45","49711  >  49712 [PSH, ACK] Seq=62 Ack=1 Win=8442 Len=1"
"248","4.267693","127.0.0.1","127.0.0.1","TCP","44","49712  >  49711 [ACK] Seq=1 Ack=63 Win=8197 Len=0"
"249","4.267867","127.0.0.1","127.0.0.1","TCP","45","49722  >  49721 [PSH, ACK] Seq=63 Ack=1 Win=8442 Len=1"
"250","4.267876","127.0.0.1","127.0.0.1","TCP","44","49721  >  49722 [ACK] Seq=1 Ack=64 Win=8198 Len=0"
"251","4.268030","127.0.0.1","127.0.0.1","TCP","45","49711  >  49712 [PSH, ACK] Seq=63 Ack=1 Win=8442 Len=1"
"252","4.268037","127.0.0.1","127.0.0.1","TCP","44","49712  >  49711 [ACK] Seq=1 Ack=64 Win=8197 Len=0"
"253","4.268380","127.0.0.1","127.0.0.1","TCP","45","49722  >  49721 [PSH, ACK] Seq=64 Ack=1 Win=8442 Len=1"
"254","4.268405","127.0.0.1","127.0.0.1","TCP","44","49721  >  49722 [ACK] Seq=1 Ack=65 Win=8198 Len=0"
"255","4.268591","127.0.0.1","127.0.0.1","TCP","45","49711  >  49712 [PSH, ACK] Seq=64 Ack=1 Win=8442 Len=1"
"256","4.268598","127.0.0.1","127.0.0.1","TCP","44","49712  >  49711 [ACK] Seq=1 Ack=65 Win=8197 Len=0"
"257","4.268783","127.0.0.1","127.0.0.1","TCP","45","49722  >  49721 [PSH, ACK] Seq=65 Ack=1 Win=8442 Len=1"
"258","4.268791","127.0.0.1","127.0.0.1","TCP","44","49721  >  49722 [ACK] Seq=1 Ack=66 Win=8198 Len=0"
"259","4.268942","127.0.0.1","127.0.0.1","TCP","45","49711  >  49712 [PSH, ACK] Seq=65 Ack=1 Win=8442 Len=1"
"260","4.268949","127.0.0.1","127.0.0.1","TCP","44","49712  >  49711 [ACK] Seq=1 Ack=66 Win=8197 Len=0"
"261","4.269113","127.0.0.1","127.0.0.1","TCP","45","49722  >  49721 [PSH, ACK] Seq=66 Ack=1 Win=8442 Len=1"
"262","4.269120","127.0.0.1","127.0.0.1","TCP","44","49721  >  49722 [ACK] Seq=1 Ack=67 Win=8198 Len=0"
"263","4.269304","127.0.0.1","127.0.0.1","TCP","45","49711  >  49712 [PSH, ACK] Seq=66 Ack=1 Win=8442 Len=1"
"264","4.269311","127.0.0.1","127.0.0.1","TCP","44","49712  >  49711 [ACK] Seq=1 Ack=67 Win=8197 Len=0"
"265","4.269472","127.0.0.1","127.0.0.1","TCP","45","49722  >  49721 [PSH, ACK] Seq=67 Ack=1 Win=8442 Len=1"
"266","4.269479","127.0.0.1","127.0.0.1","TCP","44","49721  >  49722 [ACK] Seq=1 Ack=68 Win=8198 Len=0"
"267","4.269629","127.0.0.1","127.0.0.1","TCP","45","49711  >  49712 [PSH, ACK] Seq=67 Ack=1 Win=8442 Len=1"
"268","4.269636","127.0.0.1","127.0.0.1","TCP","44","49712  >  49711 [ACK] Seq=1 Ack=68 Win=8197 Len=0"
"269","4.269796","127.0.0.1","127.0.0.1","TCP","45","49722  >  49721 [PSH, ACK] Seq=68 Ack=1 Win=8442 Len=1"
"270","4.269803","127.0.0.1","127.0.0.1","TCP","44","49721  >  49722 [ACK] Seq=1 Ack=69 Win=8198 Len=0"
"271","4.269981","127.0.0.1","127.0.0.1","TCP","45","49711  >  49712 [PSH, ACK] Seq=68 Ack=1 Win=8442 Len=1"
"272","4.269988","127.0.0.1","127.0.0.1","TCP","44","49712  >  49711 [ACK] Seq=1 Ack=69 Win=8197 Len=0"
"273","4.270164","127.0.0.1","127.0.0.1","TCP","45","49722  >  49721 [PSH, ACK] Seq=69 Ack=1 Win=8442 Len=1"
"274","4.270171","127.0.0.1","127.0.0.1","TCP","44","49721  >  49722 [ACK] Seq=1 Ack=70 Win=8198 Len=0"
"275","4.270320","127.0.0.1","127.0.0.1","TCP","45","49711  >  49712 [PSH, ACK] Seq=69 Ack=1 Win=8442 Len=1"
"276","4.270327","127.0.0.1","127.0.0.1","TCP","44","49712  >  49711 [ACK] Seq=1 Ack=70 Win=8197 Len=0"
"277","4.270542","127.0.0.1","127.0.0.1","TCP","45","49722  >  49721 [PSH, ACK] Seq=70 Ack=1 Win=8442 Len=1"
"278","4.270563","127.0.0.1","127.0.0.1","TCP","44","49721  >  49722 [ACK] Seq=1 Ack=71 Win=8198 Len=0"
"279","4.272183","127.0.0.1","127.0.0.1","TCP","45","49711  >  49712 [PSH, ACK] Seq=70 Ack=1 Win=8442 Len=1"
"280","4.272196","127.0.0.1","127.0.0.1","TCP","44","49712  >  49711 [ACK] Seq=1 Ack=71 Win=8197 Len=0"
"281","4.272434","127.0.0.1","127.0.0.1","TCP","45","49722  >  49721 [PSH, ACK] Seq=71 Ack=1 Win=8442 Len=1"
"282","4.272443","127.0.0.1","127.0.0.1","TCP","44","49721  >  49722 [ACK] Seq=1 Ack=72 Win=8198 Len=0"
"283","4.291141","127.0.0.1","127.0.0.1","TCP","45","49711  >  49712 [PSH, ACK] Seq=71 Ack=1 Win=8442 Len=1"
"284","4.291168","127.0.0.1","127.0.0.1","TCP","44","49712  >  49711 [ACK] Seq=1 Ack=72 Win=8197 Len=0"
"285","4.340922","127.0.0.1","127.0.0.1","TCP","45","49711  >  49712 [PSH, ACK] Seq=72 Ack=1 Win=8442 Len=1"
"286","4.340948","127.0.0.1","127.0.0.1","TCP","44","49712  >  49711 [ACK] Seq=1 Ack=73 Win=8197 Len=0"
"287","4.341505","127.0.0.1","127.0.0.1","TCP","45","49722  >  49721 [PSH, ACK] Seq=72 Ack=1 Win=8442 Len=1"
"288","4.341523","127.0.0.1","127.0.0.1","TCP","44","49721  >  49722 [ACK] Seq=1 Ack=73 Win=8198 Len=0"
"289","4.341531","127.0.0.1","127.0.0.1","TCP","45","49722  >  49721 [PSH, ACK] Seq=73 Ack=1 Win=8442 Len=1"
"290","4.341536","127.0.0.1","127.0.0.1","TCP","44","49721  >  49722 [ACK] Seq=1 Ack=74 Win=8198 Len=0"
"291","4.341649","127.0.0.1","127.0.0.1","TCP","45","49711  >  49712 [PSH, ACK] Seq=73 Ack=1 Win=8442 Len=1"
"292","4.341663","127.0.0.1","127.0.0.1","TCP","44","49712  >  49711 [ACK] Seq=1 Ack=74 Win=8197 Len=0"
"293","4.342227","127.0.0.1","127.0.0.1","TCP","45","49722  >  49721 [PSH, ACK] Seq=74 Ack=1 Win=8442 Len=1"
"294","4.342240","127.0.0.1","127.0.0.1","TCP","44","49721  >  49722 [ACK] Seq=1 Ack=75 Win=8198 Len=0"
"295","4.342342","127.0.0.1","127.0.0.1","TCP","45","49711  >  49712 [PSH, ACK] Seq=74 Ack=1 Win=8442 Len=1"
"296","4.342354","127.0.0.1","127.0.0.1","TCP","44","49712  >  49711 [ACK] Seq=1 Ack=75 Win=8197 Len=0"
"297","4.354339","127.0.0.1","127.0.0.1","TCP","45","49722  >  49721 [PSH, ACK] Seq=75 Ack=1 Win=8442 Len=1"
"298","4.354364","127.0.0.1","127.0.0.1","TCP","44","49721  >  49722 [ACK] Seq=1 Ack=76 Win=8198 Len=0"
"299","4.354834","127.0.0.1","127.0.0.1","TCP","45","49711  >  49712 [PSH, ACK] Seq=75 Ack=1 Win=8442 Len=1"
"300","4.354855","127.0.0.1","127.0.0.1","TCP","44","49712  >  49711 [ACK] Seq=1 Ack=76 Win=8197 Len=0"
"301","4.355355","127.0.0.1","127.0.0.1","TCP","45","49722  >  49721 [PSH, ACK] Seq=76 Ack=1 Win=8442 Len=1"
"302","4.355371","127.0.0.1","127.0.0.1","TCP","44","49721  >  49722 [ACK] Seq=1 Ack=77 Win=8198 Len=0"
"303","4.355476","127.0.0.1","127.0.0.1","TCP","45","49711  >  49712 [PSH, ACK] Seq=76 Ack=1 Win=8442 Len=1"
"304","4.355485","127.0.0.1","127.0.0.1","TCP","44","49712  >  49711 [ACK] Seq=1 Ack=77 Win=8197 Len=0"
"305","4.355790","127.0.0.1","127.0.0.1","TCP","45","49722  >  49721 [PSH, ACK] Seq=77 Ack=1 Win=8442 Len=1"
"306","4.355798","127.0.0.1","127.0.0.1","TCP","44","49721  >  49722 [ACK] Seq=1 Ack=78 Win=8198 Len=0"
"307","4.355897","127.0.0.1","127.0.0.1","TCP","45","49711  >  49712 [PSH, ACK] Seq=77 Ack=1 Win=8442 Len=1"
"308","4.355904","127.0.0.1","127.0.0.1","TCP","44","49712  >  49711 [ACK] Seq=1 Ack=78 Win=8197 Len=0"
"309","4.356204","127.0.0.1","127.0.0.1","TCP","45","49722  >  49721 [PSH, ACK] Seq=78 Ack=1 Win=8442 Len=1"
"310","4.356228","127.0.0.1","127.0.0.1","TCP","44","49721  >  49722 [ACK] Seq=1 Ack=79 Win=8198 Len=0"
"311","4.356327","127.0.0.1","127.0.0.1","TCP","45","49711  >  49712 [PSH, ACK] Seq=78 Ack=1 Win=8442 Len=1"
"312","4.356339","127.0.0.1","127.0.0.1","TCP","44","49712  >  49711 [ACK] Seq=1 Ack=79 Win=8197 Len=0"
"313","4.356557","127.0.0.1","127.0.0.1","TCP","45","49722  >  49721 [PSH, ACK] Seq=79 Ack=1 Win=8442 Len=1"
"314","4.356565","127.0.0.1","127.0.0.1","TCP","44","49721  >  49722 [ACK] Seq=1 Ack=80 Win=8198 Len=0"
"315","4.356626","127.0.0.1","127.0.0.1","TCP","45","49711  >  49712 [PSH, ACK] Seq=79 Ack=1 Win=8442 Len=1"
"316","4.356633","127.0.0.1","127.0.0.1","TCP","44","49712  >  49711 [ACK] Seq=1 Ack=80 Win=8197 Len=0"
"317","4.357198","127.0.0.1","127.0.0.1","TCP","45","49722  >  49721 [PSH, ACK] Seq=80 Ack=1 Win=8442 Len=1"
"318","4.357217","127.0.0.1","127.0.0.1","TCP","44","49721  >  49722 [ACK] Seq=1 Ack=81 Win=8198 Len=0"
"319","4.357333","127.0.0.1","127.0.0.1","TCP","45","49711  >  49712 [PSH, ACK] Seq=80 Ack=1 Win=8442 Len=1"
"320","4.357340","127.0.0.1","127.0.0.1","TCP","44","49712  >  49711 [ACK] Seq=1 Ack=81 Win=8197 Len=0"
"321","4.357739","127.0.0.1","127.0.0.1","TCP","45","49722  >  49721 [PSH, ACK] Seq=81 Ack=1 Win=8442 Len=1"
"322","4.357752","127.0.0.1","127.0.0.1","TCP","44","49721  >  49722 [ACK] Seq=1 Ack=82 Win=8198 Len=0"
"323","4.357845","127.0.0.1","127.0.0.1","TCP","45","49711  >  49712 [PSH, ACK] Seq=81 Ack=1 Win=8442 Len=1"
"324","4.357851","127.0.0.1","127.0.0.1","TCP","44","49712  >  49711 [ACK] Seq=1 Ack=82 Win=8197 Len=0"
"325","4.358202","127.0.0.1","127.0.0.1","TCP","45","49722  >  49721 [PSH, ACK] Seq=82 Ack=1 Win=8442 Len=1"
"326","4.358216","127.0.0.1","127.0.0.1","TCP","44","49721  >  49722 [ACK] Seq=1 Ack=83 Win=8198 Len=0"
"327","4.358283","127.0.0.1","127.0.0.1","TCP","45","49711  >  49712 [PSH, ACK] Seq=82 Ack=1 Win=8442 Len=1"
"328","4.358290","127.0.0.1","127.0.0.1","TCP","44","49712  >  49711 [ACK] Seq=1 Ack=83 Win=8197 Len=0"
"329","4.358604","127.0.0.1","127.0.0.1","TCP","45","49722  >  49721 [PSH, ACK] Seq=83 Ack=1 Win=8442 Len=1"
"330","4.358630","127.0.0.1","127.0.0.1","TCP","44","49721  >  49722 [ACK] Seq=1 Ack=84 Win=8198 Len=0"
"331","4.358741","127.0.0.1","127.0.0.1","TCP","45","49711  >  49712 [PSH, ACK] Seq=83 Ack=1 Win=8442 Len=1"
"332","4.358748","127.0.0.1","127.0.0.1","TCP","44","49712  >  49711 [ACK] Seq=1 Ack=84 Win=8197 Len=0"
"333","4.359215","127.0.0.1","127.0.0.1","TCP","45","49722  >  49721 [PSH, ACK] Seq=84 Ack=1 Win=8442 Len=1"
"334","4.359233","127.0.0.1","127.0.0.1","TCP","44","49721  >  49722 [ACK] Seq=1 Ack=85 Win=8198 Len=0"
"335","4.359325","127.0.0.1","127.0.0.1","TCP","45","49711  >  49712 [PSH, ACK] Seq=84 Ack=1 Win=8442 Len=1"
"336","4.359335","127.0.0.1","127.0.0.1","TCP","44","49712  >  49711 [ACK] Seq=1 Ack=85 Win=8197 Len=0"
"337","4.359561","127.0.0.1","127.0.0.1","TCP","45","49722  >  49721 [PSH, ACK] Seq=85 Ack=1 Win=8442 Len=1"
"338","4.359573","127.0.0.1","127.0.0.1","TCP","44","49721  >  49722 [ACK] Seq=1 Ack=86 Win=8198 Len=0"
"339","4.359671","127.0.0.1","127.0.0.1","TCP","45","49711  >  49712 [PSH, ACK] Seq=85 Ack=1 Win=8442 Len=1"
"340","4.359680","127.0.0.1","127.0.0.1","TCP","44","49712  >  49711 [ACK] Seq=1 Ack=86 Win=8197 Len=0"
"341","4.359823","127.0.0.1","127.0.0.1","TCP","45","49722  >  49721 [PSH, ACK] Seq=86 Ack=1 Win=8442 Len=1"
"342","4.359833","127.0.0.1","127.0.0.1","TCP","44","49721  >  49722 [ACK] Seq=1 Ack=87 Win=8198 Len=0"
"343","4.359929","127.0.0.1","127.0.0.1","TCP","45","49711  >  49712 [PSH, ACK] Seq=86 Ack=1 Win=8442 Len=1"
"344","4.359943","127.0.0.1","127.0.0.1","TCP","44","49712  >  49711 [ACK] Seq=1 Ack=87 Win=8197 Len=0"
"345","4.360027","127.0.0.1","127.0.0.1","TCP","45","49722  >  49721 [PSH, ACK] Seq=87 Ack=1 Win=8442 Len=1"
"346","4.360034","127.0.0.1","127.0.0.1","TCP","44","49721  >  49722 [ACK] Seq=1 Ack=88 Win=8198 Len=0"
"347","4.360133","127.0.0.1","127.0.0.1","TCP","45","49711  >  49712 [PSH, ACK] Seq=87 Ack=1 Win=8442 Len=1"
"348","4.360140","127.0.0.1","127.0.0.1","TCP","44","49712  >  49711 [ACK] Seq=1 Ack=88 Win=8197 Len=0"
"349","4.360249","127.0.0.1","127.0.0.1","TCP","45","49722  >  49721 [PSH, ACK] Seq=88 Ack=1 Win=8442 Len=1"
"350","4.360255","127.0.0.1","127.0.0.1","TCP","44","49721  >  49722 [ACK] Seq=1 Ack=89 Win=8198 Len=0"
"351","4.360353","127.0.0.1","127.0.0.1","TCP","45","49711  >  49712 [PSH, ACK] Seq=88 Ack=1 Win=8442 Len=1"
"352","4.360360","127.0.0.1","127.0.0.1","TCP","44","49712  >  49711 [ACK] Seq=1 Ack=89 Win=8197 Len=0"
"353","4.360469","127.0.0.1","127.0.0.1","TCP","45","49722  >  49721 [PSH, ACK] Seq=89 Ack=1 Win=8442 Len=1"
"354","4.360476","127.0.0.1","127.0.0.1","TCP","44","49721  >  49722 [ACK] Seq=1 Ack=90 Win=8198 Len=0"
"355","4.360593","127.0.0.1","127.0.0.1","TCP","45","49711  >  49712 [PSH, ACK] Seq=89 Ack=1 Win=8442 Len=1"
"356","4.360608","127.0.0.1","127.0.0.1","TCP","44","49712  >  49711 [ACK] Seq=1 Ack=90 Win=8197 Len=0"
"357","4.360799","127.0.0.1","127.0.0.1","TCP","45","49722  >  49721 [PSH, ACK] Seq=90 Ack=1 Win=8442 Len=1"
"358","4.360808","127.0.0.1","127.0.0.1","TCP","44","49721  >  49722 [ACK] Seq=1 Ack=91 Win=8198 Len=0"
"359","4.361018","127.0.0.1","127.0.0.1","TCP","45","49711  >  49712 [PSH, ACK] Seq=90 Ack=1 Win=8442 Len=1"
"360","4.361033","127.0.0.1","127.0.0.1","TCP","44","49712  >  49711 [ACK] Seq=1 Ack=91 Win=8197 Len=0"
"361","4.362413","127.0.0.1","127.0.0.1","TCP","45","49722  >  49721 [PSH, ACK] Seq=91 Ack=1 Win=8442 Len=1"
"362","4.362448","127.0.0.1","127.0.0.1","TCP","44","49721  >  49722 [ACK] Seq=1 Ack=92 Win=8198 Len=0"
"363","4.362717","127.0.0.1","127.0.0.1","TCP","45","49711  >  49712 [PSH, ACK] Seq=91 Ack=1 Win=8442 Len=1"
"364","4.362733","127.0.0.1","127.0.0.1","TCP","44","49712  >  49711 [ACK] Seq=1 Ack=92 Win=8197 Len=0"
"365","4.362903","127.0.0.1","127.0.0.1","TCP","45","49722  >  49721 [PSH, ACK] Seq=92 Ack=1 Win=8442 Len=1"
"366","4.362921","127.0.0.1","127.0.0.1","TCP","44","49721  >  49722 [ACK] Seq=1 Ack=93 Win=8198 Len=0"
"367","4.363067","127.0.0.1","127.0.0.1","TCP","45","49711  >  49712 [PSH, ACK] Seq=92 Ack=1 Win=8442 Len=1"
"368","4.363079","127.0.0.1","127.0.0.1","TCP","44","49712  >  49711 [ACK] Seq=1 Ack=93 Win=8197 Len=0"
"369","4.363165","127.0.0.1","127.0.0.1","TCP","45","49722  >  49721 [PSH, ACK] Seq=93 Ack=1 Win=8442 Len=1"
"370","4.363175","127.0.0.1","127.0.0.1","TCP","44","49721  >  49722 [ACK] Seq=1 Ack=94 Win=8198 Len=0"
"371","4.363300","127.0.0.1","127.0.0.1","TCP","45","49711  >  49712 [PSH, ACK] Seq=93 Ack=1 Win=8442 Len=1"
"372","4.363311","127.0.0.1","127.0.0.1","TCP","44","49712  >  49711 [ACK] Seq=1 Ack=94 Win=8197 Len=0"
"373","4.363600","127.0.0.1","127.0.0.1","TCP","45","49722  >  49721 [PSH, ACK] Seq=94 Ack=1 Win=8442 Len=1"
"374","4.363610","127.0.0.1","127.0.0.1","TCP","44","49721  >  49722 [ACK] Seq=1 Ack=95 Win=8198 Len=0"
"375","4.363798","127.0.0.1","127.0.0.1","TCP","45","49711  >  49712 [PSH, ACK] Seq=94 Ack=1 Win=8442 Len=1"
"376","4.363806","127.0.0.1","127.0.0.1","TCP","44","49712  >  49711 [ACK] Seq=1 Ack=95 Win=8197 Len=0"
