"No.","Time","Source","Destination","Protocol","Length","Info"
"1","0.000000","127.0.0.1","127.0.0.1","TCP","45","49722  >  49721 [PSH, ACK] Seq=1 Ack=1 Win=8442 Len=1"
"2","0.000067","127.0.0.1","127.0.0.1","TCP","44","49721  >  49722 [ACK] Seq=1 Ack=2 Win=8252 Len=0"
"3","0.000866","127.0.0.1","127.0.0.1","TCP","45","49711  >  49712 [PSH, ACK] Seq=1 Ack=1 Win=8442 Len=1"
"4","0.000894","127.0.0.1","127.0.0.1","TCP","44","49712  >  49711 [ACK] Seq=1 Ack=2 Win=8251 Len=0"
"5","0.001467","127.0.0.1","127.0.0.1","TCP","45","49722  >  49721 [PSH, ACK] Seq=2 Ack=1 Win=8442 Len=1"
"6","0.001504","127.0.0.1","127.0.0.1","TCP","44","49721  >  49722 [ACK] Seq=1 Ack=3 Win=8252 Len=0"
"7","0.001763","127.0.0.1","127.0.0.1","TCP","45","49711  >  49712 [PSH, ACK] Seq=2 Ack=1 Win=8442 Len=1"
"8","0.001780","127.0.0.1","127.0.0.1","TCP","44","49712  >  49711 [ACK] Seq=1 Ack=3 Win=8251 Len=0"
"9","0.002255","127.0.0.1","127.0.0.1","TCP","45","49722  >  49721 [PSH, ACK] Seq=3 Ack=1 Win=8442 Len=1"
"10","0.002291","127.0.0.1","127.0.0.1","TCP","44","49721  >  49722 [ACK] Seq=1 Ack=4 Win=8252 Len=0"
"11","0.002486","127.0.0.1","127.0.0.1","TCP","45","49711  >  49712 [PSH, ACK] Seq=3 Ack=1 Win=8442 Len=1"
"12","0.002500","127.0.0.1","127.0.0.1","TCP","44","49712  >  49711 [ACK] Seq=1 Ack=4 Win=8251 Len=0"
"13","0.002971","127.0.0.1","127.0.0.1","TCP","45","49722  >  49721 [PSH, ACK] Seq=4 Ack=1 Win=8442 Len=1"
"14","0.003003","127.0.0.1","127.0.0.1","TCP","44","49721  >  49722 [ACK] Seq=1 Ack=5 Win=8252 Len=0"
"15","0.003183","127.0.0.1","127.0.0.1","TCP","45","49711  >  49712 [PSH, ACK] Seq=4 Ack=1 Win=8442 Len=1"
"16","0.003196","127.0.0.1","127.0.0.1","TCP","44","49712  >  49711 [ACK] Seq=1 Ack=5 Win=8251 Len=0"
"17","0.003636","127.0.0.1","127.0.0.1","TCP","45","49722  >  49721 [PSH, ACK] Seq=5 Ack=1 Win=8442 Len=1"
"18","0.003654","127.0.0.1","127.0.0.1","TCP","44","49721  >  49722 [ACK] Seq=1 Ack=6 Win=8252 Len=0"
"19","0.003968","127.0.0.1","127.0.0.1","TCP","45","49711  >  49712 [PSH, ACK] Seq=5 Ack=1 Win=8442 Len=1"
"20","0.003985","127.0.0.1","127.0.0.1","TCP","44","49712  >  49711 [ACK] Seq=1 Ack=6 Win=8251 Len=0"
"21","0.831223","127.0.0.1","127.0.0.1","TCP","45","49711  >  49712 [PSH, ACK] Seq=6 Ack=1 Win=8442 Len=1"
"22","0.831249","127.0.0.1","127.0.0.1","TCP","44","49712  >  49711 [ACK] Seq=1 Ack=7 Win=8251 Len=0"
"23","0.831732","127.0.0.1","127.0.0.1","TCP","45","49722  >  49721 [PSH, ACK] Seq=6 Ack=1 Win=8442 Len=1"
"24","0.831748","127.0.0.1","127.0.0.1","TCP","44","49721  >  49722 [ACK] Seq=1 Ack=7 Win=8252 Len=0"
"25","0.831809","127.0.0.1","127.0.0.1","TCP","45","49722  >  49721 [PSH, ACK] Seq=7 Ack=1 Win=8442 Len=1"
"26","0.831816","127.0.0.1","127.0.0.1","TCP","44","49721  >  49722 [ACK] Seq=1 Ack=8 Win=8252 Len=0"
"27","0.832075","127.0.0.1","127.0.0.1","TCP","45","49711  >  49712 [PSH, ACK] Seq=7 Ack=1 Win=8442 Len=1"
"28","0.832085","127.0.0.1","127.0.0.1","TCP","44","49712  >  49711 [ACK] Seq=1 Ack=8 Win=8251 Len=0"
"29","0.832992","127.0.0.1","127.0.0.1","TCP","45","49722  >  49721 [PSH, ACK] Seq=8 Ack=1 Win=8442 Len=1"
"30","0.833006","127.0.0.1","127.0.0.1","TCP","44","49721  >  49722 [ACK] Seq=1 Ack=9 Win=8252 Len=0"
"31","0.833090","127.0.0.1","127.0.0.1","TCP","45","49711  >  49712 [PSH, ACK] Seq=8 Ack=1 Win=8442 Len=1"
"32","0.833098","127.0.0.1","127.0.0.1","TCP","44","49712  >  49711 [ACK] Seq=1 Ack=9 Win=8251 Len=0"
"33","0.833524","127.0.0.1","127.0.0.1","TCP","45","49722  >  49721 [PSH, ACK] Seq=9 Ack=1 Win=8442 Len=1"
"34","0.833535","127.0.0.1","127.0.0.1","TCP","44","49721  >  49722 [ACK] Seq=1 Ack=10 Win=8252 Len=0"
"35","0.833835","127.0.0.1","127.0.0.1","TCP","45","49711  >  49712 [PSH, ACK] Seq=9 Ack=1 Win=8442 Len=1"
"36","0.833847","127.0.0.1","127.0.0.1","TCP","44","49712  >  49711 [ACK] Seq=1 Ack=10 Win=8251 Len=0"
"37","0.833912","127.0.0.1","127.0.0.1","TCP","45","49722  >  49721 [PSH, ACK] Seq=10 Ack=1 Win=8442 Len=1"
"38","0.833921","127.0.0.1","127.0.0.1","TCP","44","49721  >  49722 [ACK] Seq=1 Ack=11 Win=8252 Len=0"
"39","0.834017","127.0.0.1","127.0.0.1","TCP","45","49711  >  49712 [PSH, ACK] Seq=10 Ack=1 Win=8442 Len=1"
"40","0.834024","127.0.0.1","127.0.0.1","TCP","44","49712  >  49711 [ACK] Seq=1 Ack=11 Win=8251 Len=0"
"41","0.834924","127.0.0.1","127.0.0.1","TCP","45","49722  >  49721 [PSH, ACK] Seq=11 Ack=1 Win=8442 Len=1"
"42","0.834946","127.0.0.1","127.0.0.1","TCP","44","49721  >  49722 [ACK] Seq=1 Ack=12 Win=8252 Len=0"
"43","0.835045","127.0.0.1","127.0.0.1","TCP","45","49711  >  49712 [PSH, ACK] Seq=11 Ack=1 Win=8442 Len=1"
"44","0.835059","127.0.0.1","127.0.0.1","TCP","44","49712  >  49711 [ACK] Seq=1 Ack=12 Win=8251 Len=0"
"45","0.839656","127.0.0.1","127.0.0.1","TCP","45","49711  >  49712 [PSH, ACK] Seq=12 Ack=1 Win=8442 Len=1"
"46","0.839683","127.0.0.1","127.0.0.1","TCP","44","49712  >  49711 [ACK] Seq=1 Ack=13 Win=8251 Len=0"
"47","0.840168","127.0.0.1","127.0.0.1","TCP","45","49722  >  49721 [PSH, ACK] Seq=12 Ack=1 Win=8442 Len=1"
"48","0.840200","127.0.0.1","127.0.0.1","TCP","44","49721  >  49722 [ACK] Seq=1 Ack=13 Win=8252 Len=0"
"49","0.840408","127.0.0.1","127.0.0.1","TCP","45","49711  >  49712 [PSH, ACK] Seq=13 Ack=1 Win=8442 Len=1"
"50","0.840417","127.0.0.1","127.0.0.1","TCP","44","49712  >  49711 [ACK] Seq=1 Ack=14 Win=8251 Len=0"
"51","0.840455","127.0.0.1","127.0.0.1","TCP","45","49722  >  49721 [PSH, ACK] Seq=13 Ack=1 Win=8442 Len=1"
"52","0.840463","127.0.0.1","127.0.0.1","TCP","44","49721  >  49722 [ACK] Seq=1 Ack=14 Win=8252 Len=0"
"53","0.840626","127.0.0.1","127.0.0.1","TCP","45","49722  >  49721 [PSH, ACK] Seq=14 Ack=1 Win=8442 Len=1"
"54","0.840635","127.0.0.1","127.0.0.1","TCP","44","49721  >  49722 [ACK] Seq=1 Ack=15 Win=8252 Len=0"
"55","0.840714","127.0.0.1","127.0.0.1","TCP","45","49711  >  49712 [PSH, ACK] Seq=14 Ack=1 Win=8442 Len=1"
"56","0.840723","127.0.0.1","127.0.0.1","TCP","44","49712  >  49711 [ACK] Seq=1 Ack=15 Win=8251 Len=0"
"57","0.840934","127.0.0.1","127.0.0.1","TCP","45","49722  >  49721 [PSH, ACK] Seq=15 Ack=1 Win=8442 Len=1"
"58","0.840944","127.0.0.1","127.0.0.1","TCP","44","49721  >  49722 [ACK] Seq=1 Ack=16 Win=8252 Len=0"
"59","0.841093","127.0.0.1","127.0.0.1","TCP","45","49711  >  49712 [PSH, ACK] Seq=15 Ack=1 Win=8442 Len=1"
"60","0.841106","127.0.0.1","127.0.0.1","TCP","44","49712  >  49711 [ACK] Seq=1 Ack=16 Win=8251 Len=0"
"61","0.842144","127.0.0.1","127.0.0.1","TCP","45","49722  >  49721 [PSH, ACK] Seq=16 Ack=1 Win=8442 Len=1"
"62","0.842159","127.0.0.1","127.0.0.1","TCP","44","49721  >  49722 [ACK] Seq=1 Ack=17 Win=8252 Len=0"
"63","0.842243","127.0.0.1","127.0.0.1","TCP","45","49711  >  49712 [PSH, ACK] Seq=16 Ack=1 Win=8442 Len=1"
"64","0.842252","127.0.0.1","127.0.0.1","TCP","44","49712  >  49711 [ACK] Seq=1 Ack=17 Win=8251 Len=0"
"65","0.842451","127.0.0.1","127.0.0.1","TCP","45","49722  >  49721 [PSH, ACK] Seq=17 Ack=1 Win=8442 Len=1"
"66","0.842461","127.0.0.1","127.0.0.1","TCP","44","49721  >  49722 [ACK] Seq=1 Ack=18 Win=8252 Len=0"
"67","0.842534","127.0.0.1","127.0.0.1","TCP","45","49711  >  49712 [PSH, ACK] Seq=17 Ack=1 Win=8442 Len=1"
"68","0.842541","127.0.0.1","127.0.0.1","TCP","44","49712  >  49711 [ACK] Seq=1 Ack=18 Win=8251 Len=0"
"69","0.842707","127.0.0.1","127.0.0.1","TCP","45","49722  >  49721 [PSH, ACK] Seq=18 Ack=1 Win=8442 Len=1"
"70","0.842715","127.0.0.1","127.0.0.1","TCP","44","49721  >  49722 [ACK] Seq=1 Ack=19 Win=8252 Len=0"
"71","0.842769","127.0.0.1","127.0.0.1","TCP","45","49711  >  49712 [PSH, ACK] Seq=18 Ack=1 Win=8442 Len=1"
"72","0.842776","127.0.0.1","127.0.0.1","TCP","44","49712  >  49711 [ACK] Seq=1 Ack=19 Win=8251 Len=0"
"73","0.842915","127.0.0.1","127.0.0.1","TCP","45","49722  >  49721 [PSH, ACK] Seq=19 Ack=1 Win=8442 Len=1"
"74","0.842923","127.0.0.1","127.0.0.1","TCP","44","49721  >  49722 [ACK] Seq=1 Ack=20 Win=8252 Len=0"
"75","0.842997","127.0.0.1","127.0.0.1","TCP","45","49711  >  49712 [PSH, ACK] Seq=19 Ack=1 Win=8442 Len=1"
"76","0.843004","127.0.0.1","127.0.0.1","TCP","44","49712  >  49711 [ACK] Seq=1 Ack=20 Win=8251 Len=0"
"77","0.843162","127.0.0.1","127.0.0.1","TCP","45","49722  >  49721 [PSH, ACK] Seq=20 Ack=1 Win=8442 Len=1"
"78","0.843171","127.0.0.1","127.0.0.1","TCP","44","49721  >  49722 [ACK] Seq=1 Ack=21 Win=8252 Len=0"
"79","0.843224","127.0.0.1","127.0.0.1","TCP","45","49711  >  49712 [PSH, ACK] Seq=20 Ack=1 Win=8442 Len=1"
"80","0.843231","127.0.0.1","127.0.0.1","TCP","44","49712  >  49711 [ACK] Seq=1 Ack=21 Win=8251 Len=0"
"81","0.843410","127.0.0.1","127.0.0.1","TCP","45","49722  >  49721 [PSH, ACK] Seq=21 Ack=1 Win=8442 Len=1"
"82","0.843418","127.0.0.1","127.0.0.1","TCP","44","49721  >  49722 [ACK] Seq=1 Ack=22 Win=8252 Len=0"
"83","0.843470","127.0.0.1","127.0.0.1","TCP","45","49711  >  49712 [PSH, ACK] Seq=21 Ack=1 Win=8442 Len=1"
"84","0.843477","127.0.0.1","127.0.0.1","TCP","44","49712  >  49711 [ACK] Seq=1 Ack=22 Win=8251 Len=0"
"85","0.843615","127.0.0.1","127.0.0.1","TCP","45","49722  >  49721 [PSH, ACK] Seq=22 Ack=1 Win=8442 Len=1"
"86","0.843623","127.0.0.1","127.0.0.1","TCP","44","49721  >  49722 [ACK] Seq=1 Ack=23 Win=8252 Len=0"
"87","0.843700","127.0.0.1","127.0.0.1","TCP","45","49711  >  49712 [PSH, ACK] Seq=22 Ack=1 Win=8442 Len=1"
"88","0.843707","127.0.0.1","127.0.0.1","TCP","44","49712  >  49711 [ACK] Seq=1 Ack=23 Win=8251 Len=0"
"89","0.843842","127.0.0.1","127.0.0.1","TCP","45","49722  >  49721 [PSH, ACK] Seq=23 Ack=1 Win=8442 Len=1"
"90","0.843850","127.0.0.1","127.0.0.1","TCP","44","49721  >  49722 [ACK] Seq=1 Ack=24 Win=8252 Len=0"
"91","0.843925","127.0.0.1","127.0.0.1","TCP","45","49711  >  49712 [PSH, ACK] Seq=23 Ack=1 Win=8442 Len=1"
"92","0.843932","127.0.0.1","127.0.0.1","TCP","44","49712  >  49711 [ACK] Seq=1 Ack=24 Win=8251 Len=0"
"93","0.844067","127.0.0.1","127.0.0.1","TCP","45","49722  >  49721 [PSH, ACK] Seq=24 Ack=1 Win=8442 Len=1"
"94","0.844075","127.0.0.1","127.0.0.1","TCP","44","49721  >  49722 [ACK] Seq=1 Ack=25 Win=8252 Len=0"
"95","0.844148","127.0.0.1","127.0.0.1","TCP","45","49711  >  49712 [PSH, ACK] Seq=24 Ack=1 Win=8442 Len=1"
"96","0.844155","127.0.0.1","127.0.0.1","TCP","44","49712  >  49711 [ACK] Seq=1 Ack=25 Win=8251 Len=0"
"97","0.844308","127.0.0.1","127.0.0.1","TCP","45","49722  >  49721 [PSH, ACK] Seq=25 Ack=1 Win=8442 Len=1"
"98","0.844317","127.0.0.1","127.0.0.1","TCP","44","49721  >  49722 [ACK] Seq=1 Ack=26 Win=8252 Len=0"
"99","0.844372","127.0.0.1","127.0.0.1","TCP","45","49711  >  49712 [PSH, ACK] Seq=25 Ack=1 Win=8442 Len=1"
"100","0.844379","127.0.0.1","127.0.0.1","TCP","44","49712  >  49711 [ACK] Seq=1 Ack=26 Win=8251 Len=0"
"101","0.844575","127.0.0.1","127.0.0.1","TCP","45","49722  >  49721 [PSH, ACK] Seq=26 Ack=1 Win=8442 Len=1"
"102","0.844584","127.0.0.1","127.0.0.1","TCP","44","49721  >  49722 [ACK] Seq=1 Ack=27 Win=8252 Len=0"
"103","0.846697","127.0.0.1","127.0.0.1","TCP","45","49711  >  49712 [PSH, ACK] Seq=26 Ack=1 Win=8442 Len=1"
"104","0.846720","127.0.0.1","127.0.0.1","TCP","44","49712  >  49711 [ACK] Seq=1 Ack=27 Win=8251 Len=0"
"105","0.847392","127.0.0.1","127.0.0.1","TCP","45","49722  >  49721 [PSH, ACK] Seq=27 Ack=1 Win=8442 Len=1"
"106","0.847408","127.0.0.1","127.0.0.1","TCP","44","49721  >  49722 [ACK] Seq=1 Ack=28 Win=8252 Len=0"
"107","0.870077","127.0.0.1","127.0.0.1","TCP","45","49711  >  49712 [PSH, ACK] Seq=27 Ack=1 Win=8442 Len=1"
"108","0.870104","127.0.0.1","127.0.0.1","TCP","44","49712  >  49711 [ACK] Seq=1 Ack=28 Win=8251 Len=0"
"109","0.870464","127.0.0.1","127.0.0.1","TCP","45","49722  >  49721 [PSH, ACK] Seq=28 Ack=1 Win=8442 Len=1"
"110","0.870513","127.0.0.1","127.0.0.1","TCP","44","49721  >  49722 [ACK] Seq=1 Ack=29 Win=8252 Len=0"
"111","0.872095","127.0.0.1","127.0.0.1","TCP","45","49711  >  49712 [PSH, ACK] Seq=28 Ack=1 Win=8442 Len=1"
"112","0.872118","127.0.0.1","127.0.0.1","TCP","44","49712  >  49711 [ACK] Seq=1 Ack=29 Win=8251 Len=0"
"113","0.872754","127.0.0.1","127.0.0.1","TCP","45","49722  >  49721 [PSH, ACK] Seq=29 Ack=1 Win=8442 Len=1"
"114","0.872771","127.0.0.1","127.0.0.1","TCP","44","49721  >  49722 [ACK] Seq=1 Ack=30 Win=8252 Len=0"
"115","0.874216","127.0.0.1","127.0.0.1","TCP","45","49711  >  49712 [PSH, ACK] Seq=29 Ack=1 Win=8442 Len=1"
"116","0.874234","127.0.0.1","127.0.0.1","TCP","44","49712  >  49711 [ACK] Seq=1 Ack=30 Win=8251 Len=0"
"117","0.875669","127.0.0.1","127.0.0.1","TCP","45","49711  >  49712 [PSH, ACK] Seq=30 Ack=1 Win=8442 Len=1"
"118","0.875692","127.0.0.1","127.0.0.1","TCP","44","49712  >  49711 [ACK] Seq=1 Ack=31 Win=8251 Len=0"
"119","0.897336","127.0.0.1","127.0.0.1","TCP","45","49722  >  49721 [PSH, ACK] Seq=30 Ack=1 Win=8442 Len=1"
"120","0.897376","127.0.0.1","127.0.0.1","TCP","44","49721  >  49722 [ACK] Seq=1 Ack=31 Win=8252 Len=0"
"121","0.897392","127.0.0.1","127.0.0.1","TCP","45","49722  >  49721 [PSH, ACK] Seq=31 Ack=1 Win=8442 Len=1"
"122","0.897401","127.0.0.1","127.0.0.1","TCP","44","49721  >  49722 [ACK] Seq=1 Ack=32 Win=8252 Len=0"
"123","0.897609","127.0.0.1","127.0.0.1","TCP","45","49711  >  49712 [PSH, ACK] Seq=31 Ack=1 Win=8442 Len=1"
"124","0.897627","127.0.0.1","127.0.0.1","TCP","44","49712  >  49711 [ACK] Seq=1 Ack=32 Win=8251 Len=0"
"125","0.897942","127.0.0.1","127.0.0.1","TCP","45","49722  >  49721 [PSH, ACK] Seq=32 Ack=1 Win=8442 Len=1"
"126","0.897985","127.0.0.1","127.0.0.1","TCP","44","49721  >  49722 [ACK] Seq=1 Ack=33 Win=8252 Len=0"
"127","0.898153","127.0.0.1","127.0.0.1","TCP","45","49711  >  49712 [PSH, ACK] Seq=32 Ack=1 Win=8442 Len=1"
"128","0.898162","127.0.0.1","127.0.0.1","TCP","44","49712  >  49711 [ACK] Seq=1 Ack=33 Win=8251 Len=0"
"129","0.898368","127.0.0.1","127.0.0.1","TCP","45","49722  >  49721 [PSH, ACK] Seq=33 Ack=1 Win=8442 Len=1"
"130","0.898381","127.0.0.1","127.0.0.1","TCP","44","49721  >  49722 [ACK] Seq=1 Ack=34 Win=8252 Len=0"
"131","0.898465","127.0.0.1","127.0.0.1","TCP","45","49711  >  49712 [PSH, ACK] Seq=33 Ack=1 Win=8442 Len=1"
"132","0.898473","127.0.0.1","127.0.0.1","TCP","44","49712  >  49711 [ACK] Seq=1 Ack=34 Win=8251 Len=0"
"133","0.898655","127.0.0.1","127.0.0.1","TCP","45","49722  >  49721 [PSH, ACK] Seq=34 Ack=1 Win=8442 Len=1"
"134","0.898666","127.0.0.1","127.0.0.1","TCP","44","49721  >  49722 [ACK] Seq=1 Ack=35 Win=8252 Len=0"
"135","0.898821","127.0.0.1","127.0.0.1","TCP","45","49711  >  49712 [PSH, ACK] Seq=34 Ack=1 Win=8442 Len=1"
"136","0.898830","127.0.0.1","127.0.0.1","TCP","44","49712  >  49711 [ACK] Seq=1 Ack=35 Win=8251 Len=0"
"137","0.899009","127.0.0.1","127.0.0.1","TCP","45","49722  >  49721 [PSH, ACK] Seq=35 Ack=1 Win=8442 Len=1"
"138","0.899021","127.0.0.1","127.0.0.1","TCP","44","49721  >  49722 [ACK] Seq=1 Ack=36 Win=8252 Len=0"
"139","0.899183","127.0.0.1","127.0.0.1","TCP","45","49711  >  49712 [PSH, ACK] Seq=35 Ack=1 Win=8442 Len=1"
"140","0.899192","127.0.0.1","127.0.0.1","TCP","44","49712  >  49711 [ACK] Seq=1 Ack=36 Win=8251 Len=0"
"141","0.899406","127.0.0.1","127.0.0.1","TCP","45","49722  >  49721 [PSH, ACK] Seq=36 Ack=1 Win=8442 Len=1"
"142","0.899418","127.0.0.1","127.0.0.1","TCP","44","49721  >  49722 [ACK] Seq=1 Ack=37 Win=8252 Len=0"
"143","0.899510","127.0.0.1","127.0.0.1","TCP","45","49711  >  49712 [PSH, ACK] Seq=36 Ack=1 Win=8442 Len=1"
"144","0.899518","127.0.0.1","127.0.0.1","TCP","44","49712  >  49711 [ACK] Seq=1 Ack=37 Win=8251 Len=0"
"145","0.900222","127.0.0.1","127.0.0.1","TCP","45","49722  >  49721 [PSH, ACK] Seq=37 Ack=1 Win=8442 Len=1"
"146","0.900241","127.0.0.1","127.0.0.1","TCP","44","49721  >  49722 [ACK] Seq=1 Ack=38 Win=8252 Len=0"
"147","0.900358","127.0.0.1","127.0.0.1","TCP","45","49711  >  49712 [PSH, ACK] Seq=37 Ack=1 Win=8442 Len=1"
"148","0.900366","127.0.0.1","127.0.0.1","TCP","44","49712  >  49711 [ACK] Seq=1 Ack=38 Win=8251 Len=0"
"149","0.900678","127.0.0.1","127.0.0.1","TCP","45","49722  >  49721 [PSH, ACK] Seq=38 Ack=1 Win=8442 Len=1"
"150","0.900706","127.0.0.1","127.0.0.1","TCP","44","49721  >  49722 [ACK] Seq=1 Ack=39 Win=8252 Len=0"
"151","0.900817","127.0.0.1","127.0.0.1","TCP","45","49711  >  49712 [PSH, ACK] Seq=38 Ack=1 Win=8442 Len=1"
"152","0.900830","127.0.0.1","127.0.0.1","TCP","44","49712  >  49711 [ACK] Seq=1 Ack=39 Win=8251 Len=0"
"153","0.900969","127.0.0.1","127.0.0.1","TCP","45","49722  >  49721 [PSH, ACK] Seq=39 Ack=1 Win=8442 Len=1"
"154","0.900978","127.0.0.1","127.0.0.1","TCP","44","49721  >  49722 [ACK] Seq=1 Ack=40 Win=8252 Len=0"
"155","0.901133","127.0.0.1","127.0.0.1","TCP","45","49711  >  49712 [PSH, ACK] Seq=39 Ack=1 Win=8442 Len=1"
"156","0.901140","127.0.0.1","127.0.0.1","TCP","44","49712  >  49711 [ACK] Seq=1 Ack=40 Win=8251 Len=0"
"157","0.901316","127.0.0.1","127.0.0.1","TCP","45","49722  >  49721 [PSH, ACK] Seq=40 Ack=1 Win=8442 Len=1"
"158","0.901335","127.0.0.1","127.0.0.1","TCP","44","49721  >  49722 [ACK] Seq=1 Ack=41 Win=8252 Len=0"
"159","0.901496","127.0.0.1","127.0.0.1","TCP","45","49711  >  49712 [PSH, ACK] Seq=40 Ack=1 Win=8442 Len=1"
"160","0.901504","127.0.0.1","127.0.0.1","TCP","44","49712  >  49711 [ACK] Seq=1 Ack=41 Win=8251 Len=0"
"161","0.901668","127.0.0.1","127.0.0.1","TCP","45","49722  >  49721 [PSH, ACK] Seq=41 Ack=1 Win=8442 Len=1"
"162","0.901676","127.0.0.1","127.0.0.1","TCP","44","49721  >  49722 [ACK] Seq=1 Ack=42 Win=8252 Len=0"
"163","0.901859","127.0.0.1","127.0.0.1","TCP","45","49711  >  49712 [PSH, ACK] Seq=41 Ack=1 Win=8442 Len=1"
"164","0.901867","127.0.0.1","127.0.0.1","TCP","44","49712  >  49711 [ACK] Seq=1 Ack=42 Win=8251 Len=0"
"165","0.902051","127.0.0.1","127.0.0.1","TCP","45","49722  >  49721 [PSH, ACK] Seq=42 Ack=1 Win=8442 Len=1"
"166","0.902062","127.0.0.1","127.0.0.1","TCP","44","49721  >  49722 [ACK] Seq=1 Ack=43 Win=8252 Len=0"
"167","0.902202","127.0.0.1","127.0.0.1","TCP","45","49711  >  49712 [PSH, ACK] Seq=42 Ack=1 Win=8442 Len=1"
"168","0.902210","127.0.0.1","127.0.0.1","TCP","44","49712  >  49711 [ACK] Seq=1 Ack=43 Win=8251 Len=0"
"169","0.902399","127.0.0.1","127.0.0.1","TCP","45","49722  >  49721 [PSH, ACK] Seq=43 Ack=1 Win=8442 Len=1"
"170","0.902410","127.0.0.1","127.0.0.1","TCP","44","49721  >  49722 [ACK] Seq=1 Ack=44 Win=8252 Len=0"
"171","0.902545","127.0.0.1","127.0.0.1","TCP","45","49711  >  49712 [PSH, ACK] Seq=43 Ack=1 Win=8442 Len=1"
"172","0.902558","127.0.0.1","127.0.0.1","TCP","44","49712  >  49711 [ACK] Seq=1 Ack=44 Win=8251 Len=0"
"173","0.902718","127.0.0.1","127.0.0.1","TCP","45","49722  >  49721 [PSH, ACK] Seq=44 Ack=1 Win=8442 Len=1"
"174","0.902726","127.0.0.1","127.0.0.1","TCP","44","49721  >  49722 [ACK] Seq=1 Ack=45 Win=8252 Len=0"
"175","0.902890","127.0.0.1","127.0.0.1","TCP","45","49711  >  49712 [PSH, ACK] Seq=44 Ack=1 Win=8442 Len=1"
"176","0.902898","127.0.0.1","127.0.0.1","TCP","44","49712  >  49711 [ACK] Seq=1 Ack=45 Win=8251 Len=0"
"177","0.903063","127.0.0.1","127.0.0.1","TCP","45","49722  >  49721 [PSH, ACK] Seq=45 Ack=1 Win=8442 Len=1"
"178","0.903096","127.0.0.1","127.0.0.1","TCP","44","49721  >  49722 [ACK] Seq=1 Ack=46 Win=8252 Len=0"
"179","0.903258","127.0.0.1","127.0.0.1","TCP","45","49711  >  49712 [PSH, ACK] Seq=45 Ack=1 Win=8442 Len=1"
"180","0.903269","127.0.0.1","127.0.0.1","TCP","44","49712  >  49711 [ACK] Seq=1 Ack=46 Win=8251 Len=0"
"181","0.903420","127.0.0.1","127.0.0.1","TCP","45","49722  >  49721 [PSH, ACK] Seq=46 Ack=1 Win=8442 Len=1"
"182","0.903428","127.0.0.1","127.0.0.1","TCP","44","49721  >  49722 [ACK] Seq=1 Ack=47 Win=8252 Len=0"
"183","0.903588","127.0.0.1","127.0.0.1","TCP","45","49711  >  49712 [PSH, ACK] Seq=46 Ack=1 Win=8442 Len=1"
"184","0.903595","127.0.0.1","127.0.0.1","TCP","44","49712  >  49711 [ACK] Seq=1 Ack=47 Win=8251 Len=0"
"185","0.903836","127.0.0.1","127.0.0.1","TCP","45","49722  >  49721 [PSH, ACK] Seq=47 Ack=1 Win=8442 Len=1"
"186","0.903863","127.0.0.1","127.0.0.1","TCP","44","49721  >  49722 [ACK] Seq=1 Ack=48 Win=8252 Len=0"
"187","0.903952","127.0.0.1","127.0.0.1","TCP","45","49711  >  49712 [PSH, ACK] Seq=47 Ack=1 Win=8442 Len=1"
"188","0.903966","127.0.0.1","127.0.0.1","TCP","44","49712  >  49711 [ACK] Seq=1 Ack=48 Win=8251 Len=0"
"189","0.904493","127.0.0.1","127.0.0.1","TCP","45","49722  >  49721 [PSH, ACK] Seq=48 Ack=1 Win=8442 Len=1"
"190","0.904510","127.0.0.1","127.0.0.1","TCP","44","49721  >  49722 [ACK] Seq=1 Ack=49 Win=8252 Len=0"
"191","0.904614","127.0.0.1","127.0.0.1","TCP","45","49711  >  49712 [PSH, ACK] Seq=48 Ack=1 Win=8442 Len=1"
"192","0.904623","127.0.0.1","127.0.0.1","TCP","44","49712  >  49711 [ACK] Seq=1 Ack=49 Win=8251 Len=0"
"193","0.904779","127.0.0.1","127.0.0.1","TCP","45","49722  >  49721 [PSH, ACK] Seq=49 Ack=1 Win=8442 Len=1"
"194","0.904790","127.0.0.1","127.0.0.1","TCP","44","49721  >  49722 [ACK] Seq=1 Ack=50 Win=8252 Len=0"
"195","0.904877","127.0.0.1","127.0.0.1","TCP","45","49711  >  49712 [PSH, ACK] Seq=49 Ack=1 Win=8442 Len=1"
"196","0.904883","127.0.0.1","127.0.0.1","TCP","44","49712  >  49711 [ACK] Seq=1 Ack=50 Win=8251 Len=0"
"197","0.905044","127.0.0.1","127.0.0.1","TCP","45","49722  >  49721 [PSH, ACK] Seq=50 Ack=1 Win=8442 Len=1"
"198","0.905055","127.0.0.1","127.0.0.1","TCP","44","49721  >  49722 [ACK] Seq=1 Ack=51 Win=8252 Len=0"
"199","0.905279","127.0.0.1","127.0.0.1","TCP","45","49711  >  49712 [PSH, ACK] Seq=50 Ack=1 Win=8442 Len=1"
"200","0.905296","127.0.0.1","127.0.0.1","TCP","44","49712  >  49711 [ACK] Seq=1 Ack=51 Win=8251 Len=0"
"201","0.905747","127.0.0.1","127.0.0.1","TCP","45","49722  >  49721 [PSH, ACK] Seq=51 Ack=1 Win=8442 Len=1"
"202","0.905768","127.0.0.1","127.0.0.1","TCP","44","49721  >  49722 [ACK] Seq=1 Ack=52 Win=8252 Len=0"
"203","0.905936","127.0.0.1","127.0.0.1","TCP","45","49711  >  49712 [PSH, ACK] Seq=51 Ack=1 Win=8442 Len=1"
"204","0.905944","127.0.0.1","127.0.0.1","TCP","44","49712  >  49711 [ACK] Seq=1 Ack=52 Win=8251 Len=0"
"205","0.906132","127.0.0.1","127.0.0.1","TCP","45","49722  >  49721 [PSH, ACK] Seq=52 Ack=1 Win=8442 Len=1"
"206","0.906140","127.0.0.1","127.0.0.1","TCP","44","49721  >  49722 [ACK] Seq=1 Ack=53 Win=8252 Len=0"
"207","0.906340","127.0.0.1","127.0.0.1","TCP","45","49711  >  49712 [PSH, ACK] Seq=52 Ack=1 Win=8442 Len=1"
"208","0.906348","127.0.0.1","127.0.0.1","TCP","44","49712  >  49711 [ACK] Seq=1 Ack=53 Win=8251 Len=0"
"209","0.906531","127.0.0.1","127.0.0.1","TCP","45","49722  >  49721 [PSH, ACK] Seq=53 Ack=1 Win=8442 Len=1"
"210","0.906555","127.0.0.1","127.0.0.1","TCP","44","49721  >  49722 [ACK] Seq=1 Ack=54 Win=8252 Len=0"
"211","0.906725","127.0.0.1","127.0.0.1","TCP","45","49711  >  49712 [PSH, ACK] Seq=53 Ack=1 Win=8442 Len=1"
"212","0.906740","127.0.0.1","127.0.0.1","TCP","44","49712  >  49711 [ACK] Seq=1 Ack=54 Win=8251 Len=0"
"213","0.906872","127.0.0.1","127.0.0.1","TCP","45","49722  >  49721 [PSH, ACK] Seq=54 Ack=1 Win=8442 Len=1"
"214","0.906879","127.0.0.1","127.0.0.1","TCP","44","49721  >  49722 [ACK] Seq=1 Ack=55 Win=8252 Len=0"
"215","0.907059","127.0.0.1","127.0.0.1","TCP","45","49711  >  49712 [PSH, ACK] Seq=54 Ack=1 Win=8442 Len=1"
"216","0.907066","127.0.0.1","127.0.0.1","TCP","44","49712  >  49711 [ACK] Seq=1 Ack=55 Win=8251 Len=0"
"217","0.907304","127.0.0.1","127.0.0.1","TCP","45","49722  >  49721 [PSH, ACK] Seq=55 Ack=1 Win=8442 Len=1"
"218","0.907333","127.0.0.1","127.0.0.1","TCP","44","49721  >  49722 [ACK] Seq=1 Ack=56 Win=8252 Len=0"
"219","0.907431","127.0.0.1","127.0.0.1","TCP","45","49711  >  49712 [PSH, ACK] Seq=55 Ack=1 Win=8442 Len=1"
"220","0.907438","127.0.0.1","127.0.0.1","TCP","44","49712  >  49711 [ACK] Seq=1 Ack=56 Win=8251 Len=0"
"221","0.907722","127.0.0.1","127.0.0.1","TCP","45","49722  >  49721 [PSH, ACK] Seq=56 Ack=1 Win=8442 Len=1"
"222","0.907736","127.0.0.1","127.0.0.1","TCP","44","49721  >  49722 [ACK] Seq=1 Ack=57 Win=8252 Len=0"
"223","0.907848","127.0.0.1","127.0.0.1","TCP","45","49711  >  49712 [PSH, ACK] Seq=56 Ack=1 Win=8442 Len=1"
"224","0.907855","127.0.0.1","127.0.0.1","TCP","44","49712  >  49711 [ACK] Seq=1 Ack=57 Win=8251 Len=0"
"225","0.908033","127.0.0.1","127.0.0.1","TCP","45","49722  >  49721 [PSH, ACK] Seq=57 Ack=1 Win=8442 Len=1"
"226","0.908045","127.0.0.1","127.0.0.1","TCP","44","49721  >  49722 [ACK] Seq=1 Ack=58 Win=8252 Len=0"
"227","0.908222","127.0.0.1","127.0.0.1","TCP","45","49711  >  49712 [PSH, ACK] Seq=57 Ack=1 Win=8442 Len=1"
"228","0.908228","127.0.0.1","127.0.0.1","TCP","44","49712  >  49711 [ACK] Seq=1 Ack=58 Win=8251 Len=0"
"229","0.908386","127.0.0.1","127.0.0.1","TCP","45","49722  >  49721 [PSH, ACK] Seq=58 Ack=1 Win=8442 Len=1"
"230","0.908393","127.0.0.1","127.0.0.1","TCP","44","49721  >  49722 [ACK] Seq=1 Ack=59 Win=8252 Len=0"
"231","0.908576","127.0.0.1","127.0.0.1","TCP","45","49711  >  49712 [PSH, ACK] Seq=58 Ack=1 Win=8442 Len=1"
"232","0.908582","127.0.0.1","127.0.0.1","TCP","44","49712  >  49711 [ACK] Seq=1 Ack=59 Win=8251 Len=0"
"233","0.908766","127.0.0.1","127.0.0.1","TCP","45","49722  >  49721 [PSH, ACK] Seq=59 Ack=1 Win=8442 Len=1"
"234","0.908791","127.0.0.1","127.0.0.1","TCP","44","49721  >  49722 [ACK] Seq=1 Ack=60 Win=8252 Len=0"
"235","0.908939","127.0.0.1","127.0.0.1","TCP","45","49711  >  49712 [PSH, ACK] Seq=59 Ack=1 Win=8442 Len=1"
"236","0.908955","127.0.0.1","127.0.0.1","TCP","44","49712  >  49711 [ACK] Seq=1 Ack=60 Win=8251 Len=0"
"237","0.909114","127.0.0.1","127.0.0.1","TCP","45","49722  >  49721 [PSH, ACK] Seq=60 Ack=1 Win=8442 Len=1"
"238","0.909124","127.0.0.1","127.0.0.1","TCP","44","49721  >  49722 [ACK] Seq=1 Ack=61 Win=8252 Len=0"
"239","0.909270","127.0.0.1","127.0.0.1","TCP","45","49711  >  49712 [PSH, ACK] Seq=60 Ack=1 Win=8442 Len=1"
"240","0.909276","127.0.0.1","127.0.0.1","TCP","44","49712  >  49711 [ACK] Seq=1 Ack=61 Win=8251 Len=0"
"241","0.909455","127.0.0.1","127.0.0.1","TCP","45","49722  >  49721 [PSH, ACK] Seq=61 Ack=1 Win=8442 Len=1"
"242","0.909491","127.0.0.1","127.0.0.1","TCP","44","49721  >  49722 [ACK] Seq=1 Ack=62 Win=8252 Len=0"
"243","0.909633","127.0.0.1","127.0.0.1","TCP","45","49711  >  49712 [PSH, ACK] Seq=61 Ack=1 Win=8442 Len=1"
"244","0.909649","127.0.0.1","127.0.0.1","TCP","44","49712  >  49711 [ACK] Seq=1 Ack=62 Win=8251 Len=0"
"245","0.909803","127.0.0.1","127.0.0.1","TCP","45","49722  >  49721 [PSH, ACK] Seq=62 Ack=1 Win=8442 Len=1"
"246","0.909812","127.0.0.1","127.0.0.1","TCP","44","49721  >  49722 [ACK] Seq=1 Ack=63 Win=8252 Len=0"
"247","0.909968","127.0.0.1","127.0.0.1","TCP","45","49711  >  49712 [PSH, ACK] Seq=62 Ack=1 Win=8442 Len=1"
"248","0.909975","127.0.0.1","127.0.0.1","TCP","44","49712  >  49711 [ACK] Seq=1 Ack=63 Win=8251 Len=0"
"249","0.910147","127.0.0.1","127.0.0.1","TCP","45","49722  >  49721 [PSH, ACK] Seq=63 Ack=1 Win=8442 Len=1"
"250","0.910154","127.0.0.1","127.0.0.1","TCP","44","49721  >  49722 [ACK] Seq=1 Ack=64 Win=8252 Len=0"
"251","0.910514","127.0.0.1","127.0.0.1","TCP","45","49711  >  49712 [PSH, ACK] Seq=63 Ack=1 Win=8442 Len=1"
"252","0.910526","127.0.0.1","127.0.0.1","TCP","44","49712  >  49711 [ACK] Seq=1 Ack=64 Win=8251 Len=0"
"253","0.910857","127.0.0.1","127.0.0.1","TCP","45","49722  >  49721 [PSH, ACK] Seq=64 Ack=1 Win=8442 Len=1"
"254","0.910865","127.0.0.1","127.0.0.1","TCP","44","49721  >  49722 [ACK] Seq=1 Ack=65 Win=8252 Len=0"
"255","0.911170","127.0.0.1","127.0.0.1","TCP","45","49711  >  49712 [PSH, ACK] Seq=64 Ack=1 Win=8442 Len=1"
"256","0.911183","127.0.0.1","127.0.0.1","TCP","44","49712  >  49711 [ACK] Seq=1 Ack=65 Win=8251 Len=0"
"257","0.911469","127.0.0.1","127.0.0.1","TCP","45","49722  >  49721 [PSH, ACK] Seq=65 Ack=1 Win=8442 Len=1"
"258","0.911480","127.0.0.1","127.0.0.1","TCP","44","49721  >  49722 [ACK] Seq=1 Ack=66 Win=8252 Len=0"
"259","0.911647","127.0.0.1","127.0.0.1","TCP","45","49711  >  49712 [PSH, ACK] Seq=65 Ack=1 Win=8442 Len=1"
"260","0.911654","127.0.0.1","127.0.0.1","TCP","44","49712  >  49711 [ACK] Seq=1 Ack=66 Win=8251 Len=0"
"261","0.912246","127.0.0.1","127.0.0.1","TCP","45","49722  >  49721 [PSH, ACK] Seq=66 Ack=1 Win=8442 Len=1"
"262","0.912272","127.0.0.1","127.0.0.1","TCP","44","49721  >  49722 [ACK] Seq=1 Ack=67 Win=8252 Len=0"
"263","0.912402","127.0.0.1","127.0.0.1","TCP","45","49711  >  49712 [PSH, ACK] Seq=66 Ack=1 Win=8442 Len=1"
"264","0.912414","127.0.0.1","127.0.0.1","TCP","44","49712  >  49711 [ACK] Seq=1 Ack=67 Win=8251 Len=0"
"265","0.913427","127.0.0.1","127.0.0.1","TCP","45","49722  >  49721 [PSH, ACK] Seq=67 Ack=1 Win=8442 Len=1"
"266","0.913455","127.0.0.1","127.0.0.1","TCP","44","49721  >  49722 [ACK] Seq=1 Ack=68 Win=8252 Len=0"
"267","0.913571","127.0.0.1","127.0.0.1","TCP","45","49711  >  49712 [PSH, ACK] Seq=67 Ack=1 Win=8442 Len=1"
"268","0.913584","127.0.0.1","127.0.0.1","TCP","44","49712  >  49711 [ACK] Seq=1 Ack=68 Win=8251 Len=0"
"269","0.913755","127.0.0.1","127.0.0.1","TCP","45","49722  >  49721 [PSH, ACK] Seq=68 Ack=1 Win=8442 Len=1"
"270","0.913766","127.0.0.1","127.0.0.1","TCP","44","49721  >  49722 [ACK] Seq=1 Ack=69 Win=8252 Len=0"
"271","0.913962","127.0.0.1","127.0.0.1","TCP","45","49711  >  49712 [PSH, ACK] Seq=68 Ack=1 Win=8442 Len=1"
"272","0.913972","127.0.0.1","127.0.0.1","TCP","44","49712  >  49711 [ACK] Seq=1 Ack=69 Win=8251 Len=0"
"273","0.914289","127.0.0.1","127.0.0.1","TCP","45","49722  >  49721 [PSH, ACK] Seq=69 Ack=1 Win=8442 Len=1"
"274","0.914309","127.0.0.1","127.0.0.1","TCP","44","49721  >  49722 [ACK] Seq=1 Ack=70 Win=8252 Len=0"
"275","0.914416","127.0.0.1","127.0.0.1","TCP","45","49711  >  49712 [PSH, ACK] Seq=69 Ack=1 Win=8442 Len=1"
"276","0.914430","127.0.0.1","127.0.0.1","TCP","44","49712  >  49711 [ACK] Seq=1 Ack=70 Win=8251 Len=0"
"277","0.914681","127.0.0.1","127.0.0.1","TCP","45","49722  >  49721 [PSH, ACK] Seq=70 Ack=1 Win=8442 Len=1"
"278","0.914697","127.0.0.1","127.0.0.1","TCP","44","49721  >  49722 [ACK] Seq=1 Ack=71 Win=8252 Len=0"
"279","0.914785","127.0.0.1","127.0.0.1","TCP","45","49711  >  49712 [PSH, ACK] Seq=70 Ack=1 Win=8442 Len=1"
"280","0.914795","127.0.0.1","127.0.0.1","TCP","44","49712  >  49711 [ACK] Seq=1 Ack=71 Win=8251 Len=0"
"281","0.915088","127.0.0.1","127.0.0.1","TCP","45","49722  >  49721 [PSH, ACK] Seq=71 Ack=1 Win=8442 Len=1"
"282","0.915105","127.0.0.1","127.0.0.1","TCP","44","49721  >  49722 [ACK] Seq=1 Ack=72 Win=8252 Len=0"
"283","0.915200","127.0.0.1","127.0.0.1","TCP","45","49711  >  49712 [PSH, ACK] Seq=71 Ack=1 Win=8442 Len=1"
"284","0.915208","127.0.0.1","127.0.0.1","TCP","44","49712  >  49711 [ACK] Seq=1 Ack=72 Win=8251 Len=0"
"285","0.915445","127.0.0.1","127.0.0.1","TCP","45","49722  >  49721 [PSH, ACK] Seq=72 Ack=1 Win=8442 Len=1"
"286","0.915455","127.0.0.1","127.0.0.1","TCP","44","49721  >  49722 [ACK] Seq=1 Ack=73 Win=8252 Len=0"
"287","0.915526","127.0.0.1","127.0.0.1","TCP","45","49711  >  49712 [PSH, ACK] Seq=72 Ack=1 Win=8442 Len=1"
"288","0.915532","127.0.0.1","127.0.0.1","TCP","44","49712  >  49711 [ACK] Seq=1 Ack=73 Win=8251 Len=0"
"289","0.915729","127.0.0.1","127.0.0.1","TCP","45","49722  >  49721 [PSH, ACK] Seq=73 Ack=1 Win=8442 Len=1"
"290","0.915753","127.0.0.1","127.0.0.1","TCP","44","49721  >  49722 [ACK] Seq=1 Ack=74 Win=8252 Len=0"
"291","0.915839","127.0.0.1","127.0.0.1","TCP","45","49711  >  49712 [PSH, ACK] Seq=73 Ack=1 Win=8442 Len=1"
"292","0.915845","127.0.0.1","127.0.0.1","TCP","44","49712  >  49711 [ACK] Seq=1 Ack=74 Win=8251 Len=0"
"293","0.916047","127.0.0.1","127.0.0.1","TCP","45","49722  >  49721 [PSH, ACK] Seq=74 Ack=1 Win=8442 Len=1"
"294","0.916057","127.0.0.1","127.0.0.1","TCP","44","49721  >  49722 [ACK] Seq=1 Ack=75 Win=8252 Len=0"
"295","0.916242","127.0.0.1","127.0.0.1","TCP","45","49711  >  49712 [PSH, ACK] Seq=74 Ack=1 Win=8442 Len=1"
"296","0.916250","127.0.0.1","127.0.0.1","TCP","44","49712  >  49711 [ACK] Seq=1 Ack=75 Win=8251 Len=0"
"297","0.916419","127.0.0.1","127.0.0.1","TCP","45","49722  >  49721 [PSH, ACK] Seq=75 Ack=1 Win=8442 Len=1"
"298","0.916427","127.0.0.1","127.0.0.1","TCP","44","49721  >  49722 [ACK] Seq=1 Ack=76 Win=8252 Len=0"
"299","0.916607","127.0.0.1","127.0.0.1","TCP","45","49711  >  49712 [PSH, ACK] Seq=75 Ack=1 Win=8442 Len=1"
"300","0.916614","127.0.0.1","127.0.0.1","TCP","44","49712  >  49711 [ACK] Seq=1 Ack=76 Win=8251 Len=0"
"301","0.916770","127.0.0.1","127.0.0.1","TCP","45","49722  >  49721 [PSH, ACK] Seq=76 Ack=1 Win=8442 Len=1"
"302","0.916777","127.0.0.1","127.0.0.1","TCP","44","49721  >  49722 [ACK] Seq=1 Ack=77 Win=8252 Len=0"
"303","0.916960","127.0.0.1","127.0.0.1","TCP","45","49711  >  49712 [PSH, ACK] Seq=76 Ack=1 Win=8442 Len=1"
"304","0.916967","127.0.0.1","127.0.0.1","TCP","44","49712  >  49711 [ACK] Seq=1 Ack=77 Win=8251 Len=0"
"305","0.917131","127.0.0.1","127.0.0.1","TCP","45","49722  >  49721 [PSH, ACK] Seq=77 Ack=1 Win=8442 Len=1"
"306","0.917138","127.0.0.1","127.0.0.1","TCP","44","49721  >  49722 [ACK] Seq=1 Ack=78 Win=8252 Len=0"
"307","0.917317","127.0.0.1","127.0.0.1","TCP","45","49711  >  49712 [PSH, ACK] Seq=77 Ack=1 Win=8442 Len=1"
"308","0.917323","127.0.0.1","127.0.0.1","TCP","44","49712  >  49711 [ACK] Seq=1 Ack=78 Win=8251 Len=0"
"309","0.917509","127.0.0.1","127.0.0.1","TCP","45","49722  >  49721 [PSH, ACK] Seq=78 Ack=1 Win=8442 Len=1"
"310","0.917518","127.0.0.1","127.0.0.1","TCP","44","49721  >  49722 [ACK] Seq=1 Ack=79 Win=8252 Len=0"
"311","0.917675","127.0.0.1","127.0.0.1","TCP","45","49711  >  49712 [PSH, ACK] Seq=78 Ack=1 Win=8442 Len=1"
"312","0.917682","127.0.0.1","127.0.0.1","TCP","44","49712  >  49711 [ACK] Seq=1 Ack=79 Win=8251 Len=0"
"313","0.917857","127.0.0.1","127.0.0.1","TCP","45","49722  >  49721 [PSH, ACK] Seq=79 Ack=1 Win=8442 Len=1"
"314","0.917881","127.0.0.1","127.0.0.1","TCP","44","49721  >  49722 [ACK] Seq=1 Ack=80 Win=8252 Len=0"
"315","0.918026","127.0.0.1","127.0.0.1","TCP","45","49711  >  49712 [PSH, ACK] Seq=79 Ack=1 Win=8442 Len=1"
"316","0.918033","127.0.0.1","127.0.0.1","TCP","44","49712  >  49711 [ACK] Seq=1 Ack=80 Win=8251 Len=0"
"317","0.918200","127.0.0.1","127.0.0.1","TCP","45","49722  >  49721 [PSH, ACK] Seq=80 Ack=1 Win=8442 Len=1"
"318","0.918208","127.0.0.1","127.0.0.1","TCP","44","49721  >  49722 [ACK] Seq=1 Ack=81 Win=8252 Len=0"
"319","0.918383","127.0.0.1","127.0.0.1","TCP","45","49711  >  49712 [PSH, ACK] Seq=80 Ack=1 Win=8442 Len=1"
"320","0.918390","127.0.0.1","127.0.0.1","TCP","44","49712  >  49711 [ACK] Seq=1 Ack=81 Win=8251 Len=0"
"321","0.918551","127.0.0.1","127.0.0.1","TCP","45","49722  >  49721 [PSH, ACK] Seq=81 Ack=1 Win=8442 Len=1"
"322","0.918558","127.0.0.1","127.0.0.1","TCP","44","49721  >  49722 [ACK] Seq=1 Ack=82 Win=8252 Len=0"
"323","0.918745","127.0.0.1","127.0.0.1","TCP","45","49711  >  49712 [PSH, ACK] Seq=81 Ack=1 Win=8442 Len=1"
"324","0.918752","127.0.0.1","127.0.0.1","TCP","44","49712  >  49711 [ACK] Seq=1 Ack=82 Win=8251 Len=0"
"325","0.918971","127.0.0.1","127.0.0.1","TCP","45","49722  >  49721 [PSH, ACK] Seq=82 Ack=1 Win=8442 Len=1"
"326","0.918983","127.0.0.1","127.0.0.1","TCP","44","49721  >  49722 [ACK] Seq=1 Ack=83 Win=8252 Len=0"
"327","0.919139","127.0.0.1","127.0.0.1","TCP","45","49711  >  49712 [PSH, ACK] Seq=82 Ack=1 Win=8442 Len=1"
"328","0.919158","127.0.0.1","127.0.0.1","TCP","44","49712  >  49711 [ACK] Seq=1 Ack=83 Win=8251 Len=0"
"329","0.919364","127.0.0.1","127.0.0.1","TCP","45","49722  >  49721 [PSH, ACK] Seq=83 Ack=1 Win=8442 Len=1"
"330","0.919391","127.0.0.1","127.0.0.1","TCP","44","49721  >  49722 [ACK] Seq=1 Ack=84 Win=8252 Len=0"
"331","0.919491","127.0.0.1","127.0.0.1","TCP","45","49711  >  49712 [PSH, ACK] Seq=83 Ack=1 Win=8442 Len=1"
"332","0.919507","127.0.0.1","127.0.0.1","TCP","44","49712  >  49711 [ACK] Seq=1 Ack=84 Win=8251 Len=0"
"333","1.013466","127.0.0.1","127.0.0.1","TCP","45","49722  >  49721 [PSH, ACK] Seq=84 Ack=1 Win=8442 Len=1"
"334","1.013529","127.0.0.1","127.0.0.1","TCP","44","49721  >  49722 [ACK] Seq=1 Ack=85 Win=8252 Len=0"
"335","1.013847","127.0.0.1","127.0.0.1","TCP","45","49711  >  49712 [PSH, ACK] Seq=84 Ack=1 Win=8442 Len=1"
"336","1.013894","127.0.0.1","127.0.0.1","TCP","44","49712  >  49711 [ACK] Seq=1 Ack=85 Win=8251 Len=0"
"337","1.014031","127.0.0.1","127.0.0.1","TCP","45","49722  >  49721 [PSH, ACK] Seq=85 Ack=1 Win=8442 Len=1"
"338","1.014060","127.0.0.1","127.0.0.1","TCP","44","49721  >  49722 [ACK] Seq=1 Ack=86 Win=8252 Len=0"
"339","1.014281","127.0.0.1","127.0.0.1","TCP","45","49711  >  49712 [PSH, ACK] Seq=85 Ack=1 Win=8442 Len=1"
"340","1.014298","127.0.0.1","127.0.0.1","TCP","44","49712  >  49711 [ACK] Seq=1 Ack=86 Win=8251 Len=0"
"341","1.014375","127.0.0.1","127.0.0.1","TCP","45","49722  >  49721 [PSH, ACK] Seq=86 Ack=1 Win=8442 Len=1"
"342","1.014402","127.0.0.1","127.0.0.1","TCP","44","49721  >  49722 [ACK] Seq=1 Ack=87 Win=8251 Len=0"
"343","1.014562","127.0.0.1","127.0.0.1","TCP","45","49711  >  49712 [PSH, ACK] Seq=86 Ack=1 Win=8442 Len=1"
"344","1.014569","127.0.0.1","127.0.0.1","TCP","44","49712  >  49711 [ACK] Seq=1 Ack=87 Win=8251 Len=0"
"345","1.014671","127.0.0.1","127.0.0.1","TCP","45","49722  >  49721 [PSH, ACK] Seq=87 Ack=1 Win=8442 Len=1"
"346","1.014682","127.0.0.1","127.0.0.1","TCP","44","49721  >  49722 [ACK] Seq=1 Ack=88 Win=8251 Len=0"
"347","1.014791","127.0.0.1","127.0.0.1","TCP","45","49711  >  49712 [PSH, ACK] Seq=87 Ack=1 Win=8442 Len=1"
"348","1.014798","127.0.0.1","127.0.0.1","TCP","44","49712  >  49711 [ACK] Seq=1 Ack=88 Win=8251 Len=0"
"349","1.014875","127.0.0.1","127.0.0.1","TCP","45","49722  >  49721 [PSH, ACK] Seq=88 Ack=1 Win=8442 Len=1"
"350","1.014886","127.0.0.1","127.0.0.1","TCP","44","49721  >  49722 [ACK] Seq=1 Ack=89 Win=8251 Len=0"
"351","1.015224","127.0.0.1","127.0.0.1","TCP","45","49711  >  49712 [PSH, ACK] Seq=88 Ack=1 Win=8442 Len=1"
"352","1.015240","127.0.0.1","127.0.0.1","TCP","44","49712  >  49711 [ACK] Seq=1 Ack=89 Win=8251 Len=0"
"353","1.060833","127.0.0.1","127.0.0.1","TCP","45","49711  >  49712 [PSH, ACK] Seq=89 Ack=1 Win=8442 Len=1"
"354","1.060861","127.0.0.1","127.0.0.1","TCP","44","49712  >  49711 [ACK] Seq=1 Ack=90 Win=8251 Len=0"
"355","1.061021","127.0.0.1","127.0.0.1","TCP","45","49722  >  49721 [PSH, ACK] Seq=89 Ack=1 Win=8442 Len=1"
"356","1.061065","127.0.0.1","127.0.0.1","TCP","44","49721  >  49722 [ACK] Seq=1 Ack=90 Win=8251 Len=0"
"357","1.061085","127.0.0.1","127.0.0.1","TCP","45","49722  >  49721 [PSH, ACK] Seq=90 Ack=1 Win=8442 Len=1"
"358","1.061100","127.0.0.1","127.0.0.1","TCP","44","49721  >  49722 [ACK] Seq=1 Ack=91 Win=8251 Len=0"
"359","1.061183","127.0.0.1","127.0.0.1","TCP","45","49711  >  49712 [PSH, ACK] Seq=90 Ack=1 Win=8442 Len=1"
"360","1.061200","127.0.0.1","127.0.0.1","TCP","44","49712  >  49711 [ACK] Seq=1 Ack=91 Win=8251 Len=0"
"361","1.061427","127.0.0.1","127.0.0.1","TCP","45","49722  >  49721 [PSH, ACK] Seq=91 Ack=1 Win=8442 Len=1"
"362","1.061461","127.0.0.1","127.0.0.1","TCP","44","49721  >  49722 [ACK] Seq=1 Ack=92 Win=8251 Len=0"
"363","1.061553","127.0.0.1","127.0.0.1","TCP","45","49711  >  49712 [PSH, ACK] Seq=91 Ack=1 Win=8442 Len=1"
"364","1.061561","127.0.0.1","127.0.0.1","TCP","44","49712  >  49711 [ACK] Seq=1 Ack=92 Win=8251 Len=0"
"365","1.061717","127.0.0.1","127.0.0.1","TCP","45","49722  >  49721 [PSH, ACK] Seq=92 Ack=1 Win=8442 Len=1"
"366","1.061725","127.0.0.1","127.0.0.1","TCP","44","49721  >  49722 [ACK] Seq=1 Ack=93 Win=8251 Len=0"
"367","1.061927","127.0.0.1","127.0.0.1","TCP","45","49711  >  49712 [PSH, ACK] Seq=92 Ack=1 Win=8442 Len=1"
"368","1.061936","127.0.0.1","127.0.0.1","TCP","44","49712  >  49711 [ACK] Seq=1 Ack=93 Win=8251 Len=0"
"369","1.061981","127.0.0.1","127.0.0.1","TCP","45","49722  >  49721 [PSH, ACK] Seq=93 Ack=1 Win=8442 Len=1"
"370","1.061988","127.0.0.1","127.0.0.1","TCP","44","49721  >  49722 [ACK] Seq=1 Ack=94 Win=8251 Len=0"
"371","1.062126","127.0.0.1","127.0.0.1","TCP","45","49711  >  49712 [PSH, ACK] Seq=93 Ack=1 Win=8442 Len=1"
"372","1.062131","127.0.0.1","127.0.0.1","TCP","44","49712  >  49711 [ACK] Seq=1 Ack=94 Win=8251 Len=0"
"373","1.062246","127.0.0.1","127.0.0.1","TCP","45","49722  >  49721 [PSH, ACK] Seq=94 Ack=1 Win=8442 Len=1"
"374","1.062253","127.0.0.1","127.0.0.1","TCP","44","49721  >  49722 [ACK] Seq=1 Ack=95 Win=8251 Len=0"
"375","1.062351","127.0.0.1","127.0.0.1","TCP","45","49711  >  49712 [PSH, ACK] Seq=94 Ack=1 Win=8442 Len=1"
"376","1.062357","127.0.0.1","127.0.0.1","TCP","44","49712  >  49711 [ACK] Seq=1 Ack=95 Win=8251 Len=0"
