"No.","Time","Source","Destination","Protocol","Length","Info"
"1","0.000000","192.168.4.106","224.0.0.251","MDNS","119","Standard query 0x0004 PTR _C1EB68AE._sub._googlecast._tcp.local, ""QM"" question PTR _233637DE._sub._googlecast._tcp.local, ""QM"" question PTR _googlecast._tcp.local, ""QM"" question"
"2","0.138272","192.168.4.113","3.223.77.234","TLSv1.2","364","Application Data"
"3","0.278093","192.168.4.113","74.125.200.188","TCP","55","56157  >  5228 [ACK] Seq=1 Ack=1 Win=508 Len=1"
"4","0.321137","74.125.200.188","192.168.4.113","TCP","66","5228  >  56157 [ACK] Seq=1 Ack=2 Win=290 Len=0 SLE=1 SRE=2"
"5","0.348563","3.223.77.234","192.168.4.113","TCP","54","443  >  56891 [ACK] Seq=1 Ack=311 Win=303 Len=0"
"6","0.348563","3.223.77.234","192.168.4.113","TLSv1.2","108","Application Data"
"7","0.349134","192.168.4.113","3.223.77.234","TLSv1.2","1074","Application Data"
"8","0.614109","3.223.77.234","192.168.4.113","TCP","54","443  >  56891 [ACK] Seq=55 Ack=1331 Win=373 Len=0"
"9","0.819584","3.223.77.234","192.168.4.113","TLSv1.2","512","Application Data"
"10","0.871746","192.168.4.113","3.223.77.234","TCP","54","56891  >  443 [ACK] Seq=1331 Ack=513 Win=515 Len=0"
"11","3.071947","142.250.77.138","192.168.4.113","TLSv1.2","102","Application Data"
"12","3.114508","192.168.4.113","142.250.77.138","TCP","54","54688  >  443 [ACK] Seq=1 Ack=49 Win=511 Len=0"
"13","3.379424","216.239.36.223","192.168.4.113","TCP","54","443  >  56887 [FIN, ACK] Seq=1 Ack=1 Win=283 Len=0"
"14","3.379554","192.168.4.113","216.239.36.223","TCP","54","56887  >  443 [ACK] Seq=1 Ack=2 Win=508 Len=0"
"15","4.182625","192.168.4.113","142.250.182.78","UDP","489","58173  >  443 Len=447"
"16","4.195377","142.250.182.78","192.168.4.113","UDP","75","443  >  58173 Len=33"
"17","4.205541","192.168.4.113","142.250.182.78","UDP","75","58173  >  443 Len=33"
"18","4.505687","142.250.182.78","192.168.4.113","UDP","1131","443  >  58173 Len=1089"
"19","4.505687","142.250.182.78","192.168.4.113","UDP","78","443  >  58173 Len=36"
"20","4.505687","142.250.182.78","192.168.4.113","UDP","226","443  >  58173 Len=184"
"21","4.505687","142.250.182.78","192.168.4.113","UDP","1131","443  >  58173 Len=1089"
"22","4.506459","192.168.4.113","142.250.182.78","UDP","83","58173  >  443 Len=41"
"23","4.518051","142.250.182.78","192.168.4.113","UDP","68","443  >  58173 Len=26"
"24","4.951446","192.168.4.113","172.64.155.209","TCP","55","56877  >  443 [ACK] Seq=1 Ack=1 Win=514 Len=1 [TCP segment of a reassembled PDU]"
"25","4.955846","172.64.155.209","192.168.4.113","TCP","66","443  >  56877 [ACK] Seq=1 Ack=2 Win=16 Len=0 SLE=1 SRE=2"
"26","5.216949","192.168.4.113","74.125.200.188","TCP","55","56156  >  5228 [ACK] Seq=1 Ack=1 Win=508 Len=1"
"27","5.260321","74.125.200.188","192.168.4.113","TCP","66","5228  >  56156 [ACK] Seq=1 Ack=2 Win=290 Len=0 SLE=1 SRE=2"
"28","5.632796","142.250.71.42","192.168.4.113","UDP","200","443  >  58511 Len=158"
"29","5.637243","192.168.4.113","142.250.71.42","UDP","75","58511  >  443 Len=33"
"30","5.840678","192.168.4.113","142.250.71.42","UDP","71","58511  >  443 Len=29"
"31","5.853297","142.250.71.42","192.168.4.113","UDP","67","443  >  58511 Len=25"
"32","6.058195","192.168.4.113","142.250.71.42","UDP","71","58511  >  443 Len=29"
"33","6.071093","142.250.71.42","192.168.4.113","UDP","67","443  >  58511 Len=25"
"34","6.275878","192.168.4.113","142.250.71.42","UDP","71","58511  >  443 Len=29"
"35","6.289315","142.250.71.42","192.168.4.113","UDP","67","443  >  58511 Len=25"
"36","6.494758","192.168.4.113","142.250.71.42","UDP","71","58511  >  443 Len=29"
"37","6.507393","142.250.71.42","192.168.4.113","UDP","67","443  >  58511 Len=25"
"38","6.711563","192.168.4.113","142.250.71.42","UDP","71","58511  >  443 Len=29"
"39","6.724888","142.250.71.42","192.168.4.113","UDP","67","443  >  58511 Len=25"
"40","6.930224","192.168.4.113","142.250.71.42","UDP","71","58511  >  443 Len=29"
"41","6.943119","142.250.71.42","192.168.4.113","UDP","67","443  >  58511 Len=25"
"42","7.258136","192.168.4.113","172.64.155.209","TCP","55","56876  >  443 [ACK] Seq=1 Ack=1 Win=509 Len=1 [TCP segment of a reassembled PDU]"
"43","7.262069","172.64.155.209","192.168.4.113","TCP","66","443  >  56876 [ACK] Seq=1 Ack=2 Win=13 Len=0 SLE=1 SRE=2"
"44","7.351699","192.168.4.113","142.250.71.42","UDP","71","58511  >  443 Len=29"
"45","7.363486","142.250.71.42","192.168.4.113","UDP","67","443  >  58511 Len=25"
"46","8.177481","192.168.4.113","142.250.71.42","UDP","71","58511  >  443 Len=29"
"47","8.186367","192.168.4.113","142.250.193.99","QUIC","1292","Initial, DCID=3896f74e687c6fa4, PKN: 1, CRYPTO"
"48","8.186567","192.168.4.113","142.250.193.99","QUIC","1292","Initial, DCID=3896f74e687c6fa4, PKN: 2, PADDING, CRYPTO"
"49","8.187001","192.168.4.113","142.250.193.99","QUIC","119","0-RTT, DCID=3896f74e687c6fa4"
"50","8.187806","192.168.4.113","142.250.193.99","QUIC","850","0-RTT, DCID=3896f74e687c6fa4"
"51","8.193104","142.250.71.42","192.168.4.113","UDP","67","443  >  58511 Len=25"
"52","8.208010","142.250.193.99","192.168.4.113","QUIC","1292","Initial, SCID=f896f74e687c6fa4, PKN: 1, ACK, PADDING"
"53","8.231368","142.250.193.99","192.168.4.113","QUIC","1292","Initial, SCID=f896f74e687c6fa4, PKN: 2, CRYPTO, PADDING"
"54","8.231368","142.250.193.99","192.168.4.113","QUIC","345","Protected Payload (KP0)"
"55","8.233500","192.168.4.113","142.250.193.99","QUIC","1292","Handshake, DCID=f896f74e687c6fa4"
"56","8.233858","142.250.193.99","192.168.4.113","QUIC","986","Protected Payload (KP0)"
"57","8.233858","142.250.193.99","192.168.4.113","QUIC","67","Protected Payload (KP0)"
"58","8.233858","142.250.193.99","192.168.4.113","QUIC","64","Protected Payload (KP0)"
"59","8.234331","192.168.4.113","142.250.193.99","QUIC","73","Protected Payload (KP0), DCID=f896f74e687c6fa4"
"60","8.246743","142.250.193.99","192.168.4.113","QUIC","162","Protected Payload (KP0)"
"61","8.247218","192.168.4.113","142.250.193.99","QUIC","73","Protected Payload (KP0), DCID=f896f74e687c6fa4"
"62","8.268170","142.250.193.99","192.168.4.113","QUIC","559","Protected Payload (KP0)"
"63","8.268170","142.250.193.99","192.168.4.113","QUIC","64","Protected Payload (KP0)"
"64","8.268886","192.168.4.113","142.250.193.99","QUIC","77","Protected Payload (KP0), DCID=f896f74e687c6fa4"
"65","8.281938","142.250.193.99","192.168.4.113","QUIC","67","Protected Payload (KP0)"
"66","8.862612","192.168.4.113","20.189.173.27","TCP","55","56872  >  443 [ACK] Seq=1 Ack=1 Win=512 Len=1 [TCP segment of a reassembled PDU]"
"67","9.113945","20.189.173.27","192.168.4.113","TCP","66","443  >  56872 [ACK] Seq=1 Ack=2 Win=16385 Len=0 SLE=1 SRE=2"
"68","9.798145","192.168.4.113","142.250.71.42","UDP","71","58511  >  443 Len=29"
"69","9.811621","142.250.71.42","192.168.4.113","UDP","67","443  >  58511 Len=25"
"70","13.013615","192.168.4.113","142.250.71.42","UDP","71","58511  >  443 Len=29"
"71","13.026112","142.250.71.42","192.168.4.113","UDP","67","443  >  58511 Len=25"
"72","14.815022","192.168.4.113","13.70.79.200","TCP","66","56895  >  443 [SYN] Seq=0 Win=65535 Len=0 MSS=1460 WS=256 SACK_PERM"
"73","15.053989","13.70.79.200","192.168.4.113","TCP","66","443  >  56895 [SYN, ACK] Seq=0 Ack=1 Win=65535 Len=0 MSS=1440 WS=256 SACK_PERM"
"74","15.054163","192.168.4.113","13.70.79.200","TCP","54","56895  >  443 [ACK] Seq=1 Ack=1 Win=262144 Len=0"
"75","15.057513","192.168.4.113","13.70.79.200","TLSv1.3","437","Client Hello (SNI=mobile.events.data.microsoft.com)"
"76","15.261274","13.70.79.200","192.168.4.113","TLSv1.3","153","Hello Retry Request, Change Cipher Spec"
"77","15.261408","192.168.4.113","13.70.79.200","TCP","54","56895  >  443 [ACK] Seq=384 Ack=100 Win=261888 Len=0"
"78","15.286414","192.168.4.113","13.70.79.200","TLSv1.3","508","Change Cipher Spec, Client Hello (SNI=mobile.events.data.microsoft.com)"
"79","15.466996","13.70.79.200","192.168.4.113","TLSv1.3","1494","Server Hello"
"80","15.466996","13.70.79.200","192.168.4.113","TCP","1494","443  >  56895 [ACK] Seq=1540 Ack=838 Win=4193792 Len=1440 [TCP segment of a reassembled PDU]"
"81","15.466996","13.70.79.200","192.168.4.113","TCP","1494","443  >  56895 [ACK] Seq=2980 Ack=838 Win=4193792 Len=1440 [TCP segment of a reassembled PDU]"
"82","15.467165","192.168.4.113","13.70.79.200","TCP","54","56895  >  443 [ACK] Seq=838 Ack=4420 Win=262144 Len=0"
"83","15.471683","13.70.79.200","192.168.4.113","TCP","1494","443  >  56895 [ACK] Seq=4420 Ack=838 Win=4193792 Len=1440 [TCP segment of a reassembled PDU]"
"84","15.471683","13.70.79.200","192.168.4.113","TLSv1.3","617","Application Data"
"85","15.471862","192.168.4.113","13.70.79.200","TCP","54","56895  >  443 [ACK] Seq=838 Ack=6423 Win=262144 Len=0"
"86","15.482892","192.168.4.113","13.70.79.200","TLSv1.3","128","Application Data"
"87","15.483333","192.168.4.113","13.70.79.200","TLSv1.3","1056","Application Data"
"88","15.667305","13.70.79.200","192.168.4.113","TLSv1.3","157","Application Data"
"89","15.667305","13.70.79.200","192.168.4.113","TCP","54","443  >  56895 [ACK] Seq=6526 Ack=1914 Win=4194560 Len=0"
"90","15.667305","13.70.79.200","192.168.4.113","TLSv1.3","499","Application Data"
"91","15.667434","192.168.4.113","13.70.79.200","TCP","54","56895  >  443 [ACK] Seq=1914 Ack=6971 Win=261376 Len=0"
"92","15.848192","192.168.4.113","49.205.75.99","TCP","54","56850  >  443 [FIN, ACK] Seq=1 Ack=1 Win=1020 Len=0"
"93","15.848727","192.168.4.113","49.206.251.161","TCP","54","56848  >  443 [FIN, ACK] Seq=1 Ack=1 Win=1021 Len=0"
"94","15.848947","192.168.4.113","49.206.251.161","TCP","54","56846  >  443 [FIN, ACK] Seq=1 Ack=1 Win=1021 Len=0"
"95","15.849049","192.168.4.113","202.83.26.162","TCP","54","56857  >  443 [FIN, ACK] Seq=1 Ack=1 Win=1022 Len=0"
"96","15.849273","192.168.4.113","106.51.32.34","TCP","54","56856  >  443 [FIN, ACK] Seq=1 Ack=1 Win=1022 Len=0"
"97","15.849408","192.168.4.113","49.205.75.99","TCP","54","56855  >  443 [FIN, ACK] Seq=1 Ack=1 Win=1022 Len=0"
"98","15.849602","192.168.4.113","157.240.237.60","TCP","54","56851  >  443 [FIN, ACK] Seq=1 Ack=1 Win=1021 Len=0"
"99","15.849665","192.168.4.113","157.240.192.52","TCP","54","56849  >  443 [FIN, ACK] Seq=1 Ack=1 Win=1021 Len=0"
"100","15.849663","192.168.4.113","157.240.23.53","TCP","54","56854  >  443 [FIN, ACK] Seq=1 Ack=1 Win=1021 Len=0"
"101","15.849806","192.168.4.113","157.240.192.52","TCP","54","56853  >  443 [FIN, ACK] Seq=1 Ack=1 Win=1021 Len=0"
"102","15.850209","192.168.4.113","202.83.26.162","TCP","54","56852  >  443 [FIN, ACK] Seq=1 Ack=1 Win=1023 Len=0"
"103","15.850247","192.168.4.113","157.240.242.60","TCP","54","56847  >  443 [FIN, ACK] Seq=1 Ack=1 Win=1021 Len=0"
"104","15.850440","192.168.4.113","106.51.32.34","TCP","54","56845  >  443 [FIN, ACK] Seq=1 Ack=1 Win=1020 Len=0"
"105","15.857496","192.168.4.113","157.240.23.54","TCP","66","56896  >  5222 [SYN] Seq=0 Win=64240 Len=0 MSS=1460 WS=256 SACK_PERM"
"106","15.868371","157.240.23.54","192.168.4.113","TCP","66","5222  >  56896 [SYN, ACK] Seq=0 Ack=1 Win=65535 Len=0 MSS=1392 SACK_PERM WS=256"
"107","15.868499","192.168.4.113","157.240.23.54","TCP","54","56896  >  5222 [ACK] Seq=1 Ack=1 Win=132096 Len=0"
"108","15.869026","192.168.4.113","157.240.23.54","TCP","278","56896  >  5222 [PSH, ACK] Seq=1 Ack=1 Win=132096 Len=224 [TCP segment of a reassembled PDU]"
"109","15.880147","157.240.23.54","192.168.4.113","TCP","54","5222  >  56896 [ACK] Seq=1 Ack=225 Win=66816 Len=0"
"110","16.155739","192.168.4.113","49.205.75.99","TCP","54","[TCP Retransmission] 56850  >  443 [FIN, ACK] Seq=1 Ack=1 Win=1020 Len=0"
"111","16.155906","192.168.4.113","49.206.251.161","TCP","54","[TCP Retransmission] 56848  >  443 [FIN, ACK] Seq=1 Ack=1 Win=1021 Len=0"
"112","16.155937","192.168.4.113","49.206.251.161","TCP","54","[TCP Retransmission] 56846  >  443 [FIN, ACK] Seq=1 Ack=1 Win=1021 Len=0"
"113","16.155964","192.168.4.113","202.83.26.162","TCP","54","[TCP Retransmission] 56857  >  443 [FIN, ACK] Seq=1 Ack=1 Win=1022 Len=0"
"114","16.155994","192.168.4.113","106.51.32.34","TCP","54","[TCP Retransmission] 56856  >  443 [FIN, ACK] Seq=1 Ack=1 Win=1022 Len=0"
"115","16.156035","192.168.4.113","49.205.75.99","TCP","54","[TCP Retransmission] 56855  >  443 [FIN, ACK] Seq=1 Ack=1 Win=1022 Len=0"
"116","16.156126","192.168.4.113","157.240.237.60","TCP","54","[TCP Retransmission] 56851  >  443 [FIN, ACK] Seq=1 Ack=1 Win=1021 Len=0"
"117","16.156157","192.168.4.113","157.240.23.53","TCP","54","[TCP Retransmission] 56854  >  443 [FIN, ACK] Seq=1 Ack=1 Win=1021 Len=0"
"118","16.156202","192.168.4.113","157.240.192.52","TCP","54","[TCP Retransmission] 56849  >  443 [FIN, ACK] Seq=1 Ack=1 Win=1021 Len=0"
"119","16.156240","192.168.4.113","157.240.192.52","TCP","54","[TCP Retransmission] 56853  >  443 [FIN, ACK] Seq=1 Ack=1 Win=1021 Len=0"
"120","16.156277","192.168.4.113","202.83.26.162","TCP","54","[TCP Retransmission] 56852  >  443 [FIN, ACK] Seq=1 Ack=1 Win=1023 Len=0"
"121","16.156316","192.168.4.113","157.240.242.60","TCP","54","[TCP Retransmission] 56847  >  443 [FIN, ACK] Seq=1 Ack=1 Win=1021 Len=0"
"122","16.156352","192.168.4.113","106.51.32.34","TCP","54","[TCP Retransmission] 56845  >  443 [FIN, ACK] Seq=1 Ack=1 Win=1020 Len=0"
"123","16.160066","157.240.23.54","192.168.4.113","TCP","111","5222  >  56896 [PSH, ACK] Seq=1 Ack=225 Win=66816 Len=57 [TCP segment of a reassembled PDU]"
"124","16.160066","157.240.23.54","192.168.4.113","TCP","151","5222  >  56896 [PSH, ACK] Seq=58 Ack=225 Win=66816 Len=97 [TCP segment of a reassembled PDU]"
"125","16.160066","157.240.23.54","192.168.4.113","TCP","151","[TCP Retransmission] 5222  >  56896 [PSH, ACK] Seq=58 Ack=225 Win=66816 Len=97 [TCP segment of a reassembled PDU]"
"126","16.160197","192.168.4.113","157.240.23.54","TCP","66","56896  >  5222 [ACK] Seq=225 Ack=155 Win=131840 Len=0 SLE=58 SRE=155"
"127","16.390304","157.240.23.54","192.168.4.113","TCP","100","5222  >  56896 [PSH, ACK] Seq=155 Ack=225 Win=66816 Len=46 [TCP segment of a reassembled PDU]"
"128","16.390304","157.240.23.54","192.168.4.113","TCP","107","5222  >  56896 [PSH, ACK] Seq=201 Ack=225 Win=66816 Len=53 [TCP segment of a reassembled PDU]"
"129","16.390304","157.240.23.54","192.168.4.113","TCP","107","[TCP Retransmission] 5222  >  56896 [PSH, ACK] Seq=201 Ack=225 Win=66816 Len=53 [TCP segment of a reassembled PDU]"
"130","16.390304","157.240.23.54","192.168.4.113","TCP","103","5222  >  56896 [PSH, ACK] Seq=254 Ack=225 Win=66816 Len=49 [TCP segment of a reassembled PDU]"
"131","16.390304","157.240.23.54","192.168.4.113","TCP","1446","5222  >  56896 [ACK] Seq=303 Ack=225 Win=66816 Len=1392 [TCP segment of a reassembled PDU]"
"132","16.390304","157.240.23.54","192.168.4.113","TCP","153","5222  >  56896 [PSH, ACK] Seq=1695 Ack=225 Win=66816 Len=99 [TCP segment of a reassembled PDU]"
"133","16.390304","157.240.23.54","192.168.4.113","TCP","176","5222  >  56896 [PSH, ACK] Seq=1794 Ack=225 Win=66816 Len=122 [TCP segment of a reassembled PDU]"
"134","16.390304","157.240.23.54","192.168.4.113","TCP","92","5222  >  56896 [PSH, ACK] Seq=1916 Ack=225 Win=66816 Len=38 [TCP segment of a reassembled PDU]"
"135","16.390469","192.168.4.113","157.240.23.54","TCP","66","56896  >  5222 [ACK] Seq=225 Ack=254 Win=131840 Len=0 SLE=201 SRE=254"
"136","16.390588","192.168.4.113","157.240.23.54","TCP","54","56896  >  5222 [ACK] Seq=225 Ack=1954 Win=132096 Len=0"
"137","16.392842","192.168.4.113","157.240.23.54","TCP","216","56896  >  5222 [PSH, ACK] Seq=225 Ack=1954 Win=132096 Len=162 [TCP segment of a reassembled PDU]"
"138","16.395074","192.168.4.113","157.240.23.54","TCP","201","56896  >  5222 [PSH, ACK] Seq=387 Ack=1954 Win=132096 Len=147 [TCP segment of a reassembled PDU]"
"139","16.404051","157.240.23.54","192.168.4.113","TCP","54","5222  >  56896 [ACK] Seq=1954 Ack=387 Win=67840 Len=0"
"140","16.406547","157.240.23.54","192.168.4.113","TCP","54","5222  >  56896 [ACK] Seq=1954 Ack=534 Win=68864 Len=0"
"141","16.459181","192.168.4.113","157.240.23.54","TCP","100","56896  >  5222 [PSH, ACK] Seq=534 Ack=1954 Win=132096 Len=46 [TCP segment of a reassembled PDU]"
"142","16.477170","192.168.4.113","157.240.23.54","TCP","100","56896  >  5222 [PSH, ACK] Seq=580 Ack=1954 Win=132096 Len=46 [TCP segment of a reassembled PDU]"
"143","16.486202","157.240.23.54","192.168.4.113","TCP","54","5222  >  56896 [ACK] Seq=1954 Ack=580 Win=68864 Len=0"
"144","16.488372","157.240.23.54","192.168.4.113","TCP","54","5222  >  56896 [ACK] Seq=1954 Ack=626 Win=68864 Len=0"
"145","16.498934","192.168.4.113","157.240.23.54","TCP","100","56896  >  5222 [PSH, ACK] Seq=626 Ack=1954 Win=132096 Len=46 [TCP segment of a reassembled PDU]"
"146","16.514539","157.240.23.54","192.168.4.113","TCP","54","5222  >  56896 [ACK] Seq=1954 Ack=672 Win=68864 Len=0"
"147","16.633413","192.168.4.113","157.240.23.54","TCP","100","56896  >  5222 [PSH, ACK] Seq=672 Ack=1954 Win=132096 Len=46 [TCP segment of a reassembled PDU]"
"148","16.635536","192.168.4.113","157.240.23.54","TCP","100","56896  >  5222 [PSH, ACK] Seq=718 Ack=1954 Win=132096 Len=46 [TCP segment of a reassembled PDU]"
"149","16.635755","157.240.23.54","192.168.4.113","TCP","509","5222  >  56896 [PSH, ACK] Seq=1954 Ack=672 Win=68864 Len=455 [TCP segment of a reassembled PDU]"
"150","16.645349","157.240.23.54","192.168.4.113","TCP","54","5222  >  56896 [ACK] Seq=2409 Ack=718 Win=68864 Len=0"
"151","16.645349","157.240.23.54","192.168.4.113","TCP","54","5222  >  56896 [ACK] Seq=2409 Ack=764 Win=68864 Len=0"
"152","16.646097","192.168.4.113","157.240.23.54","TCP","102","56896  >  5222 [PSH, ACK] Seq=764 Ack=2409 Win=131584 Len=48 [TCP segment of a reassembled PDU]"
"153","16.646718","192.168.4.113","157.240.23.54","TCP","100","56896  >  5222 [PSH, ACK] Seq=812 Ack=2409 Win=131584 Len=46 [TCP segment of a reassembled PDU]"
"154","16.654385","157.240.23.54","192.168.4.113","TCP","161","5222  >  56896 [PSH, ACK] Seq=2409 Ack=764 Win=68864 Len=107 [TCP segment of a reassembled PDU]"
"155","16.656487","157.240.23.54","192.168.4.113","TCP","54","5222  >  56896 [ACK] Seq=2516 Ack=858 Win=68864 Len=0"
"156","16.657270","192.168.4.113","157.240.23.54","TCP","100","56896  >  5222 [PSH, ACK] Seq=858 Ack=2516 Win=131584 Len=46 [TCP segment of a reassembled PDU]"
"157","16.657902","157.240.23.54","192.168.4.113","TCP","270","5222  >  56896 [PSH, ACK] Seq=2516 Ack=858 Win=68864 Len=216 [TCP segment of a reassembled PDU]"
"158","16.659977","157.240.23.54","192.168.4.113","TCP","97","5222  >  56896 [PSH, ACK] Seq=2732 Ack=858 Win=68864 Len=43 [TCP segment of a reassembled PDU]"
"159","16.660014","192.168.4.113","157.240.23.54","TCP","54","56896  >  5222 [ACK] Seq=904 Ack=2775 Win=131328 Len=0"
"160","16.667206","157.240.23.54","192.168.4.113","TCP","97","5222  >  56896 [PSH, ACK] Seq=2775 Ack=858 Win=68864 Len=43 [TCP segment of a reassembled PDU]"
"161","16.672943","192.168.4.113","157.240.23.54","TCP","183","56896  >  5222 [PSH, ACK] Seq=904 Ack=2818 Win=131328 Len=129 [TCP segment of a reassembled PDU]"
"162","16.673955","192.168.4.113","157.240.23.54","TCP","185","56896  >  5222 [PSH, ACK] Seq=1033 Ack=2818 Win=131328 Len=131 [TCP segment of a reassembled PDU]"
"163","16.674026","192.168.4.113","157.240.23.54","TCP","100","56896  >  5222 [PSH, ACK] Seq=1164 Ack=2818 Win=131328 Len=46 [TCP segment of a reassembled PDU]"
"164","16.682970","157.240.23.54","192.168.4.113","TCP","54","5222  >  56896 [ACK] Seq=2818 Ack=1033 Win=69888 Len=0"
"165","16.684083","157.240.23.54","192.168.4.113","TCP","54","5222  >  56896 [ACK] Seq=2818 Ack=1210 Win=70912 Len=0"
"166","16.718069","192.168.4.113","157.240.23.54","TCP","95","56896  >  5222 [PSH, ACK] Seq=1210 Ack=2818 Win=131328 Len=41 [TCP segment of a reassembled PDU]"
"167","16.768182","192.168.4.113","49.205.75.99","TCP","54","[TCP Retransmission] 56850  >  443 [FIN, ACK] Seq=1 Ack=1 Win=1020 Len=0"
"168","16.768254","192.168.4.113","49.206.251.161","TCP","54","[TCP Retransmission] 56848  >  443 [FIN, ACK] Seq=1 Ack=1 Win=1021 Len=0"
"169","16.768269","192.168.4.113","49.206.251.161","TCP","54","[TCP Retransmission] 56846  >  443 [FIN, ACK] Seq=1 Ack=1 Win=1021 Len=0"
"170","16.768282","192.168.4.113","202.83.26.162","TCP","54","[TCP Retransmission] 56857  >  443 [FIN, ACK] Seq=1 Ack=1 Win=1022 Len=0"
"171","16.768295","192.168.4.113","106.51.32.34","TCP","54","[TCP Retransmission] 56856  >  443 [FIN, ACK] Seq=1 Ack=1 Win=1022 Len=0"
"172","16.768311","192.168.4.113","49.205.75.99","TCP","54","[TCP Retransmission] 56855  >  443 [FIN, ACK] Seq=1 Ack=1 Win=1022 Len=0"
"173","16.768324","192.168.4.113","157.240.237.60","TCP","54","[TCP Retransmission] 56851  >  443 [FIN, ACK] Seq=1 Ack=1 Win=1021 Len=0"
"174","16.768349","192.168.4.113","157.240.23.53","TCP","54","[TCP Retransmission] 56854  >  443 [FIN, ACK] Seq=1 Ack=1 Win=1021 Len=0"
"175","16.768365","192.168.4.113","157.240.192.52","TCP","54","[TCP Retransmission] 56849  >  443 [FIN, ACK] Seq=1 Ack=1 Win=1021 Len=0"
"176","16.768387","192.168.4.113","157.240.192.52","TCP","54","[TCP Retransmission] 56853  >  443 [FIN, ACK] Seq=1 Ack=1 Win=1021 Len=0"
"177","16.768401","192.168.4.113","202.83.26.162","TCP","54","[TCP Retransmission] 56852  >  443 [FIN, ACK] Seq=1 Ack=1 Win=1023 Len=0"
"178","16.768418","192.168.4.113","157.240.242.60","TCP","54","[TCP Retransmission] 56847  >  443 [FIN, ACK] Seq=1 Ack=1 Win=1021 Len=0"
"179","16.768430","192.168.4.113","106.51.32.34","TCP","54","[TCP Retransmission] 56845  >  443 [FIN, ACK] Seq=1 Ack=1 Win=1020 Len=0"
"180","16.768533","157.240.23.54","192.168.4.113","TCP","54","5222  >  56896 [ACK] Seq=2818 Ack=1251 Win=70912 Len=0"
"181","17.000586","157.240.23.54","192.168.4.113","TCP","310","5222  >  56896 [PSH, ACK] Seq=2818 Ack=1251 Win=70912 Len=256 [TCP segment of a reassembled PDU]"
"182","17.000586","157.240.23.54","192.168.4.113","TCP","315","5222  >  56896 [PSH, ACK] Seq=3074 Ack=1251 Win=70912 Len=261 [TCP segment of a reassembled PDU]"
"183","17.000586","157.240.23.54","192.168.4.113","TCP","315","[TCP Retransmission] 5222  >  56896 [PSH, ACK] Seq=3074 Ack=1251 Win=70912 Len=261 [TCP segment of a reassembled PDU]"
"184","17.000586","157.240.23.54","192.168.4.113","TCP","1446","5222  >  56896 [ACK] Seq=3335 Ack=1251 Win=70912 Len=1392 [TCP segment of a reassembled PDU]"
"185","17.000586","157.240.23.54","192.168.4.113","TCP","153","5222  >  56896 [PSH, ACK] Seq=4727 Ack=1251 Win=70912 Len=99 [TCP segment of a reassembled PDU]"
"186","17.000586","157.240.23.54","192.168.4.113","TCP","220","5222  >  56896 [PSH, ACK] Seq=4826 Ack=1251 Win=70912 Len=166 [TCP segment of a reassembled PDU]"
"187","17.000730","192.168.4.113","157.240.23.54","TCP","66","56896  >  5222 [ACK] Seq=1251 Ack=3335 Win=130816 Len=0 SLE=3074 SRE=3335"
"188","17.000826","192.168.4.113","157.240.23.54","TCP","54","56896  >  5222 [ACK] Seq=1251 Ack=4992 Win=132096 Len=0"
"189","17.025666","192.168.4.113","157.240.192.52","TCP","66","56897  >  443 [SYN] Seq=0 Win=65535 Len=0 MSS=1460 WS=256 SACK_PERM"
"190","17.026224","192.168.4.113","49.205.75.99","TCP","66","56898  >  443 [SYN] Seq=0 Win=65535 Len=0 MSS=1460 WS=256 SACK_PERM"
"191","17.026224","192.168.4.113","49.205.75.99","TCP","66","56899  >  443 [SYN] Seq=0 Win=65535 Len=0 MSS=1460 WS=256 SACK_PERM"
"192","17.028991","49.205.75.99","192.168.4.113","TCP","66","443  >  56898 [SYN, ACK] Seq=0 Ack=1 Win=32016 Len=0 MSS=1392 SACK_PERM WS=256"
"193","17.028991","49.205.75.99","192.168.4.113","TCP","66","443  >  56899 [SYN, ACK] Seq=0 Ack=1 Win=32016 Len=0 MSS=1392 SACK_PERM WS=256"
"194","17.029174","192.168.4.113","49.205.75.99","TCP","54","56898  >  443 [ACK] Seq=1 Ack=1 Win=262144 Len=0"
"195","17.029241","192.168.4.113","49.205.75.99","TCP","54","56899  >  443 [ACK] Seq=1 Ack=1 Win=262144 Len=0"
"196","17.034895","157.240.192.52","192.168.4.113","TCP","66","443  >  56897 [SYN, ACK] Seq=0 Ack=1 Win=65535 Len=0 MSS=1392 SACK_PERM WS=256"
"197","17.035080","192.168.4.113","157.240.192.52","TCP","54","56897  >  443 [ACK] Seq=1 Ack=1 Win=262144 Len=0"
"198","17.048016","192.168.4.113","157.240.237.60","TCP","66","56900  >  443 [SYN] Seq=0 Win=65535 Len=0 MSS=1460 WS=256 SACK_PERM"
"199","17.048998","192.168.4.113","157.240.192.52","TLSv1.3","523","Client Hello (SNI=mmg.whatsapp.net)"
"200","17.049094","192.168.4.113","49.206.251.161","TCP","66","56901  >  443 [SYN] Seq=0 Win=65535 Len=0 MSS=1460 WS=256 SACK_PERM"
"201","17.049297","192.168.4.113","157.240.23.53","TCP","66","56902  >  443 [SYN] Seq=0 Win=65535 Len=0 MSS=1460 WS=256 SACK_PERM"
"202","17.049553","192.168.4.113","157.240.192.52","TCP","66","56903  >  443 [SYN] Seq=0 Win=65535 Len=0 MSS=1460 WS=256 SACK_PERM"
"203","17.049791","192.168.4.113","202.83.26.162","TCP","66","56904  >  443 [SYN] Seq=0 Win=65535 Len=0 MSS=1460 WS=256 SACK_PERM"
"204","17.050222","192.168.4.113","49.206.251.161","TCP","66","56905  >  443 [SYN] Seq=0 Win=65535 Len=0 MSS=1460 WS=256 SACK_PERM"
"205","17.050431","192.168.4.113","157.240.242.60","TCP","66","56906  >  443 [SYN] Seq=0 Win=65535 Len=0 MSS=1460 WS=256 SACK_PERM"
"206","17.050995","192.168.4.113","49.205.75.99","TLSv1.3","549","Client Hello (SNI=media.fblr2-2.fna.whatsapp.net)"
"207","17.051254","192.168.4.113","106.51.32.34","TCP","66","56907  >  443 [SYN] Seq=0 Win=65535 Len=0 MSS=1460 WS=256 SACK_PERM"
"208","17.051378","192.168.4.113","106.51.32.34","TCP","66","56908  >  443 [SYN] Seq=0 Win=65535 Len=0 MSS=1460 WS=256 SACK_PERM"
"209","17.051556","192.168.4.113","49.205.75.99","TLSv1.3","358","Client Hello (SNI=media.fblr2-2.fna.whatsapp.net)"
"210","17.051798","192.168.4.113","202.83.26.162","TCP","66","56909  >  443 [SYN] Seq=0 Win=65535 Len=0 MSS=1460 WS=256 SACK_PERM"
"211","17.052270","49.206.251.161","192.168.4.113","TCP","66","443  >  56901 [SYN, ACK] Seq=0 Ack=1 Win=32016 Len=0 MSS=1392 SACK_PERM WS=256"
"212","17.052377","192.168.4.113","49.206.251.161","TCP","54","56901  >  443 [ACK] Seq=1 Ack=1 Win=262144 Len=0"
"213","17.052721","202.83.26.162","192.168.4.113","TCP","66","443  >  56904 [SYN, ACK] Seq=0 Ack=1 Win=32016 Len=0 MSS=1392 SACK_PERM WS=256"
"214","17.052721","49.206.251.161","192.168.4.113","TCP","66","443  >  56905 [SYN, ACK] Seq=0 Ack=1 Win=32016 Len=0 MSS=1392 SACK_PERM WS=256"
"215","17.052823","192.168.4.113","202.83.26.162","TCP","54","56904  >  443 [ACK] Seq=1 Ack=1 Win=262144 Len=0"
"216","17.052862","192.168.4.113","49.206.251.161","TCP","54","56905  >  443 [ACK] Seq=1 Ack=1 Win=262144 Len=0"
"217","17.054726","192.168.4.113","202.83.26.162","TLSv1.3","549","Client Hello (SNI=media.fblr2-3.fna.whatsapp.net)"
"218","17.056094","192.168.4.113","49.206.251.161","TLSv1.3","551","Client Hello (SNI=media.fblr22-2.fna.whatsapp.net)"
"219","17.056739","192.168.4.113","49.206.251.161","TLSv1.3","359","Client Hello (SNI=media.fblr22-2.fna.whatsapp.net)"
"220","17.057211","49.205.75.99","192.168.4.113","TCP","54","443  >  56899 [ACK] Seq=1 Ack=496 Win=31744 Len=0"
"221","17.057211","106.51.32.34","192.168.4.113","TCP","66","443  >  56907 [SYN, ACK] Seq=0 Ack=1 Win=32016 Len=0 MSS=1392 SACK_PERM WS=256"
"222","17.057211","49.205.75.99","192.168.4.113","TLSv1.3","266","Server Hello, Change Cipher Spec, Application Data"
"223","17.057211","106.51.32.34","192.168.4.113","TCP","66","443  >  56908 [SYN, ACK] Seq=0 Ack=1 Win=32016 Len=0 MSS=1392 SACK_PERM WS=256"
"224","17.057211","49.205.75.99","192.168.4.113","TCP","54","443  >  56898 [ACK] Seq=1 Ack=305 Win=31744 Len=0"
"225","17.057211","202.83.26.162","192.168.4.113","TCP","66","443  >  56909 [SYN, ACK] Seq=0 Ack=1 Win=32016 Len=0 MSS=1392 SACK_PERM WS=256"
"226","17.057211","49.205.75.99","192.168.4.113","TLSv1.3","1446","Server Hello, Change Cipher Spec, Application Data"
"227","17.057211","49.205.75.99","192.168.4.113","TLSv1.3","1446","Application Data"
"228","17.057211","49.205.75.99","192.168.4.113","TLSv1.3","406","Application Data"
"229","17.057211","202.83.26.162","192.168.4.113","TCP","54","443  >  56904 [ACK] Seq=1 Ack=496 Win=31744 Len=0"
"230","17.057650","192.168.4.113","106.51.32.34","TCP","54","56907  >  443 [ACK] Seq=1 Ack=1 Win=262144 Len=0"
"231","17.057725","192.168.4.113","49.205.75.99","TCP","54","56899  >  443 [ACK] Seq=496 Ack=213 Win=261888 Len=0"
"232","17.057747","192.168.4.113","106.51.32.34","TCP","54","56908  >  443 [ACK] Seq=1 Ack=1 Win=262144 Len=0"
"233","17.057767","192.168.4.113","202.83.26.162","TCP","54","56909  >  443 [ACK] Seq=1 Ack=1 Win=262144 Len=0"
"234","17.057794","192.168.4.113","49.205.75.99","TCP","54","56898  >  443 [ACK] Seq=305 Ack=3137 Win=262144 Len=0"
"235","17.057882","202.83.26.162","192.168.4.113","TLSv1.3","266","Server Hello, Change Cipher Spec, Application Data"
"236","17.057960","192.168.4.113","202.83.26.162","TCP","54","56904  >  443 [ACK] Seq=496 Ack=213 Win=261888 Len=0"
"237","17.058226","157.240.192.52","192.168.4.113","TCP","54","443  >  56897 [ACK] Seq=1 Ack=470 Win=66816 Len=0"
"238","17.059745","192.168.4.113","202.83.26.162","TLSv1.3","358","Client Hello (SNI=media.fblr2-3.fna.whatsapp.net)"
"239","17.061091","192.168.4.113","202.83.26.162","TLSv1.3","118","Change Cipher Spec, Application Data"
"240","17.061579","192.168.4.113","106.51.32.34","TLSv1.3","359","Client Hello (SNI=media.fblr22-1.fna.whatsapp.net)"
"241","17.061579","192.168.4.113","106.51.32.34","TLSv1.3","551","Client Hello (SNI=media.fblr22-1.fna.whatsapp.net)"
"242","17.061791","192.168.4.113","202.83.26.162","TLSv1.3","134","Application Data"
"243","17.066309","49.206.251.161","192.168.4.113","TCP","54","443  >  56901 [ACK] Seq=1 Ack=498 Win=31744 Len=0"
"244","17.066309","49.206.251.161","192.168.4.113","TLSv1.3","266","Server Hello, Change Cipher Spec, Application Data"
"245","17.066429","192.168.4.113","49.206.251.161","TCP","54","56901  >  443 [ACK] Seq=498 Ack=213 Win=261888 Len=0"
"246","17.066582","157.240.192.52","192.168.4.113","TCP","66","443  >  56903 [SYN, ACK] Seq=0 Ack=1 Win=65535 Len=0 MSS=1392 SACK_PERM WS=256"
"247","17.066667","192.168.4.113","157.240.192.52","TCP","54","56903  >  443 [ACK] Seq=1 Ack=1 Win=262144 Len=0"
"248","17.066704","49.206.251.161","192.168.4.113","TCP","54","443  >  56905 [ACK] Seq=1 Ack=306 Win=31744 Len=0"
"249","17.066727","157.240.192.52","192.168.4.113","TLSv1.3","266","Server Hello, Change Cipher Spec, Application Data"
"250","17.066727","157.240.23.53","192.168.4.113","TCP","66","443  >  56902 [SYN, ACK] Seq=0 Ack=1 Win=65535 Len=0 MSS=1392 SACK_PERM WS=256"
"251","17.066765","192.168.4.113","157.240.192.52","TCP","54","56897  >  443 [ACK] Seq=470 Ack=213 Win=261888 Len=0"
"252","17.066826","192.168.4.113","157.240.23.53","TCP","54","56902  >  443 [ACK] Seq=1 Ack=1 Win=262144 Len=0"
"253","17.066926","49.206.251.161","192.168.4.113","TLSv1.3","1446","Server Hello, Change Cipher Spec, Application Data"
"254","17.066926","49.206.251.161","192.168.4.113","TLSv1.3","1446","Application Data"
"255","17.066926","49.206.251.161","192.168.4.113","TLSv1.3","410","Application Data"
"256","17.066926","202.83.26.162","192.168.4.113","TCP","54","443  >  56909 [ACK] Seq=1 Ack=305 Win=31744 Len=0"
"257","17.066926","202.83.26.162","192.168.4.113","TLSv1.3","1446","Server Hello, Change Cipher Spec, Application Data"
"258","17.066926","202.83.26.162","192.168.4.113","TLSv1.3","1446","Application Data"
"259","17.066926","202.83.26.162","192.168.4.113","TLSv1.3","407","Application Data"
"260","17.066926","202.83.26.162","192.168.4.113","TLSv1.3","237","Application Data"
"261","17.066926","202.83.26.162","192.168.4.113","TLSv1.3","128","Application Data"
"262","17.066926","106.51.32.34","192.168.4.113","TCP","54","443  >  56907 [ACK] Seq=1 Ack=498 Win=31744 Len=0"
"263","17.066926","106.51.32.34","192.168.4.113","TLSv1.3","266","Server Hello, Change Cipher Spec, Application Data"
"264","17.066926","202.83.26.162","192.168.4.113","TLSv1.3","85","Application Data"
"265","17.066926","106.51.32.34","192.168.4.113","TCP","54","443  >  56908 [ACK] Seq=1 Ack=306 Win=31744 Len=0"
"266","17.066926","106.51.32.34","192.168.4.113","TLSv1.3","1446","Server Hello, Change Cipher Spec, Application Data"
"267","17.066926","106.51.32.34","192.168.4.113","TLSv1.3","1446","Application Data"
"268","17.066926","106.51.32.34","192.168.4.113","TLSv1.3","412","Application Data"
"269","17.067127","192.168.4.113","49.206.251.161","TCP","54","56905  >  443 [ACK] Seq=306 Ack=3141 Win=262144 Len=0"
"270","17.067153","192.168.4.113","202.83.26.162","TCP","54","56909  >  443 [ACK] Seq=305 Ack=3138 Win=262144 Len=0"
"271","17.067170","192.168.4.113","202.83.26.162","TCP","54","56904  >  443 [ACK] Seq=640 Ack=501 Win=261632 Len=0"
"272","17.067194","192.168.4.113","106.51.32.34","TCP","54","56907  >  443 [ACK] Seq=498 Ack=213 Win=261888 Len=0"
"273","17.067207","192.168.4.113","106.51.32.34","TCP","54","56908  >  443 [ACK] Seq=306 Ack=3143 Win=262144 Len=0"
"274","17.067292","157.240.237.60","192.168.4.113","TCP","66","443  >  56900 [SYN, ACK] Seq=0 Ack=1 Win=65535 Len=0 MSS=1392 SACK_PERM WS=256"
"275","17.067336","192.168.4.113","157.240.237.60","TCP","54","56900  >  443 [ACK] Seq=1 Ack=1 Win=262144 Len=0"
"276","17.070047","192.168.4.113","49.206.251.161","TLSv1.3","118","Change Cipher Spec, Application Data"
"277","17.071894","192.168.4.113","106.51.32.34","TLSv1.3","118","Change Cipher Spec, Application Data"
"278","17.072041","192.168.4.113","157.240.237.60","TLSv1.3","536","Client Hello (SNI=media-pnq1-2.cdn.whatsapp.net)"
"279","17.072695","192.168.4.113","157.240.23.53","TLSv1.3","536","Client Hello (SNI=media-maa2-1.cdn.whatsapp.net)"
"280","17.073025","192.168.4.113","49.206.251.161","TLSv1.3","134","Application Data"
"281","17.073148","192.168.4.113","202.83.26.162","TLSv1.3","85","Application Data"
"282","17.073231","192.168.4.113","106.51.32.34","TLSv1.3","134","Application Data"
"283","17.073607","192.168.4.113","49.205.75.99","TLSv1.3","118","Change Cipher Spec, Application Data"
"284","17.074057","192.168.4.113","157.240.192.52","TLSv1.3","118","Change Cipher Spec, Application Data"
"285","17.074436","192.168.4.113","49.205.75.99","TLSv1.3","118","Change Cipher Spec, Application Data"
"286","17.074900","192.168.4.113","49.205.75.99","TLSv1.3","134","Application Data"
"287","17.075099","192.168.4.113","157.240.192.52","TLSv1.3","134","Application Data"
"288","17.076260","192.168.4.113","157.240.192.52","TLSv1.3","536","Client Hello (SNI=media-maa2-2.cdn.whatsapp.net)"
"289","17.076467","192.168.4.113","49.205.75.99","TLSv1.3","134","Application Data"
"290","17.076772","49.206.251.161","192.168.4.113","TCP","410","[TCP Spurious Retransmission] 443  >  56905 [PSH, ACK] Seq=2785 Ack=306 Win=31744 Len=356 [TCP segment of a reassembled PDU]"
"291","17.076826","192.168.4.113","49.206.251.161","TCP","66","[TCP Dup ACK 269#1] 56905  >  443 [ACK] Seq=306 Ack=3141 Win=262144 Len=0 SLE=2785 SRE=3141"
"292","17.076898","157.240.242.60","192.168.4.113","TCP","66","443  >  56906 [SYN, ACK] Seq=0 Ack=1 Win=65535 Len=0 MSS=1392 SACK_PERM WS=256"
"293","17.077020","192.168.4.113","157.240.242.60","TCP","54","56906  >  443 [ACK] Seq=1 Ack=1 Win=262144 Len=0"
"294","17.077098","49.206.251.161","192.168.4.113","TLSv1.3","238","Application Data"
"295","17.077098","49.206.251.161","192.168.4.113","TLSv1.3","128","Application Data"
"296","17.077098","106.51.32.34","192.168.4.113","TLSv1.3","238","Application Data"
"297","17.077098","106.51.32.34","192.168.4.113","TLSv1.3","128","Application Data"
"298","17.077098","49.206.251.161","192.168.4.113","TLSv1.3","85","Application Data"
"299","17.077098","106.51.32.34","192.168.4.113","TLSv1.3","85","Application Data"
"300","17.077098","49.205.75.99","192.168.4.113","TLSv1.3","237","Application Data"
"301","17.077098","49.205.75.99","192.168.4.113","TLSv1.3","128","Application Data"
"302","17.077225","192.168.4.113","49.206.251.161","TCP","54","56901  >  443 [ACK] Seq=642 Ack=502 Win=261632 Len=0"
"303","17.077247","192.168.4.113","106.51.32.34","TCP","54","56907  >  443 [ACK] Seq=642 Ack=502 Win=261632 Len=0"
"304","17.077259","192.168.4.113","49.205.75.99","TCP","54","56899  >  443 [ACK] Seq=640 Ack=470 Win=261632 Len=0"
"305","17.078145","49.205.75.99","192.168.4.113","TLSv1.3","85","Application Data"
"306","17.078145","49.205.75.99","192.168.4.113","TLSv1.3","237","Application Data"
"307","17.078145","49.205.75.99","192.168.4.113","TLSv1.3","128","Application Data"
"308","17.078194","192.168.4.113","49.205.75.99","TCP","54","56899  >  443 [ACK] Seq=640 Ack=501 Win=261632 Len=0"
"309","17.078214","192.168.4.113","49.205.75.99","TCP","54","56898  >  443 [ACK] Seq=449 Ack=3394 Win=261632 Len=0"
"310","17.078763","49.205.75.99","192.168.4.113","TLSv1.3","85","Application Data"
"311","17.078787","192.168.4.113","49.205.75.99","TCP","54","56898  >  443 [ACK] Seq=449 Ack=3425 Win=261632 Len=0"
"312","17.078793","192.168.4.113","49.205.75.99","TLSv1.3","85","Application Data"
"313","17.079013","192.168.4.113","106.51.32.34","TLSv1.3","85","Application Data"
"314","17.079827","192.168.4.113","49.205.75.99","TLSv1.3","85","Application Data"
"315","17.080141","192.168.4.113","49.206.251.161","TLSv1.3","85","Application Data"
"316","17.080306","192.168.4.113","202.83.26.162","TLSv1.3","118","Change Cipher Spec, Application Data"
"317","17.080332","192.168.4.113","157.240.242.60","TLSv1.3","536","Client Hello (SNI=media-pnq1-1.cdn.whatsapp.net)"
"318","17.080881","192.168.4.113","202.83.26.162","TLSv1.3","134","Application Data"
"319","17.082940","202.83.26.162","192.168.4.113","TLSv1.3","237","Application Data"
"320","17.082940","202.83.26.162","192.168.4.113","TLSv1.3","128","Application Data"
"321","17.082998","192.168.4.113","202.83.26.162","TCP","54","56909  >  443 [ACK] Seq=449 Ack=3395 Win=261632 Len=0"
"322","17.083771","192.168.4.113","106.51.32.34","TLSv1.3","118","Change Cipher Spec, Application Data"
"323","17.083774","192.168.4.113","202.83.26.162","TLSv1.3","85","Application Data"
"324","17.084104","192.168.4.113","106.51.32.34","TLSv1.3","134","Application Data"
"325","17.086702","202.83.26.162","192.168.4.113","TLSv1.3","85","Application Data"
"326","17.086751","192.168.4.113","202.83.26.162","TCP","54","56909  >  443 [ACK] Seq=480 Ack=3426 Win=261632 Len=0"
"327","17.086862","157.240.192.52","192.168.4.113","TCP","54","443  >  56897 [ACK] Seq=213 Ack=614 Win=66816 Len=0"
"328","17.086862","157.240.23.53","192.168.4.113","TCP","54","443  >  56902 [ACK] Seq=1 Ack=483 Win=66816 Len=0"
"329","17.086862","157.240.192.52","192.168.4.113","TLSv1.3","225","Application Data"
"330","17.086862","157.240.192.52","192.168.4.113","TLSv1.3","128","Application Data"
"331","17.086862","157.240.192.52","192.168.4.113","TLSv1.3","85","Application Data"
"332","17.086862","157.240.23.53","192.168.4.113","TLSv1.3","266","Server Hello, Change Cipher Spec, Application Data"
"333","17.086862","157.240.192.52","192.168.4.113","TCP","54","443  >  56903 [ACK] Seq=1 Ack=483 Win=66816 Len=0"
"334","17.086862","157.240.192.52","192.168.4.113","TLSv1.3","266","Server Hello, Change Cipher Spec, Application Data"
"335","17.087061","192.168.4.113","157.240.192.52","TCP","54","56897  >  443 [ACK] Seq=614 Ack=489 Win=261632 Len=0"
"336","17.087118","192.168.4.113","157.240.23.53","TCP","54","56902  >  443 [ACK] Seq=483 Ack=213 Win=261888 Len=0"
"337","17.087147","192.168.4.113","157.240.192.52","TCP","54","56903  >  443 [ACK] Seq=483 Ack=213 Win=261888 Len=0"
"338","17.087220","106.51.32.34","192.168.4.113","TLSv1.3","238","Application Data"
"339","17.087220","106.51.32.34","192.168.4.113","TLSv1.3","128","Application Data"
"340","17.087275","192.168.4.113","106.51.32.34","TCP","54","56908  >  443 [ACK] Seq=450 Ack=3401 Win=261632 Len=0"
"341","17.087332","106.51.32.34","192.168.4.113","TLSv1.3","85","Application Data"
"342","17.087358","192.168.4.113","106.51.32.34","TCP","54","56908  >  443 [ACK] Seq=450 Ack=3432 Win=261632 Len=0"
"343","17.091858","157.240.237.60","192.168.4.113","TCP","54","443  >  56900 [ACK] Seq=1 Ack=483 Win=66816 Len=0"
"344","17.092677","157.240.237.60","192.168.4.113","TLSv1.3","266","Server Hello, Change Cipher Spec, Application Data"
"345","17.092722","192.168.4.113","157.240.237.60","TCP","54","56900  >  443 [ACK] Seq=483 Ack=213 Win=261888 Len=0"
"346","17.093070","192.168.4.113","49.206.251.161","TLSv1.3","118","Change Cipher Spec, Application Data"
"347","17.094142","192.168.4.113","157.240.237.60","TLSv1.3","118","Change Cipher Spec, Application Data"
"348","17.095197","49.206.251.161","192.168.4.113","TLSv1.3","238","Application Data"
"349","17.095248","192.168.4.113","49.206.251.161","TCP","54","56905  >  443 [ACK] Seq=370 Ack=3325 Win=261888 Len=0"
"350","17.095635","49.206.251.161","192.168.4.113","TLSv1.3","128","Application Data"
"351","17.095657","192.168.4.113","49.206.251.161","TCP","54","56905  >  443 [ACK] Seq=370 Ack=3399 Win=261632 Len=0"
"352","17.096329","192.168.4.113","157.240.192.52","TLSv1.3","118","Change Cipher Spec, Application Data"
"353","17.099324","192.168.4.113","49.206.251.161","TLSv1.3","182","Application Data"
"354","17.099480","192.168.4.113","49.206.251.161","TLSv1.3","134","Application Data"
"355","17.100481","192.168.4.113","157.240.23.53","TLSv1.3","118","Change Cipher Spec, Application Data"
"356","17.101210","192.168.4.113","49.206.251.161","TLSv1.3","92","Application Data"
"357","17.101252","192.168.4.113","157.240.237.60","TLSv1.3","134","Application Data"
"358","17.101465","192.168.4.113","157.240.192.52","TLSv1.3","85","Application Data"
"359","17.101501","192.168.4.113","157.240.192.52","TLSv1.3","134","Application Data"
"360","17.101627","192.168.4.113","157.240.23.53","TLSv1.3","134","Application Data"
"361","17.101694","192.168.4.113","49.206.251.161","TLSv1.3","85","Application Data"
"362","17.102810","192.168.4.113","202.83.26.162","TLSv1.3","182","Application Data"
"363","17.103387","157.240.242.60","192.168.4.113","TCP","54","443  >  56906 [ACK] Seq=1 Ack=483 Win=66816 Len=0"
"364","17.103521","49.206.251.161","192.168.4.113","TCP","54","443  >  56901 [ACK] Seq=502 Ack=801 Win=31744 Len=0"
"365","17.103521","49.206.251.161","192.168.4.113","TLSv1.3","89","Application Data"
"366","17.103521","49.206.251.161","192.168.4.113","TLSv1.3","159","Application Data"
"367","17.103521","49.206.251.161","192.168.4.113","TLSv1.3","85","Application Data"
"368","17.103521","49.206.251.161","192.168.4.113","TLSv1.3","85","Application Data"
"369","17.103594","192.168.4.113","49.206.251.161","TCP","54","56901  >  443 [ACK] Seq=839 Ack=673 Win=261376 Len=0"
"370","17.103619","192.168.4.113","49.206.251.161","TCP","54","56905  >  443 [ACK] Seq=481 Ack=3430 Win=261632 Len=0"
"371","17.103654","157.240.242.60","192.168.4.113","TLSv1.3","266","Server Hello, Change Cipher Spec, Application Data"
"372","17.103687","192.168.4.113","157.240.242.60","TCP","54","56906  >  443 [ACK] Seq=483 Ack=213 Win=261888 Len=0"
"373","17.103743","49.206.251.161","192.168.4.113","TLSv1.3","89","Application Data"
"374","17.103743","49.206.251.161","192.168.4.113","TLSv1.3","94","Application Data"
"375","17.103743","49.206.251.161","192.168.4.113","TLSv1.3","85","Application Data"
"376","17.103815","192.168.4.113","49.206.251.161","TCP","54","56901  >  443 [ACK] Seq=839 Ack=779 Win=261120 Len=0"
"377","17.104494","192.168.4.113","49.205.75.99","TLSv1.3","182","Application Data"
"378","17.105998","192.168.4.113","157.240.237.60","TLSv1.3","178","Application Data"
"379","17.106343","192.168.4.113","106.51.32.34","TLSv1.3","182","Application Data"
"380","17.106574","202.83.26.162","192.168.4.113","TCP","54","443  >  56904 [ACK] Seq=501 Ack=799 Win=31744 Len=0"
"381","17.106574","202.83.26.162","192.168.4.113","TLSv1.3","89","Application Data"
"382","17.106574","202.83.26.162","192.168.4.113","TLSv1.3","159","Application Data"
"383","17.106574","202.83.26.162","192.168.4.113","TLSv1.3","85","Application Data"
"384","17.106636","192.168.4.113","202.83.26.162","TCP","54","56904  >  443 [ACK] Seq=799 Ack=672 Win=261376 Len=0"
"385","17.106687","157.240.192.52","192.168.4.113","TLSv1.3","225","Application Data"
"386","17.106687","157.240.192.52","192.168.4.113","TLSv1.3","128","Application Data"
"387","17.106725","192.168.4.113","157.240.192.52","TCP","54","56903  >  443 [ACK] Seq=627 Ack=458 Win=261632 Len=0"
"388","17.107419","49.205.75.99","192.168.4.113","TCP","54","443  >  56899 [ACK] Seq=501 Ack=799 Win=31744 Len=0"
"389","17.107419","49.205.75.99","192.168.4.113","TLSv1.3","89","Application Data"
"390","17.107419","49.205.75.99","192.168.4.113","TLSv1.3","159","Application Data"
"391","17.107419","49.205.75.99","192.168.4.113","TLSv1.3","85","Application Data"
"392","17.107480","192.168.4.113","49.205.75.99","TCP","54","56899  >  443 [ACK] Seq=799 Ack=672 Win=261376 Len=0"
"393","17.107811","192.168.4.113","202.83.26.162","TLSv1.3","92","Application Data"
"394","17.108232","192.168.4.113","157.240.242.60","TLSv1.3","118","Change Cipher Spec, Application Data"
"395","17.108784","192.168.4.113","49.205.75.99","TLSv1.3","92","Application Data"
"396","17.108948","106.51.32.34","192.168.4.113","TCP","54","443  >  56907 [ACK] Seq=502 Ack=801 Win=31744 Len=0"
"397","17.108948","106.51.32.34","192.168.4.113","TLSv1.3","89","Application Data"
"398","17.108948","106.51.32.34","192.168.4.113","TLSv1.3","159","Application Data"
"399","17.108948","106.51.32.34","192.168.4.113","TLSv1.3","85","Application Data"
"400","17.109009","192.168.4.113","106.51.32.34","TCP","54","56907  >  443 [ACK] Seq=801 Ack=673 Win=261376 Len=0"
"401","17.109427","192.168.4.113","157.240.242.60","TLSv1.3","134","Application Data"
"402","17.109839","192.168.4.113","157.240.192.52","TLSv1.3","85","Application Data"
"403","17.109839","192.168.4.113","106.51.32.34","TLSv1.3","85","Application Data"
"404","17.109848","192.168.4.113","157.240.23.53","TLSv1.3","178","Application Data"
"405","17.109947","192.168.4.113","157.240.192.52","TLSv1.3","181","Application Data"
"406","17.110573","202.83.26.162","192.168.4.113","TLSv1.3","89","Application Data"
"407","17.110573","202.83.26.162","192.168.4.113","TLSv1.3","94","Application Data"
"408","17.110573","202.83.26.162","192.168.4.113","TLSv1.3","85","Application Data"
"409","17.110651","192.168.4.113","202.83.26.162","TCP","54","56904  >  443 [ACK] Seq=837 Ack=778 Win=261120 Len=0"
"410","17.110688","192.168.4.113","106.51.32.34","TLSv1.3","92","Application Data"
"411","17.110869","157.240.192.52","192.168.4.113","TLSv1.3","85","Application Data"
"412","17.110924","192.168.4.113","157.240.192.52","TCP","54","56903  >  443 [ACK] Seq=785 Ack=489 Win=261632 Len=0"
"413","17.110978","49.205.75.99","192.168.4.113","TLSv1.3","89","Application Data"
"414","17.110978","49.205.75.99","192.168.4.113","TLSv1.3","94","Application Data"
"415","17.111036","192.168.4.113","49.205.75.99","TCP","54","56899  >  443 [ACK] Seq=837 Ack=747 Win=261376 Len=0"
"416","17.111652","49.205.75.99","192.168.4.113","TLSv1.3","85","Application Data"
"417","17.111701","192.168.4.113","49.205.75.99","TCP","54","56899  >  443 [ACK] Seq=837 Ack=778 Win=261120 Len=0"
"418","17.111751","192.168.4.113","157.240.192.52","TLSv1.3","172","Application Data"
"419","17.112759","157.240.23.53","192.168.4.113","TLSv1.3","225","Application Data"
"420","17.112759","157.240.23.53","192.168.4.113","TLSv1.3","128","Application Data"
"421","17.112759","157.240.23.53","192.168.4.113","TLSv1.3","85","Application Data"
"422","17.112818","192.168.4.113","157.240.23.53","TCP","54","56902  >  443 [ACK] Seq=751 Ack=489 Win=261632 Len=0"
"423","17.113219","157.240.237.60","192.168.4.113","TLSv1.3","225","Application Data"
"424","17.113319","192.168.4.113","157.240.237.60","TCP","54","56900  >  443 [ACK] Seq=751 Ack=384 Win=261632 Len=0"
"425","17.113684","106.51.32.34","192.168.4.113","TLSv1.3","89","Application Data"
"426","17.113684","106.51.32.34","192.168.4.113","TLSv1.3","94","Application Data"
"427","17.113684","106.51.32.34","192.168.4.113","TLSv1.3","85","Application Data"
"428","17.113736","192.168.4.113","106.51.32.34","TCP","54","56907  >  443 [ACK] Seq=839 Ack=779 Win=261120 Len=0"
"429","17.114199","192.168.4.113","157.240.23.53","TLSv1.3","85","Application Data"
"430","17.115497","157.240.237.60","192.168.4.113","TLSv1.3","128","Application Data"
"431","17.115548","192.168.4.113","157.240.237.60","TCP","54","56900  >  443 [ACK] Seq=751 Ack=458 Win=261632 Len=0"
"432","17.115703","192.168.4.113","157.240.237.60","TLSv1.3","85","Application Data"
"433","17.116515","192.168.4.113","157.240.242.60","TLSv1.3","178","Application Data"
"434","17.119649","157.240.192.52","192.168.4.113","TCP","54","443  >  56903 [ACK] Seq=489 Ack=785 Win=66816 Len=0"
"435","17.119649","157.240.192.52","192.168.4.113","TLSv1.3","89","Application Data"
"436","17.119649","157.240.237.60","192.168.4.113","TLSv1.3","85","Application Data"
"437","17.119727","192.168.4.113","157.240.192.52","TCP","54","56903  >  443 [ACK] Seq=785 Ack=524 Win=261376 Len=0"
"438","17.119761","192.168.4.113","157.240.237.60","TCP","54","56900  >  443 [ACK] Seq=782 Ack=489 Win=261632 Len=0"
"439","17.121762","157.240.192.52","192.168.4.113","TLSv1.3","159","Application Data"
"440","17.121762","157.240.192.52","192.168.4.113","TLSv1.3","85","Application Data"
"441","17.121762","157.240.23.53","192.168.4.113","TLSv1.3","89","Application Data"
"442","17.121762","157.240.23.53","192.168.4.113","TLSv1.3","159","Application Data"
"443","17.121762","157.240.23.53","192.168.4.113","TLSv1.3","85","Application Data"
"444","17.121889","192.168.4.113","157.240.192.52","TCP","54","56903  >  443 [ACK] Seq=785 Ack=660 Win=261376 Len=0"
"445","17.121943","192.168.4.113","157.240.23.53","TCP","54","56902  >  443 [ACK] Seq=782 Ack=660 Win=261376 Len=0"
"446","17.122318","157.240.192.52","192.168.4.113","TCP","54","443  >  56897 [ACK] Seq=489 Ack=763 Win=66816 Len=0"
"447","17.122318","157.240.192.52","192.168.4.113","TLSv1.3","89","Application Data"
"448","17.122318","157.240.192.52","192.168.4.113","TLSv1.3","159","Application Data"
"449","17.122318","157.240.192.52","192.168.4.113","TLSv1.3","85","Application Data"
"450","17.122365","192.168.4.113","157.240.192.52","TCP","54","56897  >  443 [ACK] Seq=763 Ack=660 Win=261376 Len=0"
"451","17.123149","49.205.75.99","192.168.4.113","TCP","54","443  >  56898 [ACK] Seq=3425 Ack=480 Win=31744 Len=0"
"452","17.124374","157.240.237.60","192.168.4.113","TLSv1.3","89","Application Data"
"453","17.124416","192.168.4.113","157.240.237.60","TCP","54","56900  >  443 [ACK] Seq=782 Ack=524 Win=261376 Len=0"
"454","17.124878","157.240.237.60","192.168.4.113","TLSv1.3","159","Application Data"
"455","17.124878","157.240.237.60","192.168.4.113","TLSv1.3","85","Application Data"
"456","17.124913","192.168.4.113","157.240.237.60","TCP","54","56900  >  443 [ACK] Seq=782 Ack=660 Win=261376 Len=0"
"457","17.126020","202.83.26.162","192.168.4.113","TCP","54","443  >  56909 [ACK] Seq=3426 Ack=480 Win=31744 Len=0"
"458","17.130553","157.240.242.60","192.168.4.113","TLSv1.3","225","Application Data"
"459","17.130553","157.240.242.60","192.168.4.113","TLSv1.3","128","Application Data"
"460","17.130553","157.240.242.60","192.168.4.113","TLSv1.3","85","Application Data"
"461","17.130618","192.168.4.113","157.240.242.60","TCP","54","56906  >  443 [ACK] Seq=751 Ack=489 Win=261632 Len=0"
"462","17.132156","192.168.4.113","157.240.242.60","TLSv1.3","85","Application Data"
"463","17.136862","157.240.242.60","192.168.4.113","TLSv1.3","89","Application Data"
"464","17.136987","192.168.4.113","157.240.242.60","TCP","54","56906  >  443 [ACK] Seq=782 Ack=524 Win=261376 Len=0"
"465","17.137149","157.240.242.60","192.168.4.113","TLSv1.3","159","Application Data"
"466","17.137149","157.240.242.60","192.168.4.113","TLSv1.3","85","Application Data"
"467","17.137187","192.168.4.113","157.240.242.60","TCP","54","56906  >  443 [ACK] Seq=782 Ack=660 Win=261376 Len=0"
"468","17.145055","49.206.251.161","192.168.4.113","TCP","54","443  >  56905 [ACK] Seq=3430 Ack=481 Win=31744 Len=0"
"469","17.147310","192.168.4.113","202.83.26.162","TLSv1.3","235","Application Data"
"470","17.150573","202.83.26.162","192.168.4.113","TLSv1.3","89","Application Data"
"471","17.150573","202.83.26.162","192.168.4.113","TLSv1.3","418","Application Data"
"472","17.150573","202.83.26.162","192.168.4.113","TLSv1.3","77","Application Data"
"473","17.150573","202.83.26.162","192.168.4.113","TCP","1446","443  >  56904 [ACK] Seq=1200 Ack=1018 Win=31744 Len=1392 [TCP segment of a reassembled PDU]"
"474","17.150683","192.168.4.113","202.83.26.162","TCP","54","56904  >  443 [ACK] Seq=1018 Ack=2592 Win=262144 Len=0"
"475","17.151064","202.83.26.162","192.168.4.113","TCP","1446","443  >  56904 [ACK] Seq=2592 Ack=1018 Win=31744 Len=1392 [TCP segment of a reassembled PDU]"
"476","17.151064","202.83.26.162","192.168.4.113","TLSv1.3","485","Application Data"
"477","17.151142","192.168.4.113","202.83.26.162","TCP","54","56904  >  443 [ACK] Seq=1018 Ack=4415 Win=262144 Len=0"
"478","17.153237","106.51.32.34","192.168.4.113","TCP","54","443  >  56908 [ACK] Seq=3432 Ack=481 Win=31744 Len=0"
"479","17.165555","157.240.23.53","192.168.4.113","TCP","54","443  >  56902 [ACK] Seq=660 Ack=782 Win=66816 Len=0"
"480","17.175679","157.240.237.60","192.168.4.113","TCP","54","443  >  56900 [ACK] Seq=660 Ack=782 Win=66816 Len=0"
"481","17.193912","157.240.242.60","192.168.4.113","TCP","54","443  >  56906 [ACK] Seq=660 Ack=782 Win=66816 Len=0"
"482","17.970414","192.168.4.113","49.205.75.99","TCP","54","[TCP Retransmission] 56850  >  443 [FIN, ACK] Seq=1 Ack=1 Win=1020 Len=0"
"483","17.970538","192.168.4.113","49.206.251.161","TCP","54","[TCP Retransmission] 56848  >  443 [FIN, ACK] Seq=1 Ack=1 Win=1021 Len=0"
"484","17.970572","192.168.4.113","49.206.251.161","TCP","54","[TCP Retransmission] 56846  >  443 [FIN, ACK] Seq=1 Ack=1 Win=1021 Len=0"
"485","17.970599","192.168.4.113","202.83.26.162","TCP","54","[TCP Retransmission] 56857  >  443 [FIN, ACK] Seq=1 Ack=1 Win=1022 Len=0"
"486","17.970628","192.168.4.113","106.51.32.34","TCP","54","[TCP Retransmission] 56856  >  443 [FIN, ACK] Seq=1 Ack=1 Win=1022 Len=0"
"487","17.970663","192.168.4.113","49.205.75.99","TCP","54","[TCP Retransmission] 56855  >  443 [FIN, ACK] Seq=1 Ack=1 Win=1022 Len=0"
"488","17.970693","192.168.4.113","157.240.237.60","TCP","54","[TCP Retransmission] 56851  >  443 [FIN, ACK] Seq=1 Ack=1 Win=1021 Len=0"
"489","17.970723","192.168.4.113","157.240.23.53","TCP","54","[TCP Retransmission] 56854  >  443 [FIN, ACK] Seq=1 Ack=1 Win=1021 Len=0"
"490","17.970797","192.168.4.113","157.240.192.52","TCP","54","[TCP Retransmission] 56849  >  443 [FIN, ACK] Seq=1 Ack=1 Win=1021 Len=0"
"491","17.970831","192.168.4.113","157.240.192.52","TCP","54","[TCP Retransmission] 56853  >  443 [FIN, ACK] Seq=1 Ack=1 Win=1021 Len=0"
"492","17.970899","192.168.4.113","202.83.26.162","TCP","54","[TCP Retransmission] 56852  >  443 [FIN, ACK] Seq=1 Ack=1 Win=1023 Len=0"
"493","17.970933","192.168.4.113","157.240.242.60","TCP","54","[TCP Retransmission] 56847  >  443 [FIN, ACK] Seq=1 Ack=1 Win=1021 Len=0"
"494","17.970969","192.168.4.113","106.51.32.34","TCP","54","[TCP Retransmission] 56845  >  443 [FIN, ACK] Seq=1 Ack=1 Win=1020 Len=0"
"495","19.183407","192.168.4.113","142.250.182.78","UDP","71","58173  >  443 Len=29"
"496","19.191260","192.168.4.113","142.250.193.99","QUIC","1292","Initial, DCID=3c016ad0e7210d15, PKN: 1, CRYPTO"
"497","19.191490","192.168.4.113","142.250.193.99","QUIC","1292","Initial, DCID=3c016ad0e7210d15, PKN: 2, PING, PING, CRYPTO, PADDING, CRYPTO, CRYPTO, PADDING, PING, PING, PING, CRYPTO"
"498","19.191970","192.168.4.113","142.250.193.99","QUIC","124","0-RTT, DCID=3c016ad0e7210d15"
"499","19.192782","192.168.4.113","142.250.193.99","QUIC","880","0-RTT, DCID=3c016ad0e7210d15"
"500","19.197330","142.250.182.78","192.168.4.113","UDP","68","443  >  58173 Len=26"
"501","19.214775","142.250.193.99","192.168.4.113","QUIC","1292","Initial, SCID=fc016ad0e7210d15, PKN: 1, ACK, PADDING"
"502","19.241294","142.250.193.99","192.168.4.113","QUIC","1292","Initial, SCID=fc016ad0e7210d15, PKN: 2, CRYPTO, PADDING"
"503","19.241737","142.250.193.99","192.168.4.113","QUIC","343","Protected Payload (KP0)"
"504","19.242722","192.168.4.113","142.250.193.99","QUIC","1292","Handshake, DCID=fc016ad0e7210d15"
"505","19.243166","142.250.193.99","192.168.4.113","QUIC","986","Protected Payload (KP0)"
"506","19.243568","192.168.4.113","142.250.193.99","QUIC","73","Protected Payload (KP0), DCID=fc016ad0e7210d15"
"507","19.245438","142.250.193.99","192.168.4.113","QUIC","67","Protected Payload (KP0)"
"508","19.245614","142.250.193.99","192.168.4.113","QUIC","64","Protected Payload (KP0)"
"509","19.255888","142.250.193.99","192.168.4.113","QUIC","162","Protected Payload (KP0)"
"510","19.256358","192.168.4.113","142.250.193.99","QUIC","73","Protected Payload (KP0), DCID=fc016ad0e7210d15"
"511","19.274560","142.250.193.99","192.168.4.113","QUIC","574","Protected Payload (KP0)"
"512","19.274733","142.250.193.99","192.168.4.113","QUIC","64","Protected Payload (KP0)"
"513","19.275356","192.168.4.113","142.250.193.99","QUIC","77","Protected Payload (KP0), DCID=fc016ad0e7210d15"
"514","19.285009","142.250.193.99","192.168.4.113","QUIC","67","Protected Payload (KP0)"
"515","19.433592","192.168.4.113","142.250.71.42","UDP","71","58511  >  443 Len=29"
"516","19.446760","142.250.71.42","192.168.4.113","UDP","67","443  >  58511 Len=25"
"517","19.968968","192.168.4.106","224.0.0.251","MDNS","119","Standard query 0x0005 PTR _C1EB68AE._sub._googlecast._tcp.local, ""QM"" question PTR _233637DE._sub._googlecast._tcp.local, ""QM"" question PTR _googlecast._tcp.local, ""QM"" question"
"518","20.341307","192.168.4.113","142.250.182.106","TCP","55","56892  >  443 [ACK] Seq=1 Ack=1 Win=509 Len=1 [TCP segment of a reassembled PDU]"
"519","20.352320","142.250.182.106","192.168.4.113","TCP","66","443  >  56892 [ACK] Seq=1 Ack=2 Win=279 Len=0 SLE=1 SRE=2"
"520","20.372199","192.168.4.113","49.205.75.99","TCP","54","[TCP Retransmission] 56850  >  443 [FIN, ACK] Seq=1 Ack=1 Win=1020 Len=0"
"521","20.372305","192.168.4.113","49.206.251.161","TCP","54","[TCP Retransmission] 56848  >  443 [FIN, ACK] Seq=1 Ack=1 Win=1021 Len=0"
"522","20.372328","192.168.4.113","49.206.251.161","TCP","54","[TCP Retransmission] 56846  >  443 [FIN, ACK] Seq=1 Ack=1 Win=1021 Len=0"
"523","20.372356","192.168.4.113","202.83.26.162","TCP","54","[TCP Retransmission] 56857  >  443 [FIN, ACK] Seq=1 Ack=1 Win=1022 Len=0"
"524","20.372381","192.168.4.113","106.51.32.34","TCP","54","[TCP Retransmission] 56856  >  443 [FIN, ACK] Seq=1 Ack=1 Win=1022 Len=0"
"525","20.372405","192.168.4.113","49.205.75.99","TCP","54","[TCP Retransmission] 56855  >  443 [FIN, ACK] Seq=1 Ack=1 Win=1022 Len=0"
"526","20.372429","192.168.4.113","157.240.237.60","TCP","54","[TCP Retransmission] 56851  >  443 [FIN, ACK] Seq=1 Ack=1 Win=1021 Len=0"
"527","20.372453","192.168.4.113","157.240.23.53","TCP","54","[TCP Retransmission] 56854  >  443 [FIN, ACK] Seq=1 Ack=1 Win=1021 Len=0"
"528","20.372480","192.168.4.113","157.240.192.52","TCP","54","[TCP Retransmission] 56849  >  443 [FIN, ACK] Seq=1 Ack=1 Win=1021 Len=0"
"529","20.372504","192.168.4.113","157.240.192.52","TCP","54","[TCP Retransmission] 56853  >  443 [FIN, ACK] Seq=1 Ack=1 Win=1021 Len=0"
"530","20.372526","192.168.4.113","202.83.26.162","TCP","54","[TCP Retransmission] 56852  >  443 [FIN, ACK] Seq=1 Ack=1 Win=1023 Len=0"
"531","20.372551","192.168.4.113","157.240.242.60","TCP","54","[TCP Retransmission] 56847  >  443 [FIN, ACK] Seq=1 Ack=1 Win=1021 Len=0"
"532","20.372574","192.168.4.113","106.51.32.34","TCP","54","[TCP Retransmission] 56845  >  443 [FIN, ACK] Seq=1 Ack=1 Win=1020 Len=0"
"533","23.573177","192.168.4.113","157.240.23.54","TCP","1197","56896  >  5222 [PSH, ACK] Seq=1251 Ack=4992 Win=132096 Len=1143 [TCP segment of a reassembled PDU]"
"534","23.585860","157.240.23.54","192.168.4.113","TCP","54","5222  >  56896 [ACK] Seq=4992 Ack=2394 Win=73216 Len=0"
"535","23.860140","157.240.23.54","192.168.4.113","TCP","93","5222  >  56896 [PSH, ACK] Seq=4992 Ack=2394 Win=73216 Len=39 [TCP segment of a reassembled PDU]"
"536","23.909564","192.168.4.113","157.240.23.54","TCP","54","56896  >  5222 [ACK] Seq=2394 Ack=5031 Win=132096 Len=0"
"537","25.182371","192.168.4.113","49.205.75.99","TCP","54","[TCP Retransmission] 56850  >  443 [FIN, ACK] Seq=1 Ack=1 Win=1020 Len=0"
"538","25.182475","192.168.4.113","49.206.251.161","TCP","54","[TCP Retransmission] 56848  >  443 [FIN, ACK] Seq=1 Ack=1 Win=1021 Len=0"
"539","25.182501","192.168.4.113","49.206.251.161","TCP","54","[TCP Retransmission] 56846  >  443 [FIN, ACK] Seq=1 Ack=1 Win=1021 Len=0"
"540","25.182525","192.168.4.113","202.83.26.162","TCP","54","[TCP Retransmission] 56857  >  443 [FIN, ACK] Seq=1 Ack=1 Win=1022 Len=0"
"541","25.182548","192.168.4.113","106.51.32.34","TCP","54","[TCP Retransmission] 56856  >  443 [FIN, ACK] Seq=1 Ack=1 Win=1022 Len=0"
"542","25.182571","192.168.4.113","49.205.75.99","TCP","54","[TCP Retransmission] 56855  >  443 [FIN, ACK] Seq=1 Ack=1 Win=1022 Len=0"
"543","25.182594","192.168.4.113","157.240.237.60","TCP","54","[TCP Retransmission] 56851  >  443 [FIN, ACK] Seq=1 Ack=1 Win=1021 Len=0"
"544","25.182618","192.168.4.113","157.240.23.53","TCP","54","[TCP Retransmission] 56854  >  443 [FIN, ACK] Seq=1 Ack=1 Win=1021 Len=0"
"545","25.182642","192.168.4.113","157.240.192.52","TCP","54","[TCP Retransmission] 56849  >  443 [FIN, ACK] Seq=1 Ack=1 Win=1021 Len=0"
"546","25.182665","192.168.4.113","157.240.192.52","TCP","54","[TCP Retransmission] 56853  >  443 [FIN, ACK] Seq=1 Ack=1 Win=1021 Len=0"
"547","25.182688","192.168.4.113","202.83.26.162","TCP","54","[TCP Retransmission] 56852  >  443 [FIN, ACK] Seq=1 Ack=1 Win=1023 Len=0"
"548","25.182711","192.168.4.113","157.240.242.60","TCP","54","[TCP Retransmission] 56847  >  443 [FIN, ACK] Seq=1 Ack=1 Win=1021 Len=0"
"549","25.182736","192.168.4.113","106.51.32.34","TCP","54","[TCP Retransmission] 56845  >  443 [FIN, ACK] Seq=1 Ack=1 Win=1020 Len=0"
"550","25.731536","192.168.4.113","216.239.38.223","TLSv1.2","78","Application Data"
"551","25.731915","192.168.4.113","216.239.38.223","TCP","54","56870  >  443 [FIN, ACK] Seq=25 Ack=1 Win=508 Len=0"
"552","25.734259","142.250.182.78","192.168.4.113","UDP","79","443  >  58173 Len=37"
"553","25.734259","142.250.182.78","192.168.4.113","UDP","78","443  >  58173 Len=36"
"554","25.734259","142.250.182.78","192.168.4.113","UDP","127","443  >  58173 Len=85"
"555","25.743554","192.168.4.113","142.250.182.78","UDP","75","58173  >  443 Len=33"
"556","25.743862","216.239.38.223","192.168.4.113","TCP","54","443  >  56870 [RST] Seq=1 Win=0 Len=0"
"557","25.746059","192.168.4.113","142.250.182.78","UDP","539","58173  >  443 Len=497"
"558","25.759366","142.250.182.78","192.168.4.113","UDP","75","443  >  58173 Len=33"
"559","25.776259","192.168.4.113","142.250.182.78","UDP","75","58173  >  443 Len=33"
"560","25.907912","142.250.71.42","192.168.4.113","UDP","200","443  >  58511 Len=158"
"561","25.907912","142.250.71.42","192.168.4.113","UDP","64","443  >  58511 Len=22"
"562","25.920817","192.168.4.113","142.250.71.42","UDP","75","58511  >  443 Len=33"
"563","25.938346","192.168.4.113","142.250.71.42","QUIC","1292","Initial, DCID=41f47e05471a81ad, PKN: 1, CRYPTO"
"564","25.938524","192.168.4.113","142.250.71.42","QUIC","1292","Initial, DCID=41f47e05471a81ad, PKN: 2, PING, PING, CRYPTO, PADDING, PING, PING, PING, PADDING, PING"
"565","25.938892","192.168.4.113","142.250.71.42","QUIC","121","0-RTT, DCID=41f47e05471a81ad"
"566","25.939488","192.168.4.113","142.250.71.42","QUIC","570","0-RTT, DCID=41f47e05471a81ad"
"567","25.949061","142.250.71.42","192.168.4.113","QUIC","1292","Initial, SCID=e1f47e05471a81ad, PKN: 1, ACK, PADDING"
"568","25.954363","142.250.182.78","192.168.4.113","UDP","160","443  >  58173 Len=118"
"569","25.956911","192.168.4.113","142.250.182.78","UDP","82","58173  >  443 Len=40"
"570","25.967596","142.250.182.78","192.168.4.113","UDP","68","443  >  58173 Len=26"
"571","25.981111","142.250.71.42","192.168.4.113","QUIC","1292","Initial, SCID=e1f47e05471a81ad, PKN: 2, CRYPTO, PADDING"
"572","25.981111","142.250.71.42","192.168.4.113","QUIC","342","Protected Payload (KP0)"
"573","25.981111","142.250.71.42","192.168.4.113","QUIC","992","Protected Payload (KP0)"
"574","25.981319","142.250.71.42","192.168.4.113","QUIC","91","Protected Payload (KP0)"
"575","25.981319","142.250.71.42","192.168.4.113","QUIC","66","Protected Payload (KP0)"
"576","25.982626","192.168.4.113","142.250.71.42","QUIC","1292","Initial, DCID=e1f47e05471a81ad, PKN: 5, ACK, PADDING"
"577","25.983309","192.168.4.113","142.250.71.42","QUIC","120","Handshake, DCID=e1f47e05471a81ad"
"578","25.983554","192.168.4.113","142.250.71.42","QUIC","73","Protected Payload (KP0), DCID=e1f47e05471a81ad"
"579","26.000298","142.250.71.42","192.168.4.113","QUIC","162","Protected Payload (KP0)"
"580","26.000298","142.250.71.42","192.168.4.113","QUIC","64","Protected Payload (KP0)"
"581","26.000706","192.168.4.113","142.250.71.42","QUIC","73","Protected Payload (KP0), DCID=e1f47e05471a81ad"
"582","26.031716","192.168.4.113","142.250.71.42","QUIC","74","Protected Payload (KP0), DCID=e1f47e05471a81ad"
"583","26.036319","142.250.71.42","192.168.4.113","QUIC","64","Protected Payload (KP0)"
"584","26.036767","192.168.4.113","142.250.71.42","QUIC","75","Protected Payload (KP0), DCID=e1f47e05471a81ad"
"585","26.202830","192.168.4.113","142.250.71.42","QUIC","71","Protected Payload (KP0), DCID=e1f47e05471a81ad"
"586","26.205957","142.250.71.42","192.168.4.113","QUIC","241","Protected Payload (KP0)"
"587","26.205957","142.250.71.42","192.168.4.113","QUIC","63","Protected Payload (KP0)"
"588","26.206530","192.168.4.113","142.250.71.42","QUIC","79","Protected Payload (KP0), DCID=e1f47e05471a81ad"
"589","26.206681","192.168.4.113","142.250.71.42","QUIC","75","Protected Payload (KP0), DCID=e1f47e05471a81ad"
"590","26.211665","192.168.4.113","142.250.71.42","UDP","535","58511  >  443 Len=493"
"591","26.214804","142.250.71.42","192.168.4.113","QUIC","67","Protected Payload (KP0)"
"592","26.222824","142.250.71.42","192.168.4.113","UDP","71","443  >  58511 Len=29"
"593","26.233969","192.168.4.113","142.250.71.42","UDP","75","58511  >  443 Len=33"
"594","26.438278","192.168.4.113","142.250.71.42","UDP","71","58511  >  443 Len=29"
"595","26.441250","142.250.71.42","192.168.4.113","UDP","127","443  >  58511 Len=85"
"596","26.443964","192.168.4.113","142.250.71.42","UDP","79","58511  >  443 Len=37"
"597","26.451503","142.250.71.42","192.168.4.113","UDP","67","443  >  58511 Len=25"
"598","26.454419","142.250.71.42","192.168.4.113","UDP","67","443  >  58511 Len=25"
"599","26.656882","192.168.4.113","142.250.71.42","UDP","71","58511  >  443 Len=29"
"600","26.669093","142.250.71.42","192.168.4.113","UDP","67","443  >  58511 Len=25"
"601","26.874386","192.168.4.113","142.250.71.42","UDP","71","58511  >  443 Len=29"
"602","26.888209","142.250.71.42","192.168.4.113","UDP","67","443  >  58511 Len=25"
"603","27.093757","192.168.4.113","142.250.71.42","UDP","71","58511  >  443 Len=29"
"604","27.106253","142.250.71.42","192.168.4.113","UDP","67","443  >  58511 Len=25"
"605","27.312364","192.168.4.113","142.250.71.42","UDP","71","58511  >  443 Len=29"
"606","27.325657","142.250.71.42","192.168.4.113","UDP","67","443  >  58511 Len=25"
"607","27.529110","192.168.4.113","142.250.71.42","UDP","71","58511  >  443 Len=29"
"608","27.542024","142.250.71.42","192.168.4.113","UDP","67","443  >  58511 Len=25"
"609","27.749309","192.168.4.113","142.250.71.42","UDP","71","58511  >  443 Len=29"
"610","27.761470","142.250.71.42","192.168.4.113","UDP","67","443  >  58511 Len=25"
"611","28.168655","192.168.4.113","142.250.71.42","UDP","71","58511  >  443 Len=29"
"612","28.180996","142.250.71.42","192.168.4.113","UDP","67","443  >  58511 Len=25"
"613","28.984086","192.168.4.113","142.250.71.42","UDP","71","58511  >  443 Len=29"
"614","28.996776","142.250.71.42","192.168.4.113","UDP","67","443  >  58511 Len=25"
"615","30.605436","192.168.4.113","142.250.71.42","UDP","71","58511  >  443 Len=29"
"616","30.618390","142.250.71.42","192.168.4.113","UDP","67","443  >  58511 Len=25"
"617","31.292708","192.168.4.113","17.242.13.5","TLSv1.2","121","Application Data"
"618","31.321760","17.242.13.5","192.168.4.113","TLSv1.2","81","Application Data"
"619","31.370026","192.168.4.113","17.242.13.5","TCP","54","56291  >  5223 [ACK] Seq=68 Ack=28 Win=64125 Len=0"
"620","33.076475","142.250.77.138","192.168.4.113","TLSv1.2","102","Application Data"
"621","33.117680","192.168.4.113","142.250.77.138","TCP","54","54688  >  443 [ACK] Seq=1 Ack=97 Win=511 Len=0"
"622","33.823073","192.168.4.113","142.250.71.42","UDP","71","58511  >  443 Len=29"
"623","33.835861","142.250.71.42","192.168.4.113","UDP","67","443  >  58511 Len=25"
"624","34.510173","DLinkInterna_32:74:23","Broadcast","ARP","42","Who has 192.168.4.101? Tell 192.168.4.1"
"625","34.789786","192.168.4.113","49.205.75.99","TCP","54","56850  >  443 [RST, ACK] Seq=2 Ack=1 Win=0 Len=0"
"626","34.790172","192.168.4.113","49.206.251.161","TCP","54","56848  >  443 [RST, ACK] Seq=2 Ack=1 Win=0 Len=0"
"627","34.790215","192.168.4.113","49.206.251.161","TCP","54","56846  >  443 [RST, ACK] Seq=2 Ack=1 Win=0 Len=0"
"628","34.790259","192.168.4.113","202.83.26.162","TCP","54","56857  >  443 [RST, ACK] Seq=2 Ack=1 Win=0 Len=0"
"629","34.790307","192.168.4.113","106.51.32.34","TCP","54","56856  >  443 [RST, ACK] Seq=2 Ack=1 Win=0 Len=0"
"630","34.790349","192.168.4.113","49.205.75.99","TCP","54","56855  >  443 [RST, ACK] Seq=2 Ack=1 Win=0 Len=0"
"631","34.790393","192.168.4.113","157.240.237.60","TCP","54","56851  >  443 [RST, ACK] Seq=2 Ack=1 Win=0 Len=0"
"632","34.790433","192.168.4.113","157.240.23.53","TCP","54","56854  >  443 [RST, ACK] Seq=2 Ack=1 Win=0 Len=0"
"633","34.790471","192.168.4.113","157.240.192.52","TCP","54","56849  >  443 [RST, ACK] Seq=2 Ack=1 Win=0 Len=0"
"634","34.790504","192.168.4.113","157.240.192.52","TCP","54","56853  >  443 [RST, ACK] Seq=2 Ack=1 Win=0 Len=0"
"635","34.790535","192.168.4.113","202.83.26.162","TCP","54","56852  >  443 [RST, ACK] Seq=2 Ack=1 Win=0 Len=0"
"636","34.790572","192.168.4.113","157.240.242.60","TCP","54","56847  >  443 [RST, ACK] Seq=2 Ack=1 Win=0 Len=0"
"637","34.790603","192.168.4.113","106.51.32.34","TCP","54","56845  >  443 [RST, ACK] Seq=2 Ack=1 Win=0 Len=0"
"638","35.010600","192.168.4.113","18.155.33.113","TCP","54","56889  >  443 [FIN, ACK] Seq=1 Ack=1 Win=253 Len=0"
"639","35.025015","18.155.33.113","192.168.4.113","TCP","54","443  >  56889 [FIN, ACK] Seq=1 Ack=2 Win=147 Len=0"
"640","35.025134","192.168.4.113","18.155.33.113","TCP","54","56889  >  443 [ACK] Seq=2 Ack=2 Win=253 Len=0"
"641","35.201133","192.168.4.113","142.250.182.78","UDP","406","58173  >  443 Len=364"
"642","35.202162","192.168.4.113","142.250.182.78","UDP","1285","58173  >  443 Len=1243"
"643","35.202309","192.168.4.113","142.250.182.78","UDP","1292","58173  >  443 Len=1250"
"644","35.202429","192.168.4.113","142.250.182.78","UDP","640","58173  >  443 Len=598"
"645","35.216028","142.250.182.78","192.168.4.113","UDP","78","443  >  58173 Len=36"
"646","35.218728","192.168.4.113","142.250.182.78","UDP","75","58173  >  443 Len=33"
"647","35.220397","192.168.4.113","142.250.71.42","UDP","330","58511  >  443 Len=288"
"648","35.231126","142.250.71.42","192.168.4.113","UDP","71","443  >  58511 Len=29"
"649","35.245358","192.168.4.113","142.250.71.42","UDP","75","58511  >  443 Len=33"
"650","35.310212","142.250.182.78","192.168.4.113","UDP","733","443  >  58173 Len=691"
"651","35.311954","142.250.182.78","192.168.4.113","UDP","239","443  >  58173 Len=197"
"652","35.313206","192.168.4.113","142.250.182.78","UDP","81","58173  >  443 Len=39"
"653","35.323496","142.250.182.78","192.168.4.113","UDP","68","443  >  58173 Len=26"
"654","35.411891","142.250.182.78","192.168.4.113","UDP","130","443  >  58173 Len=88"
"655","35.412986","142.250.182.78","192.168.4.113","UDP","253","443  >  58173 Len=211"
"656","35.414771","192.168.4.113","142.250.182.78","UDP","82","58173  >  443 Len=40"
"657","35.425321","142.250.182.78","192.168.4.113","UDP","68","443  >  58173 Len=26"
"658","35.435149","192.168.4.113","142.250.71.42","UDP","71","58511  >  443 Len=29"
"659","35.435779","142.250.71.42","192.168.4.113","UDP","1160","443  >  58511 Len=1118"
"660","35.435779","142.250.71.42","192.168.4.113","UDP","63","443  >  58511 Len=21"
"661","35.439946","192.168.4.113","142.250.71.42","UDP","79","58511  >  443 Len=37"
"662","35.446090","142.250.71.42","192.168.4.113","UDP","67","443  >  58511 Len=25"
"663","35.449900","142.250.71.42","192.168.4.113","UDP","67","443  >  58511 Len=25"
"664","35.654677","192.168.4.113","142.250.71.42","UDP","71","58511  >  443 Len=29"
"665","35.667026","142.250.71.42","192.168.4.113","UDP","67","443  >  58511 Len=25"
"666","35.871626","192.168.4.113","142.250.71.42","UDP","71","58511  >  443 Len=29"
"667","35.879492","192.168.4.113","157.240.23.54","TCP","54","56896  >  5222 [FIN, ACK] Seq=2394 Ack=5031 Win=132096 Len=0"
"668","35.884309","142.250.71.42","192.168.4.113","UDP","67","443  >  58511 Len=25"
"669","35.931193","157.240.23.54","192.168.4.113","TCP","54","5222  >  56896 [ACK] Seq=5031 Ack=2395 Win=73216 Len=0"
"670","36.090708","192.168.4.113","142.250.71.42","UDP","71","58511  >  443 Len=29"
"671","36.102844","157.240.23.54","192.168.4.113","TCP","54","5222  >  56896 [FIN, ACK] Seq=5031 Ack=2395 Win=73216 Len=0"
"672","36.102914","192.168.4.113","157.240.23.54","TCP","54","56896  >  5222 [ACK] Seq=2395 Ack=5032 Win=132096 Len=0"
"673","36.103489","142.250.71.42","192.168.4.113","UDP","67","443  >  58511 Len=25"
"674","36.313027","192.168.4.113","142.250.71.42","UDP","71","58511  >  443 Len=29"
"675","36.326304","142.250.71.42","192.168.4.113","UDP","67","443  >  58511 Len=25"
"676","36.374455","192.168.4.113","172.217.166.35","QUIC","1292","Initial, DCID=003855ecfaeed479, PKN: 1, CRYPTO"
"677","36.374626","192.168.4.113","172.217.166.35","QUIC","1292","Initial, DCID=003855ecfaeed479, PKN: 2, CRYPTO, PADDING, CRYPTO, PADDING, CRYPTO, CRYPTO"
"678","36.374957","192.168.4.113","172.217.166.35","QUIC","124","0-RTT, DCID=003855ecfaeed479"
"679","36.412562","172.217.166.35","192.168.4.113","QUIC","1292","Initial, SCID=e03855ecfaeed479, PKN: 1, ACK, PADDING"
"680","36.474104","172.217.166.35","192.168.4.113","QUIC","1292","Initial, SCID=e03855ecfaeed479, PKN: 2, CRYPTO, PADDING"
"681","36.474104","172.217.166.35","192.168.4.113","QUIC","353","Protected Payload (KP0)"
"682","36.474104","172.217.166.35","192.168.4.113","QUIC","981","Protected Payload (KP0)"
"683","36.474104","172.217.166.35","192.168.4.113","QUIC","74","Protected Payload (KP0)"
"684","36.474104","172.217.166.35","192.168.4.113","QUIC","66","Protected Payload (KP0)"
"685","36.476421","192.168.4.113","172.217.166.35","QUIC","1292","Initial, DCID=e03855ecfaeed479, PKN: 4, ACK, PADDING"
"686","36.477711","192.168.4.113","172.217.166.35","QUIC","121","Handshake, DCID=e03855ecfaeed479"
"687","36.477980","192.168.4.113","172.217.166.35","QUIC","73","Protected Payload (KP0), DCID=e03855ecfaeed479"
"688","36.478822","192.168.4.113","172.217.166.35","QUIC","725","Protected Payload (KP0), DCID=e03855ecfaeed479"
"689","36.514439","172.217.166.35","192.168.4.113","QUIC","162","Protected Payload (KP0)"
"690","36.515954","172.217.166.35","192.168.4.113","QUIC","71","Protected Payload (KP0)"
"691","36.516469","192.168.4.113","172.217.166.35","QUIC","74","Protected Payload (KP0), DCID=e03855ecfaeed479"
"692","36.530591","192.168.4.113","142.250.71.42","UDP","71","58511  >  443 Len=29"
"693","36.541369","142.250.71.42","192.168.4.113","UDP","67","443  >  58511 Len=25"
"694","36.582571","172.217.166.35","192.168.4.113","QUIC","918","Protected Payload (KP0)"
"695","36.583177","172.217.166.35","192.168.4.113","QUIC","63","Protected Payload (KP0)"
"696","36.583345","192.168.4.113","172.217.166.35","QUIC","77","Protected Payload (KP0), DCID=e03855ecfaeed479"
"697","36.653223","172.217.166.35","192.168.4.113","QUIC","66","Protected Payload (KP0)"
"698","36.749722","192.168.4.113","142.250.71.42","UDP","71","58511  >  443 Len=29"
"699","36.762891","142.250.71.42","192.168.4.113","UDP","67","443  >  58511 Len=25"
"700","37.173014","192.168.4.113","142.250.71.42","UDP","71","58511  >  443 Len=29"
