"No.","Time","Source","Destination","Protocol","Length","Info"
"1","0.000000","127.0.0.1","127.0.0.1","TCP","45","49709  >  49711 [ACK] Seq=1 Ack=1 Win=8276 Len=1"
"2","0.000020","127.0.0.1","127.0.0.1","TCP","56","49711  >  49709 [ACK] Seq=1 Ack=2 Win=8310 Len=0 SLE=1 SRE=2"
"3","0.056494","127.0.0.1","127.0.0.1","TCP","2636","49709  >  52453 [PSH, ACK] Seq=1 Ack=1 Win=8405 Len=2592"
"4","0.056614","127.0.0.1","127.0.0.1","TCP","44","52453  >  49709 [ACK] Seq=1 Ack=2593 Win=8279 Len=0"
"5","0.062510","127.0.0.1","127.0.0.1","TCP","74","52453  >  49709 [PSH, ACK] Seq=1 Ack=2593 Win=8279 Len=30"
"6","0.062594","127.0.0.1","127.0.0.1","TCP","44","49709  >  52453 [ACK] Seq=2593 Ack=31 Win=8404 Len=0"
"7","0.063145","127.0.0.1","127.0.0.1","TCP","61","49709  >  52453 [PSH, ACK] Seq=2593 Ack=31 Win=8404 Len=17"
"8","0.063204","127.0.0.1","127.0.0.1","TCP","44","52453  >  49709 [ACK] Seq=31 Ack=2610 Win=8279 Len=0"
"9","0.325643","127.0.0.1","127.0.0.1","TCP","101","49708  >  52447 [PSH, ACK] Seq=1 Ack=1 Win=8386 Len=57"
"10","0.325671","127.0.0.1","127.0.0.1","TCP","44","52447  >  49708 [ACK] Seq=1 Ack=58 Win=8392 Len=0"
"11","0.325705","127.0.0.1","127.0.0.1","TCP","343","49708  >  52447 [PSH, ACK] Seq=58 Ack=1 Win=8386 Len=299"
"12","0.325713","127.0.0.1","127.0.0.1","TCP","44","52447  >  49708 [ACK] Seq=1 Ack=357 Win=8390 Len=0"
"13","0.347023","127.0.0.1","127.0.0.1","TCP","2638","49709  >  52453 [PSH, ACK] Seq=2610 Ack=31 Win=8404 Len=2594"
"14","0.347073","127.0.0.1","127.0.0.1","TCP","44","52453  >  49709 [ACK] Seq=31 Ack=5204 Win=8269 Len=0"
"15","0.348750","127.0.0.1","127.0.0.1","TCP","74","52453  >  49709 [PSH, ACK] Seq=31 Ack=5204 Win=8269 Len=30"
"16","0.348804","127.0.0.1","127.0.0.1","TCP","44","49709  >  52453 [ACK] Seq=5204 Ack=61 Win=8404 Len=0"
"17","0.348913","127.0.0.1","127.0.0.1","TCP","61","49709  >  52453 [PSH, ACK] Seq=5204 Ack=61 Win=8404 Len=17"
"18","0.348941","127.0.0.1","127.0.0.1","TCP","44","52453  >  49709 [ACK] Seq=61 Ack=5221 Win=8268 Len=0"
"19","0.391936","127.0.0.1","127.0.0.1","TCP","105","52447  >  49708 [PSH, ACK] Seq=1 Ack=357 Win=8390 Len=61"
"20","0.391992","127.0.0.1","127.0.0.1","TCP","44","49708  >  52447 [ACK] Seq=357 Ack=62 Win=8386 Len=0"
"21","0.392069","127.0.0.1","127.0.0.1","TCP","100","52447  >  49708 [PSH, ACK] Seq=62 Ack=357 Win=8390 Len=56"
"22","0.392085","127.0.0.1","127.0.0.1","TCP","44","49708  >  52447 [ACK] Seq=357 Ack=118 Win=8385 Len=0"
"23","0.392317","127.0.0.1","127.0.0.1","TCP","105","52447  >  49708 [PSH, ACK] Seq=118 Ack=357 Win=8390 Len=61"
"24","0.392342","127.0.0.1","127.0.0.1","TCP","44","49708  >  52447 [ACK] Seq=357 Ack=179 Win=8385 Len=0"
"25","0.392403","127.0.0.1","127.0.0.1","TCP","219","52447  >  49708 [PSH, ACK] Seq=179 Ack=357 Win=8390 Len=175"
"26","0.392425","127.0.0.1","127.0.0.1","TCP","44","49708  >  52447 [ACK] Seq=357 Ack=354 Win=8384 Len=0"
"27","0.568895","127.0.0.1","127.0.0.1","TCP","2634","49709  >  52453 [PSH, ACK] Seq=5221 Ack=61 Win=8404 Len=2590"
"28","0.568955","127.0.0.1","127.0.0.1","TCP","44","52453  >  49709 [ACK] Seq=61 Ack=7811 Win=8258 Len=0"
"29","0.569299","127.0.0.1","127.0.0.1","TCP","74","52453  >  49709 [PSH, ACK] Seq=61 Ack=7811 Win=8258 Len=30"
"30","0.569320","127.0.0.1","127.0.0.1","TCP","44","49709  >  52453 [ACK] Seq=7811 Ack=91 Win=8404 Len=0"
"31","0.569376","127.0.0.1","127.0.0.1","TCP","61","49709  >  52453 [PSH, ACK] Seq=7811 Ack=91 Win=8404 Len=17"
"32","0.569397","127.0.0.1","127.0.0.1","TCP","44","52453  >  49709 [ACK] Seq=91 Ack=7828 Win=8258 Len=0"
"33","0.630440","127.0.0.1","127.0.0.1","TCP","45","49692  >  49691 [PSH, ACK] Seq=1 Ack=1 Win=8442 Len=1"
"34","0.630469","127.0.0.1","127.0.0.1","TCP","44","49691  >  49692 [ACK] Seq=1 Ack=2 Win=8280 Len=0"
"35","0.630695","127.0.0.1","127.0.0.1","TCP","45","49689  >  49690 [PSH, ACK] Seq=1 Ack=1 Win=8442 Len=1"
"36","0.630708","127.0.0.1","127.0.0.1","TCP","44","49690  >  49689 [ACK] Seq=1 Ack=2 Win=8279 Len=0"
"37","0.630816","127.0.0.1","127.0.0.1","TCP","45","49692  >  49691 [PSH, ACK] Seq=2 Ack=1 Win=8442 Len=1"
"38","0.630825","127.0.0.1","127.0.0.1","TCP","44","49691  >  49692 [ACK] Seq=1 Ack=3 Win=8280 Len=0"
"39","0.630981","127.0.0.1","127.0.0.1","TCP","45","49689  >  49690 [PSH, ACK] Seq=2 Ack=1 Win=8442 Len=1"
"40","0.630989","127.0.0.1","127.0.0.1","TCP","44","49690  >  49689 [ACK] Seq=1 Ack=3 Win=8279 Len=0"
"41","0.631085","127.0.0.1","127.0.0.1","TCP","45","49692  >  49691 [PSH, ACK] Seq=3 Ack=1 Win=8442 Len=1"
"42","0.631098","127.0.0.1","127.0.0.1","TCP","44","49691  >  49692 [ACK] Seq=1 Ack=4 Win=8280 Len=0"
"43","0.631220","127.0.0.1","127.0.0.1","TCP","45","49689  >  49690 [PSH, ACK] Seq=3 Ack=1 Win=8442 Len=1"
"44","0.631226","127.0.0.1","127.0.0.1","TCP","44","49690  >  49689 [ACK] Seq=1 Ack=4 Win=8279 Len=0"
"45","0.631333","127.0.0.1","127.0.0.1","TCP","45","49692  >  49691 [PSH, ACK] Seq=4 Ack=1 Win=8442 Len=1"
"46","0.631342","127.0.0.1","127.0.0.1","TCP","44","49691  >  49692 [ACK] Seq=1 Ack=5 Win=8280 Len=0"
"47","0.631465","127.0.0.1","127.0.0.1","TCP","45","49689  >  49690 [PSH, ACK] Seq=4 Ack=1 Win=8442 Len=1"
"48","0.631471","127.0.0.1","127.0.0.1","TCP","44","49690  >  49689 [ACK] Seq=1 Ack=5 Win=8279 Len=0"
"49","0.631564","127.0.0.1","127.0.0.1","TCP","45","49692  >  49691 [PSH, ACK] Seq=5 Ack=1 Win=8442 Len=1"
"50","0.631571","127.0.0.1","127.0.0.1","TCP","44","49691  >  49692 [ACK] Seq=1 Ack=6 Win=8280 Len=0"
"51","0.631863","127.0.0.1","127.0.0.1","TCP","45","49689  >  49690 [PSH, ACK] Seq=5 Ack=1 Win=8442 Len=1"
"52","0.631874","127.0.0.1","127.0.0.1","TCP","44","49690  >  49689 [ACK] Seq=1 Ack=6 Win=8279 Len=0"
"53","0.688060","127.0.0.1","127.0.0.1","TCP","45","49689  >  49690 [PSH, ACK] Seq=6 Ack=1 Win=8442 Len=1"
"54","0.688086","127.0.0.1","127.0.0.1","TCP","44","49690  >  49689 [ACK] Seq=1 Ack=7 Win=8279 Len=0"
"55","0.688239","127.0.0.1","127.0.0.1","TCP","45","49692  >  49691 [PSH, ACK] Seq=6 Ack=1 Win=8442 Len=1"
"56","0.688266","127.0.0.1","127.0.0.1","TCP","44","49691  >  49692 [ACK] Seq=1 Ack=7 Win=8280 Len=0"
"57","0.688322","127.0.0.1","127.0.0.1","TCP","45","49692  >  49691 [PSH, ACK] Seq=7 Ack=1 Win=8442 Len=1"
"58","0.688342","127.0.0.1","127.0.0.1","TCP","44","49691  >  49692 [ACK] Seq=1 Ack=8 Win=8280 Len=0"
"59","0.688526","127.0.0.1","127.0.0.1","TCP","45","49689  >  49690 [PSH, ACK] Seq=7 Ack=1 Win=8442 Len=1"
"60","0.688534","127.0.0.1","127.0.0.1","TCP","44","49690  >  49689 [ACK] Seq=1 Ack=8 Win=8279 Len=0"
"61","0.688683","127.0.0.1","127.0.0.1","TCP","45","49692  >  49691 [PSH, ACK] Seq=8 Ack=1 Win=8442 Len=1"
"62","0.688692","127.0.0.1","127.0.0.1","TCP","44","49691  >  49692 [ACK] Seq=1 Ack=9 Win=8280 Len=0"
"63","0.688765","127.0.0.1","127.0.0.1","TCP","45","49689  >  49690 [PSH, ACK] Seq=8 Ack=1 Win=8442 Len=1"
"64","0.688771","127.0.0.1","127.0.0.1","TCP","44","49690  >  49689 [ACK] Seq=1 Ack=9 Win=8279 Len=0"
"65","0.688947","127.0.0.1","127.0.0.1","TCP","45","49692  >  49691 [PSH, ACK] Seq=9 Ack=1 Win=8442 Len=1"
"66","0.688974","127.0.0.1","127.0.0.1","TCP","44","49691  >  49692 [ACK] Seq=1 Ack=10 Win=8280 Len=0"
"67","0.689107","127.0.0.1","127.0.0.1","TCP","45","49689  >  49690 [PSH, ACK] Seq=9 Ack=1 Win=8442 Len=1"
"68","0.689114","127.0.0.1","127.0.0.1","TCP","44","49690  >  49689 [ACK] Seq=1 Ack=10 Win=8279 Len=0"
"69","0.788126","127.0.0.1","127.0.0.1","TCP","2641","49709  >  52453 [PSH, ACK] Seq=7828 Ack=91 Win=8404 Len=2597"
"70","0.788186","127.0.0.1","127.0.0.1","TCP","44","52453  >  49709 [ACK] Seq=91 Ack=10425 Win=8248 Len=0"
"71","0.788329","127.0.0.1","127.0.0.1","TCP","74","52453  >  49709 [PSH, ACK] Seq=91 Ack=10425 Win=8248 Len=30"
"72","0.788349","127.0.0.1","127.0.0.1","TCP","44","49709  >  52453 [ACK] Seq=10425 Ack=121 Win=8404 Len=0"
"73","0.788405","127.0.0.1","127.0.0.1","TCP","61","49709  >  52453 [PSH, ACK] Seq=10425 Ack=121 Win=8404 Len=17"
"74","0.788417","127.0.0.1","127.0.0.1","TCP","44","52453  >  49709 [ACK] Seq=121 Ack=10442 Win=8248 Len=0"
"75","0.993970","127.0.0.1","127.0.0.1","TCP","2648","49709  >  52453 [PSH, ACK] Seq=10442 Ack=121 Win=8404 Len=2604"
"76","0.994008","127.0.0.1","127.0.0.1","TCP","44","52453  >  49709 [ACK] Seq=121 Ack=13046 Win=8238 Len=0"
"77","0.994427","127.0.0.1","127.0.0.1","TCP","87","52453  >  49709 [PSH, ACK] Seq=121 Ack=13046 Win=8238 Len=43"
"78","0.994465","127.0.0.1","127.0.0.1","TCP","44","49709  >  52453 [ACK] Seq=13046 Ack=164 Win=8404 Len=0"
"79","0.995075","127.0.0.1","127.0.0.1","TCP","61","49709  >  52453 [PSH, ACK] Seq=13046 Ack=164 Win=8404 Len=17"
"80","0.995124","127.0.0.1","127.0.0.1","TCP","44","52453  >  49709 [ACK] Seq=164 Ack=13063 Win=8238 Len=0"
"81","1.214912","127.0.0.1","127.0.0.1","TCP","2649","49709  >  52453 [PSH, ACK] Seq=13063 Ack=164 Win=8404 Len=2605"
"82","1.214941","127.0.0.1","127.0.0.1","TCP","44","52453  >  49709 [ACK] Seq=164 Ack=15668 Win=8228 Len=0"
"83","1.215016","127.0.0.1","127.0.0.1","TCP","74","52453  >  49709 [PSH, ACK] Seq=164 Ack=15668 Win=8228 Len=30"
"84","1.215025","127.0.0.1","127.0.0.1","TCP","44","49709  >  52453 [ACK] Seq=15668 Ack=194 Win=8404 Len=0"
"85","1.215198","127.0.0.1","127.0.0.1","TCP","61","49709  >  52453 [PSH, ACK] Seq=15668 Ack=194 Win=8404 Len=17"
"86","1.215242","127.0.0.1","127.0.0.1","TCP","44","52453  >  49709 [ACK] Seq=194 Ack=15685 Win=8228 Len=0"
"87","1.481952","127.0.0.1","127.0.0.1","TCP","2639","49709  >  52453 [PSH, ACK] Seq=15685 Ack=194 Win=8404 Len=2595"
"88","1.482054","127.0.0.1","127.0.0.1","TCP","44","52453  >  49709 [ACK] Seq=194 Ack=18280 Win=8217 Len=0"
"89","1.483283","127.0.0.1","127.0.0.1","TCP","74","52453  >  49709 [PSH, ACK] Seq=194 Ack=18280 Win=8217 Len=30"
"90","1.483353","127.0.0.1","127.0.0.1","TCP","44","49709  >  52453 [ACK] Seq=18280 Ack=224 Win=8404 Len=0"
"91","1.483692","127.0.0.1","127.0.0.1","TCP","61","49709  >  52453 [PSH, ACK] Seq=18280 Ack=224 Win=8404 Len=17"
"92","1.483750","127.0.0.1","127.0.0.1","TCP","44","52453  >  49709 [ACK] Seq=224 Ack=18297 Win=8217 Len=0"
"93","1.639629","127.0.0.1","127.0.0.1","TCP","45","49692  >  49691 [PSH, ACK] Seq=10 Ack=1 Win=8442 Len=1"
"94","1.639711","127.0.0.1","127.0.0.1","TCP","44","49691  >  49692 [ACK] Seq=1 Ack=11 Win=8280 Len=0"
"95","1.640387","127.0.0.1","127.0.0.1","TCP","45","49689  >  49690 [PSH, ACK] Seq=10 Ack=1 Win=8442 Len=1"
"96","1.640413","127.0.0.1","127.0.0.1","TCP","44","49690  >  49689 [ACK] Seq=1 Ack=11 Win=8279 Len=0"
"97","1.640780","127.0.0.1","127.0.0.1","TCP","45","49692  >  49691 [PSH, ACK] Seq=11 Ack=1 Win=8442 Len=1"
"98","1.640846","127.0.0.1","127.0.0.1","TCP","44","49691  >  49692 [ACK] Seq=1 Ack=12 Win=8280 Len=0"
"99","1.641381","127.0.0.1","127.0.0.1","TCP","45","49689  >  49690 [PSH, ACK] Seq=11 Ack=1 Win=8442 Len=1"
"100","1.641399","127.0.0.1","127.0.0.1","TCP","44","49690  >  49689 [ACK] Seq=1 Ack=12 Win=8279 Len=0"
"101","1.641733","127.0.0.1","127.0.0.1","TCP","45","49692  >  49691 [PSH, ACK] Seq=12 Ack=1 Win=8442 Len=1"
"102","1.641798","127.0.0.1","127.0.0.1","TCP","44","49691  >  49692 [ACK] Seq=1 Ack=13 Win=8280 Len=0"
"103","1.642287","127.0.0.1","127.0.0.1","TCP","45","49689  >  49690 [PSH, ACK] Seq=12 Ack=1 Win=8442 Len=1"
"104","1.642303","127.0.0.1","127.0.0.1","TCP","44","49690  >  49689 [ACK] Seq=1 Ack=13 Win=8279 Len=0"
"105","1.642600","127.0.0.1","127.0.0.1","TCP","45","49692  >  49691 [PSH, ACK] Seq=13 Ack=1 Win=8442 Len=1"
"106","1.642664","127.0.0.1","127.0.0.1","TCP","44","49691  >  49692 [ACK] Seq=1 Ack=14 Win=8280 Len=0"
"107","1.643236","127.0.0.1","127.0.0.1","TCP","45","49689  >  49690 [PSH, ACK] Seq=13 Ack=1 Win=8442 Len=1"
"108","1.643252","127.0.0.1","127.0.0.1","TCP","44","49690  >  49689 [ACK] Seq=1 Ack=14 Win=8279 Len=0"
"109","1.643557","127.0.0.1","127.0.0.1","TCP","45","49692  >  49691 [PSH, ACK] Seq=14 Ack=1 Win=8442 Len=1"
"110","1.643620","127.0.0.1","127.0.0.1","TCP","44","49691  >  49692 [ACK] Seq=1 Ack=15 Win=8280 Len=0"
"111","1.644263","127.0.0.1","127.0.0.1","TCP","45","49689  >  49690 [PSH, ACK] Seq=14 Ack=1 Win=8442 Len=1"
"112","1.644279","127.0.0.1","127.0.0.1","TCP","44","49690  >  49689 [ACK] Seq=1 Ack=15 Win=8279 Len=0"
"113","1.764653","127.0.0.1","127.0.0.1","TCP","2654","49709  >  52453 [PSH, ACK] Seq=18297 Ack=224 Win=8404 Len=2610"
"114","1.764724","127.0.0.1","127.0.0.1","TCP","44","52453  >  49709 [ACK] Seq=224 Ack=20907 Win=8207 Len=0"
"115","1.764948","127.0.0.1","127.0.0.1","TCP","74","52453  >  49709 [PSH, ACK] Seq=224 Ack=20907 Win=8207 Len=30"
"116","1.765004","127.0.0.1","127.0.0.1","TCP","44","49709  >  52453 [ACK] Seq=20907 Ack=254 Win=8404 Len=0"
"117","1.765119","127.0.0.1","127.0.0.1","TCP","61","49709  >  52453 [PSH, ACK] Seq=20907 Ack=254 Win=8404 Len=17"
"118","1.765143","127.0.0.1","127.0.0.1","TCP","44","52453  >  49709 [ACK] Seq=254 Ack=20924 Win=8207 Len=0"
"119","1.909689","127.0.0.1","127.0.0.1","TCP","101","49708  >  52447 [PSH, ACK] Seq=357 Ack=354 Win=8384 Len=57"
"120","1.909740","127.0.0.1","127.0.0.1","TCP","44","52447  >  49708 [ACK] Seq=354 Ack=414 Win=8390 Len=0"
"121","1.909819","127.0.0.1","127.0.0.1","TCP","202","49708  >  52447 [PSH, ACK] Seq=414 Ack=354 Win=8384 Len=158"
"122","1.909836","127.0.0.1","127.0.0.1","TCP","44","52447  >  49708 [ACK] Seq=354 Ack=572 Win=8390 Len=0"
"123","1.910921","127.0.0.1","127.0.0.1","TCP","105","52447  >  49708 [PSH, ACK] Seq=354 Ack=572 Win=8390 Len=61"
"124","1.910964","127.0.0.1","127.0.0.1","TCP","44","49708  >  52447 [ACK] Seq=572 Ack=415 Win=8384 Len=0"
"125","1.911171","127.0.0.1","127.0.0.1","TCP","100","52447  >  49708 [PSH, ACK] Seq=415 Ack=572 Win=8390 Len=56"
"126","1.911205","127.0.0.1","127.0.0.1","TCP","44","49708  >  52447 [ACK] Seq=572 Ack=471 Win=8384 Len=0"
"127","1.911650","127.0.0.1","127.0.0.1","TCP","105","52447  >  49708 [PSH, ACK] Seq=471 Ack=572 Win=8390 Len=61"
"128","1.911680","127.0.0.1","127.0.0.1","TCP","44","49708  >  52447 [ACK] Seq=572 Ack=532 Win=8384 Len=0"
"129","1.911852","127.0.0.1","127.0.0.1","TCP","171","52447  >  49708 [PSH, ACK] Seq=532 Ack=572 Win=8390 Len=127"
"130","1.911883","127.0.0.1","127.0.0.1","TCP","44","49708  >  52447 [ACK] Seq=572 Ack=659 Win=8383 Len=0"
"131","2.017814","127.0.0.1","127.0.0.1","TCP","2644","49709  >  52453 [PSH, ACK] Seq=20924 Ack=254 Win=8404 Len=2600"
"132","2.017862","127.0.0.1","127.0.0.1","TCP","44","52453  >  49709 [ACK] Seq=254 Ack=23524 Win=8197 Len=0"
"133","2.026922","127.0.0.1","127.0.0.1","TCP","74","52453  >  49709 [PSH, ACK] Seq=254 Ack=23524 Win=8197 Len=30"
"134","2.026974","127.0.0.1","127.0.0.1","TCP","44","49709  >  52453 [ACK] Seq=23524 Ack=284 Win=8403 Len=0"
"135","2.028795","127.0.0.1","127.0.0.1","TCP","61","49709  >  52453 [PSH, ACK] Seq=23524 Ack=284 Win=8403 Len=17"
"136","2.028836","127.0.0.1","127.0.0.1","TCP","44","52453  >  49709 [ACK] Seq=284 Ack=23541 Win=8197 Len=0"
"137","2.314164","127.0.0.1","127.0.0.1","TCP","2639","49709  >  52453 [PSH, ACK] Seq=23541 Ack=284 Win=8403 Len=2595"
"138","2.314202","127.0.0.1","127.0.0.1","TCP","44","52453  >  49709 [ACK] Seq=284 Ack=26136 Win=8187 Len=0"
"139","2.314299","127.0.0.1","127.0.0.1","TCP","74","52453  >  49709 [PSH, ACK] Seq=284 Ack=26136 Win=8187 Len=30"
"140","2.314310","127.0.0.1","127.0.0.1","TCP","44","49709  >  52453 [ACK] Seq=26136 Ack=314 Win=8403 Len=0"
"141","2.314442","127.0.0.1","127.0.0.1","TCP","61","49709  >  52453 [PSH, ACK] Seq=26136 Ack=314 Win=8403 Len=17"
"142","2.314453","127.0.0.1","127.0.0.1","TCP","44","52453  >  49709 [ACK] Seq=314 Ack=26153 Win=8187 Len=0"
"143","2.519229","127.0.0.1","127.0.0.1","TCP","2654","49709  >  52453 [PSH, ACK] Seq=26153 Ack=314 Win=8403 Len=2610"
"144","2.519295","127.0.0.1","127.0.0.1","TCP","44","52453  >  49709 [ACK] Seq=314 Ack=28763 Win=8442 Len=0"
"145","2.519421","127.0.0.1","127.0.0.1","TCP","74","52453  >  49709 [PSH, ACK] Seq=314 Ack=28763 Win=8442 Len=30"
"146","2.519447","127.0.0.1","127.0.0.1","TCP","44","49709  >  52453 [ACK] Seq=28763 Ack=344 Win=8403 Len=0"
"147","2.522245","127.0.0.1","127.0.0.1","TCP","61","49709  >  52453 [PSH, ACK] Seq=28763 Ack=344 Win=8403 Len=17"
"148","2.522268","127.0.0.1","127.0.0.1","TCP","44","52453  >  49709 [ACK] Seq=344 Ack=28780 Win=8442 Len=0"
"149","2.644748","127.0.0.1","127.0.0.1","TCP","45","49692  >  49691 [PSH, ACK] Seq=15 Ack=1 Win=8442 Len=1"
"150","2.644778","127.0.0.1","127.0.0.1","TCP","44","49691  >  49692 [ACK] Seq=1 Ack=16 Win=8280 Len=0"
"151","2.645225","127.0.0.1","127.0.0.1","TCP","45","49689  >  49690 [PSH, ACK] Seq=15 Ack=1 Win=8442 Len=1"
"152","2.645244","127.0.0.1","127.0.0.1","TCP","44","49690  >  49689 [ACK] Seq=1 Ack=16 Win=8279 Len=0"
"153","2.645417","127.0.0.1","127.0.0.1","TCP","45","49692  >  49691 [PSH, ACK] Seq=16 Ack=1 Win=8442 Len=1"
"154","2.645428","127.0.0.1","127.0.0.1","TCP","44","49691  >  49692 [ACK] Seq=1 Ack=17 Win=8280 Len=0"
"155","2.645675","127.0.0.1","127.0.0.1","TCP","45","49689  >  49690 [PSH, ACK] Seq=16 Ack=1 Win=8442 Len=1"
"156","2.645684","127.0.0.1","127.0.0.1","TCP","44","49690  >  49689 [ACK] Seq=1 Ack=17 Win=8279 Len=0"
"157","2.645822","127.0.0.1","127.0.0.1","TCP","45","49692  >  49691 [PSH, ACK] Seq=17 Ack=1 Win=8442 Len=1"
"158","2.645842","127.0.0.1","127.0.0.1","TCP","44","49691  >  49692 [ACK] Seq=1 Ack=18 Win=8280 Len=0"
"159","2.646074","127.0.0.1","127.0.0.1","TCP","45","49689  >  49690 [PSH, ACK] Seq=17 Ack=1 Win=8442 Len=1"
"160","2.646083","127.0.0.1","127.0.0.1","TCP","44","49690  >  49689 [ACK] Seq=1 Ack=18 Win=8279 Len=0"
"161","2.646225","127.0.0.1","127.0.0.1","TCP","45","49692  >  49691 [PSH, ACK] Seq=18 Ack=1 Win=8442 Len=1"
"162","2.646233","127.0.0.1","127.0.0.1","TCP","44","49691  >  49692 [ACK] Seq=1 Ack=19 Win=8280 Len=0"
"163","2.646420","127.0.0.1","127.0.0.1","TCP","45","49689  >  49690 [PSH, ACK] Seq=18 Ack=1 Win=8442 Len=1"
"164","2.646429","127.0.0.1","127.0.0.1","TCP","44","49690  >  49689 [ACK] Seq=1 Ack=19 Win=8279 Len=0"
"165","2.646590","127.0.0.1","127.0.0.1","TCP","45","49692  >  49691 [PSH, ACK] Seq=19 Ack=1 Win=8442 Len=1"
"166","2.646598","127.0.0.1","127.0.0.1","TCP","44","49691  >  49692 [ACK] Seq=1 Ack=20 Win=8280 Len=0"
"167","2.646935","127.0.0.1","127.0.0.1","TCP","45","49689  >  49690 [PSH, ACK] Seq=19 Ack=1 Win=8442 Len=1"
"168","2.646944","127.0.0.1","127.0.0.1","TCP","44","49690  >  49689 [ACK] Seq=1 Ack=20 Win=8279 Len=0"
"169","2.708691","127.0.0.1","127.0.0.1","TCP","105","52447  >  49708 [PSH, ACK] Seq=659 Ack=572 Win=8390 Len=61"
"170","2.708762","127.0.0.1","127.0.0.1","TCP","44","49708  >  52447 [ACK] Seq=572 Ack=720 Win=8383 Len=0"
"171","2.709430","127.0.0.1","127.0.0.1","TCP","122","52447  >  49708 [PSH, ACK] Seq=720 Ack=572 Win=8390 Len=78"
"172","2.709479","127.0.0.1","127.0.0.1","TCP","44","49708  >  52447 [ACK] Seq=572 Ack=798 Win=8383 Len=0"
"173","2.709931","127.0.0.1","127.0.0.1","TCP","101","49708  >  52447 [PSH, ACK] Seq=572 Ack=798 Win=8383 Len=57"
"174","2.709983","127.0.0.1","127.0.0.1","TCP","44","52447  >  49708 [ACK] Seq=798 Ack=629 Win=8389 Len=0"
"175","2.710083","127.0.0.1","127.0.0.1","TCP","87","49708  >  52447 [PSH, ACK] Seq=629 Ack=798 Win=8383 Len=43"
"176","2.710118","127.0.0.1","127.0.0.1","TCP","44","52447  >  49708 [ACK] Seq=798 Ack=672 Win=8389 Len=0"
"177","2.760664","127.0.0.1","127.0.0.1","TCP","2654","49709  >  52453 [PSH, ACK] Seq=28780 Ack=344 Win=8403 Len=2610"
"178","2.760770","127.0.0.1","127.0.0.1","TCP","44","52453  >  49709 [ACK] Seq=344 Ack=31390 Win=8432 Len=0"
"179","2.791399","127.0.0.1","127.0.0.1","TCP","87","52453  >  49709 [PSH, ACK] Seq=344 Ack=31390 Win=8432 Len=43"
"180","2.791488","127.0.0.1","127.0.0.1","TCP","44","49709  >  52453 [ACK] Seq=31390 Ack=387 Win=8403 Len=0"
"181","2.792012","127.0.0.1","127.0.0.1","TCP","61","49709  >  52453 [PSH, ACK] Seq=31390 Ack=387 Win=8403 Len=17"
"182","2.792069","127.0.0.1","127.0.0.1","TCP","44","52453  >  49709 [ACK] Seq=387 Ack=31407 Win=8432 Len=0"
"183","3.046216","127.0.0.1","127.0.0.1","TCP","2654","49709  >  52453 [PSH, ACK] Seq=31407 Ack=387 Win=8403 Len=2610"
"184","3.046285","127.0.0.1","127.0.0.1","TCP","44","52453  >  49709 [ACK] Seq=387 Ack=34017 Win=8422 Len=0"
"185","3.046626","127.0.0.1","127.0.0.1","TCP","74","52453  >  49709 [PSH, ACK] Seq=387 Ack=34017 Win=8422 Len=30"
"186","3.046673","127.0.0.1","127.0.0.1","TCP","44","49709  >  52453 [ACK] Seq=34017 Ack=417 Win=8403 Len=0"
"187","3.046763","127.0.0.1","127.0.0.1","TCP","61","49709  >  52453 [PSH, ACK] Seq=34017 Ack=417 Win=8403 Len=17"
"188","3.046787","127.0.0.1","127.0.0.1","TCP","44","52453  >  49709 [ACK] Seq=417 Ack=34034 Win=8422 Len=0"
"189","3.260833","127.0.0.1","127.0.0.1","TCP","2654","49709  >  52453 [PSH, ACK] Seq=34034 Ack=417 Win=8403 Len=2610"
"190","3.260896","127.0.0.1","127.0.0.1","TCP","44","52453  >  49709 [ACK] Seq=417 Ack=36644 Win=8411 Len=0"
"191","3.261496","127.0.0.1","127.0.0.1","TCP","74","52453  >  49709 [PSH, ACK] Seq=417 Ack=36644 Win=8411 Len=30"
"192","3.261544","127.0.0.1","127.0.0.1","TCP","44","49709  >  52453 [ACK] Seq=36644 Ack=447 Win=8403 Len=0"
"193","3.261681","127.0.0.1","127.0.0.1","TCP","61","49709  >  52453 [PSH, ACK] Seq=36644 Ack=447 Win=8403 Len=17"
"194","3.261707","127.0.0.1","127.0.0.1","TCP","44","52453  >  49709 [ACK] Seq=447 Ack=36661 Win=8411 Len=0"
"195","3.480462","127.0.0.1","127.0.0.1","TCP","2654","49709  >  52453 [PSH, ACK] Seq=36661 Ack=447 Win=8403 Len=2610"
"196","3.480524","127.0.0.1","127.0.0.1","TCP","44","52453  >  49709 [ACK] Seq=447 Ack=39271 Win=8401 Len=0"
"197","3.492353","127.0.0.1","127.0.0.1","TCP","74","52453  >  49709 [PSH, ACK] Seq=447 Ack=39271 Win=8401 Len=30"
"198","3.492401","127.0.0.1","127.0.0.1","TCP","44","49709  >  52453 [ACK] Seq=39271 Ack=477 Win=8403 Len=0"
"199","3.496028","127.0.0.1","127.0.0.1","TCP","61","49709  >  52453 [PSH, ACK] Seq=39271 Ack=477 Win=8403 Len=17"
"200","3.496048","127.0.0.1","127.0.0.1","TCP","44","52453  >  49709 [ACK] Seq=477 Ack=39288 Win=8401 Len=0"
"201","3.671071","127.0.0.1","127.0.0.1","TCP","45","49692  >  49691 [PSH, ACK] Seq=20 Ack=1 Win=8442 Len=1"
"202","3.671107","127.0.0.1","127.0.0.1","TCP","44","49691  >  49692 [ACK] Seq=1 Ack=21 Win=8280 Len=0"
"203","3.671658","127.0.0.1","127.0.0.1","TCP","45","49689  >  49690 [PSH, ACK] Seq=20 Ack=1 Win=8442 Len=1"
"204","3.671675","127.0.0.1","127.0.0.1","TCP","44","49690  >  49689 [ACK] Seq=1 Ack=21 Win=8279 Len=0"
"205","3.671866","127.0.0.1","127.0.0.1","TCP","45","49692  >  49691 [PSH, ACK] Seq=21 Ack=1 Win=8442 Len=1"
"206","3.671879","127.0.0.1","127.0.0.1","TCP","44","49691  >  49692 [ACK] Seq=1 Ack=22 Win=8280 Len=0"
"207","3.672178","127.0.0.1","127.0.0.1","TCP","45","49689  >  49690 [PSH, ACK] Seq=21 Ack=1 Win=8442 Len=1"
"208","3.672201","127.0.0.1","127.0.0.1","TCP","44","49690  >  49689 [ACK] Seq=1 Ack=22 Win=8279 Len=0"
"209","3.672358","127.0.0.1","127.0.0.1","TCP","45","49692  >  49691 [PSH, ACK] Seq=22 Ack=1 Win=8442 Len=1"
"210","3.672366","127.0.0.1","127.0.0.1","TCP","44","49691  >  49692 [ACK] Seq=1 Ack=23 Win=8280 Len=0"
"211","3.672556","127.0.0.1","127.0.0.1","TCP","45","49689  >  49690 [PSH, ACK] Seq=22 Ack=1 Win=8442 Len=1"
"212","3.672564","127.0.0.1","127.0.0.1","TCP","44","49690  >  49689 [ACK] Seq=1 Ack=23 Win=8279 Len=0"
"213","3.672703","127.0.0.1","127.0.0.1","TCP","45","49692  >  49691 [PSH, ACK] Seq=23 Ack=1 Win=8442 Len=1"
"214","3.672711","127.0.0.1","127.0.0.1","TCP","44","49691  >  49692 [ACK] Seq=1 Ack=24 Win=8280 Len=0"
"215","3.672926","127.0.0.1","127.0.0.1","TCP","45","49689  >  49690 [PSH, ACK] Seq=23 Ack=1 Win=8442 Len=1"
"216","3.672934","127.0.0.1","127.0.0.1","TCP","44","49690  >  49689 [ACK] Seq=1 Ack=24 Win=8279 Len=0"
"217","3.673062","127.0.0.1","127.0.0.1","TCP","45","49692  >  49691 [PSH, ACK] Seq=24 Ack=1 Win=8442 Len=1"
"218","3.673071","127.0.0.1","127.0.0.1","TCP","44","49691  >  49692 [ACK] Seq=1 Ack=25 Win=8280 Len=0"
"219","3.673404","127.0.0.1","127.0.0.1","TCP","45","49689  >  49690 [PSH, ACK] Seq=24 Ack=1 Win=8442 Len=1"
"220","3.673428","127.0.0.1","127.0.0.1","TCP","44","49690  >  49689 [ACK] Seq=1 Ack=25 Win=8279 Len=0"
"221","3.712315","127.0.0.1","127.0.0.1","TCP","2650","49709  >  52453 [PSH, ACK] Seq=39288 Ack=477 Win=8403 Len=2606"
"222","3.712379","127.0.0.1","127.0.0.1","TCP","44","52453  >  49709 [ACK] Seq=477 Ack=41894 Win=8391 Len=0"
"223","3.716680","127.0.0.1","127.0.0.1","TCP","74","52453  >  49709 [PSH, ACK] Seq=477 Ack=41894 Win=8391 Len=30"
"224","3.716711","127.0.0.1","127.0.0.1","TCP","44","49709  >  52453 [ACK] Seq=41894 Ack=507 Win=8403 Len=0"
"225","3.719634","127.0.0.1","127.0.0.1","TCP","61","49709  >  52453 [PSH, ACK] Seq=41894 Ack=507 Win=8403 Len=17"
"226","3.719677","127.0.0.1","127.0.0.1","TCP","44","52453  >  49709 [ACK] Seq=507 Ack=41911 Win=8391 Len=0"
"227","3.915286","127.0.0.1","127.0.0.1","TCP","2653","49709  >  52453 [PSH, ACK] Seq=41911 Ack=507 Win=8403 Len=2609"
"228","3.915339","127.0.0.1","127.0.0.1","TCP","44","52453  >  49709 [ACK] Seq=507 Ack=44520 Win=8381 Len=0"
"229","3.918503","127.0.0.1","127.0.0.1","TCP","74","52453  >  49709 [PSH, ACK] Seq=507 Ack=44520 Win=8381 Len=30"
"230","3.918522","127.0.0.1","127.0.0.1","TCP","44","49709  >  52453 [ACK] Seq=44520 Ack=537 Win=8402 Len=0"
"231","3.923701","127.0.0.1","127.0.0.1","TCP","61","49709  >  52453 [PSH, ACK] Seq=44520 Ack=537 Win=8402 Len=17"
"232","3.923748","127.0.0.1","127.0.0.1","TCP","44","52453  >  49709 [ACK] Seq=537 Ack=44537 Win=8381 Len=0"
"233","4.243623","127.0.0.1","127.0.0.1","TCP","2655","49709  >  52453 [PSH, ACK] Seq=44537 Ack=537 Win=8402 Len=2611"
"234","4.243679","127.0.0.1","127.0.0.1","TCP","44","52453  >  49709 [ACK] Seq=537 Ack=47148 Win=8370 Len=0"
"235","4.246982","127.0.0.1","127.0.0.1","TCP","74","52453  >  49709 [PSH, ACK] Seq=537 Ack=47148 Win=8370 Len=30"
"236","4.247026","127.0.0.1","127.0.0.1","TCP","44","49709  >  52453 [ACK] Seq=47148 Ack=567 Win=8402 Len=0"
"237","4.250280","127.0.0.1","127.0.0.1","TCP","61","49709  >  52453 [PSH, ACK] Seq=47148 Ack=567 Win=8402 Len=17"
"238","4.250314","127.0.0.1","127.0.0.1","TCP","44","52453  >  49709 [ACK] Seq=567 Ack=47165 Win=8370 Len=0"
"239","4.478941","127.0.0.1","127.0.0.1","TCP","2639","49709  >  52453 [PSH, ACK] Seq=47165 Ack=567 Win=8402 Len=2595"
"240","4.479009","127.0.0.1","127.0.0.1","TCP","44","52453  >  49709 [ACK] Seq=567 Ack=49760 Win=8360 Len=0"
"241","4.484626","127.0.0.1","127.0.0.1","TCP","87","52453  >  49709 [PSH, ACK] Seq=567 Ack=49760 Win=8360 Len=43"
"242","4.484671","127.0.0.1","127.0.0.1","TCP","44","49709  >  52453 [ACK] Seq=49760 Ack=610 Win=8402 Len=0"
"243","4.487563","127.0.0.1","127.0.0.1","TCP","61","49709  >  52453 [PSH, ACK] Seq=49760 Ack=610 Win=8402 Len=17"
"244","4.487606","127.0.0.1","127.0.0.1","TCP","44","52453  >  49709 [ACK] Seq=610 Ack=49777 Win=8360 Len=0"
"245","4.693966","127.0.0.1","127.0.0.1","TCP","45","49692  >  49691 [PSH, ACK] Seq=25 Ack=1 Win=8442 Len=1"
"246","4.694016","127.0.0.1","127.0.0.1","TCP","44","49691  >  49692 [ACK] Seq=1 Ack=26 Win=8280 Len=0"
"247","4.694461","127.0.0.1","127.0.0.1","TCP","45","49689  >  49690 [PSH, ACK] Seq=25 Ack=1 Win=8442 Len=1"
"248","4.694475","127.0.0.1","127.0.0.1","TCP","44","49690  >  49689 [ACK] Seq=1 Ack=26 Win=8279 Len=0"
"249","4.694639","127.0.0.1","127.0.0.1","TCP","45","49692  >  49691 [PSH, ACK] Seq=26 Ack=1 Win=8442 Len=1"
"250","4.694665","127.0.0.1","127.0.0.1","TCP","44","49691  >  49692 [ACK] Seq=1 Ack=27 Win=8280 Len=0"
"251","4.694938","127.0.0.1","127.0.0.1","TCP","45","49689  >  49690 [PSH, ACK] Seq=26 Ack=1 Win=8442 Len=1"
"252","4.694947","127.0.0.1","127.0.0.1","TCP","44","49690  >  49689 [ACK] Seq=1 Ack=27 Win=8279 Len=0"
"253","4.695084","127.0.0.1","127.0.0.1","TCP","45","49692  >  49691 [PSH, ACK] Seq=27 Ack=1 Win=8442 Len=1"
"254","4.695092","127.0.0.1","127.0.0.1","TCP","44","49691  >  49692 [ACK] Seq=1 Ack=28 Win=8280 Len=0"
"255","4.695287","127.0.0.1","127.0.0.1","TCP","45","49689  >  49690 [PSH, ACK] Seq=27 Ack=1 Win=8442 Len=1"
"256","4.695295","127.0.0.1","127.0.0.1","TCP","44","49690  >  49689 [ACK] Seq=1 Ack=28 Win=8279 Len=0"
"257","4.695465","127.0.0.1","127.0.0.1","TCP","45","49692  >  49691 [PSH, ACK] Seq=28 Ack=1 Win=8442 Len=1"
"258","4.695473","127.0.0.1","127.0.0.1","TCP","44","49691  >  49692 [ACK] Seq=1 Ack=29 Win=8280 Len=0"
"259","4.695656","127.0.0.1","127.0.0.1","TCP","45","49689  >  49690 [PSH, ACK] Seq=28 Ack=1 Win=8442 Len=1"
"260","4.695663","127.0.0.1","127.0.0.1","TCP","44","49690  >  49689 [ACK] Seq=1 Ack=29 Win=8279 Len=0"
"261","4.695798","127.0.0.1","127.0.0.1","TCP","45","49692  >  49691 [PSH, ACK] Seq=29 Ack=1 Win=8442 Len=1"
"262","4.695807","127.0.0.1","127.0.0.1","TCP","44","49691  >  49692 [ACK] Seq=1 Ack=30 Win=8280 Len=0"
"263","4.696169","127.0.0.1","127.0.0.1","TCP","45","49689  >  49690 [PSH, ACK] Seq=29 Ack=1 Win=8442 Len=1"
"264","4.696177","127.0.0.1","127.0.0.1","TCP","44","49690  >  49689 [ACK] Seq=1 Ack=30 Win=8279 Len=0"
"265","4.705227","127.0.0.1","127.0.0.1","TCP","2642","49709  >  52453 [PSH, ACK] Seq=49777 Ack=610 Win=8402 Len=2598"
"266","4.705287","127.0.0.1","127.0.0.1","TCP","44","52453  >  49709 [ACK] Seq=610 Ack=52375 Win=8350 Len=0"
"267","4.710123","127.0.0.1","127.0.0.1","TCP","74","52453  >  49709 [PSH, ACK] Seq=610 Ack=52375 Win=8350 Len=30"
"268","4.710168","127.0.0.1","127.0.0.1","TCP","44","49709  >  52453 [ACK] Seq=52375 Ack=640 Win=8402 Len=0"
"269","4.713431","127.0.0.1","127.0.0.1","TCP","61","49709  >  52453 [PSH, ACK] Seq=52375 Ack=640 Win=8402 Len=17"
"270","4.713475","127.0.0.1","127.0.0.1","TCP","44","52453  >  49709 [ACK] Seq=640 Ack=52392 Win=8350 Len=0"
"271","4.924853","127.0.0.1","127.0.0.1","TCP","2642","49709  >  52453 [PSH, ACK] Seq=52392 Ack=640 Win=8402 Len=2598"
"272","4.924916","127.0.0.1","127.0.0.1","TCP","44","52453  >  49709 [ACK] Seq=640 Ack=54990 Win=8340 Len=0"
"273","4.940278","127.0.0.1","127.0.0.1","TCP","74","52453  >  49709 [PSH, ACK] Seq=640 Ack=54990 Win=8340 Len=30"
"274","4.940325","127.0.0.1","127.0.0.1","TCP","44","49709  >  52453 [ACK] Seq=54990 Ack=670 Win=8402 Len=0"
"275","4.945357","127.0.0.1","127.0.0.1","TCP","61","49709  >  52453 [PSH, ACK] Seq=54990 Ack=670 Win=8402 Len=17"
"276","4.945400","127.0.0.1","127.0.0.1","TCP","44","52453  >  49709 [ACK] Seq=670 Ack=55007 Win=8340 Len=0"
"277","5.145686","127.0.0.1","127.0.0.1","TCP","2635","49709  >  52453 [PSH, ACK] Seq=55007 Ack=670 Win=8402 Len=2591"
"278","5.145720","127.0.0.1","127.0.0.1","TCP","44","52453  >  49709 [ACK] Seq=670 Ack=57598 Win=8330 Len=0"
"279","5.156554","127.0.0.1","127.0.0.1","TCP","74","52453  >  49709 [PSH, ACK] Seq=670 Ack=57598 Win=8330 Len=30"
"280","5.156577","127.0.0.1","127.0.0.1","TCP","44","49709  >  52453 [ACK] Seq=57598 Ack=700 Win=8402 Len=0"
"281","5.177427","127.0.0.1","127.0.0.1","TCP","61","49709  >  52453 [PSH, ACK] Seq=57598 Ack=700 Win=8402 Len=17"
"282","5.177475","127.0.0.1","127.0.0.1","TCP","44","52453  >  49709 [ACK] Seq=700 Ack=57615 Win=8330 Len=0"
"283","5.378113","127.0.0.1","127.0.0.1","TCP","2642","49709  >  52453 [PSH, ACK] Seq=57615 Ack=700 Win=8402 Len=2598"
"284","5.378181","127.0.0.1","127.0.0.1","TCP","44","52453  >  49709 [ACK] Seq=700 Ack=60213 Win=8319 Len=0"
"285","5.378461","127.0.0.1","127.0.0.1","TCP","74","52453  >  49709 [PSH, ACK] Seq=700 Ack=60213 Win=8319 Len=30"
"286","5.378517","127.0.0.1","127.0.0.1","TCP","44","49709  >  52453 [ACK] Seq=60213 Ack=730 Win=8402 Len=0"
"287","5.381569","127.0.0.1","127.0.0.1","TCP","61","49709  >  52453 [PSH, ACK] Seq=60213 Ack=730 Win=8402 Len=17"
"288","5.381614","127.0.0.1","127.0.0.1","TCP","44","52453  >  49709 [ACK] Seq=730 Ack=60230 Win=8319 Len=0"
"289","5.699599","127.0.0.1","127.0.0.1","TCP","2636","49709  >  52453 [PSH, ACK] Seq=60230 Ack=730 Win=8402 Len=2592"
"290","5.699660","127.0.0.1","127.0.0.1","TCP","44","52453  >  49709 [ACK] Seq=730 Ack=62822 Win=8309 Len=0"
"291","5.710582","127.0.0.1","127.0.0.1","TCP","45","49692  >  49691 [PSH, ACK] Seq=30 Ack=1 Win=8442 Len=1"
"292","5.710624","127.0.0.1","127.0.0.1","TCP","44","49691  >  49692 [ACK] Seq=1 Ack=31 Win=8280 Len=0"
"293","5.711060","127.0.0.1","127.0.0.1","TCP","45","49689  >  49690 [PSH, ACK] Seq=30 Ack=1 Win=8442 Len=1"
"294","5.711075","127.0.0.1","127.0.0.1","TCP","44","49690  >  49689 [ACK] Seq=1 Ack=31 Win=8279 Len=0"
"295","5.711504","127.0.0.1","127.0.0.1","TCP","45","49692  >  49691 [PSH, ACK] Seq=31 Ack=1 Win=8442 Len=1"
"296","5.711519","127.0.0.1","127.0.0.1","TCP","44","49691  >  49692 [ACK] Seq=1 Ack=32 Win=8280 Len=0"
"297","5.711826","127.0.0.1","127.0.0.1","TCP","45","49689  >  49690 [PSH, ACK] Seq=31 Ack=1 Win=8442 Len=1"
"298","5.711837","127.0.0.1","127.0.0.1","TCP","44","49690  >  49689 [ACK] Seq=1 Ack=32 Win=8279 Len=0"
"299","5.712336","127.0.0.1","127.0.0.1","TCP","45","49692  >  49691 [PSH, ACK] Seq=32 Ack=1 Win=8442 Len=1"
"300","5.712361","127.0.0.1","127.0.0.1","TCP","44","49691  >  49692 [ACK] Seq=1 Ack=33 Win=8280 Len=0"
"301","5.712614","127.0.0.1","127.0.0.1","TCP","45","49689  >  49690 [PSH, ACK] Seq=32 Ack=1 Win=8442 Len=1"
"302","5.712623","127.0.0.1","127.0.0.1","TCP","44","49690  >  49689 [ACK] Seq=1 Ack=33 Win=8279 Len=0"
"303","5.712774","127.0.0.1","127.0.0.1","TCP","45","49692  >  49691 [PSH, ACK] Seq=33 Ack=1 Win=8442 Len=1"
"304","5.712783","127.0.0.1","127.0.0.1","TCP","44","49691  >  49692 [ACK] Seq=1 Ack=34 Win=8280 Len=0"
"305","5.712994","127.0.0.1","127.0.0.1","TCP","45","49689  >  49690 [PSH, ACK] Seq=33 Ack=1 Win=8442 Len=1"
"306","5.713008","127.0.0.1","127.0.0.1","TCP","44","49690  >  49689 [ACK] Seq=1 Ack=34 Win=8279 Len=0"
"307","5.713178","127.0.0.1","127.0.0.1","TCP","45","49692  >  49691 [PSH, ACK] Seq=34 Ack=1 Win=8442 Len=1"
"308","5.713186","127.0.0.1","127.0.0.1","TCP","44","49691  >  49692 [ACK] Seq=1 Ack=35 Win=8280 Len=0"
"309","5.713562","127.0.0.1","127.0.0.1","TCP","45","49689  >  49690 [PSH, ACK] Seq=34 Ack=1 Win=8442 Len=1"
"310","5.713578","127.0.0.1","127.0.0.1","TCP","44","49690  >  49689 [ACK] Seq=1 Ack=35 Win=8279 Len=0"
"311","5.715122","127.0.0.1","127.0.0.1","TCP","74","52453  >  49709 [PSH, ACK] Seq=730 Ack=62822 Win=8309 Len=30"
"312","5.715138","127.0.0.1","127.0.0.1","TCP","44","49709  >  52453 [ACK] Seq=62822 Ack=760 Win=8402 Len=0"
"313","5.715295","127.0.0.1","127.0.0.1","TCP","61","49709  >  52453 [PSH, ACK] Seq=62822 Ack=760 Win=8402 Len=17"
"314","5.715305","127.0.0.1","127.0.0.1","TCP","44","52453  >  49709 [ACK] Seq=760 Ack=62839 Win=8309 Len=0"
"315","5.918870","127.0.0.1","127.0.0.1","TCP","2640","49709  >  52453 [PSH, ACK] Seq=62839 Ack=760 Win=8402 Len=2596"
"316","5.918902","127.0.0.1","127.0.0.1","TCP","44","52453  >  49709 [ACK] Seq=760 Ack=65435 Win=8299 Len=0"
"317","5.920509","127.0.0.1","127.0.0.1","TCP","74","52453  >  49709 [PSH, ACK] Seq=760 Ack=65435 Win=8299 Len=30"
"318","5.920556","127.0.0.1","127.0.0.1","TCP","44","49709  >  52453 [ACK] Seq=65435 Ack=790 Win=8401 Len=0"
"319","5.922324","127.0.0.1","127.0.0.1","TCP","61","49709  >  52453 [PSH, ACK] Seq=65435 Ack=790 Win=8401 Len=17"
"320","5.922338","127.0.0.1","127.0.0.1","TCP","44","52453  >  49709 [ACK] Seq=790 Ack=65452 Win=8299 Len=0"
"321","6.120711","127.0.0.1","127.0.0.1","TCP","2640","49709  >  52453 [PSH, ACK] Seq=65452 Ack=790 Win=8401 Len=2596"
"322","6.120771","127.0.0.1","127.0.0.1","TCP","44","52453  >  49709 [ACK] Seq=790 Ack=68048 Win=8289 Len=0"
"323","6.122241","127.0.0.1","127.0.0.1","TCP","87","52453  >  49709 [PSH, ACK] Seq=790 Ack=68048 Win=8289 Len=43"
"324","6.122277","127.0.0.1","127.0.0.1","TCP","44","49709  >  52453 [ACK] Seq=68048 Ack=833 Win=8401 Len=0"
"325","6.122453","127.0.0.1","127.0.0.1","TCP","61","49709  >  52453 [PSH, ACK] Seq=68048 Ack=833 Win=8401 Len=17"
"326","6.122477","127.0.0.1","127.0.0.1","TCP","44","52453  >  49709 [ACK] Seq=833 Ack=68065 Win=8289 Len=0"
"327","6.411649","127.0.0.1","127.0.0.1","TCP","2643","49709  >  52453 [PSH, ACK] Seq=68065 Ack=833 Win=8401 Len=2599"
"328","6.411716","127.0.0.1","127.0.0.1","TCP","44","52453  >  49709 [ACK] Seq=833 Ack=70664 Win=8279 Len=0"
"329","6.413070","127.0.0.1","127.0.0.1","TCP","74","52453  >  49709 [PSH, ACK] Seq=833 Ack=70664 Win=8279 Len=30"
"330","6.413091","127.0.0.1","127.0.0.1","TCP","44","49709  >  52453 [ACK] Seq=70664 Ack=863 Win=8401 Len=0"
"331","6.413258","127.0.0.1","127.0.0.1","TCP","61","49709  >  52453 [PSH, ACK] Seq=70664 Ack=863 Win=8401 Len=17"
"332","6.413273","127.0.0.1","127.0.0.1","TCP","44","52453  >  49709 [ACK] Seq=863 Ack=70681 Win=8278 Len=0"
"333","6.671268","127.0.0.1","127.0.0.1","TCP","2640","49709  >  52453 [PSH, ACK] Seq=70681 Ack=863 Win=8401 Len=2596"
"334","6.671338","127.0.0.1","127.0.0.1","TCP","44","52453  >  49709 [ACK] Seq=863 Ack=73277 Win=8268 Len=0"
"335","6.671637","127.0.0.1","127.0.0.1","TCP","74","52453  >  49709 [PSH, ACK] Seq=863 Ack=73277 Win=8268 Len=30"
"336","6.671678","127.0.0.1","127.0.0.1","TCP","44","49709  >  52453 [ACK] Seq=73277 Ack=893 Win=8401 Len=0"
"337","6.671845","127.0.0.1","127.0.0.1","TCP","61","49709  >  52453 [PSH, ACK] Seq=73277 Ack=893 Win=8401 Len=17"
"338","6.671889","127.0.0.1","127.0.0.1","TCP","44","52453  >  49709 [ACK] Seq=893 Ack=73294 Win=8268 Len=0"
"339","6.718439","127.0.0.1","127.0.0.1","TCP","45","49692  >  49691 [PSH, ACK] Seq=35 Ack=1 Win=8442 Len=1"
"340","6.718487","127.0.0.1","127.0.0.1","TCP","44","49691  >  49692 [ACK] Seq=1 Ack=36 Win=8280 Len=0"
"341","6.718823","127.0.0.1","127.0.0.1","TCP","45","49689  >  49690 [PSH, ACK] Seq=35 Ack=1 Win=8442 Len=1"
"342","6.718839","127.0.0.1","127.0.0.1","TCP","44","49690  >  49689 [ACK] Seq=1 Ack=36 Win=8279 Len=0"
"343","6.718998","127.0.0.1","127.0.0.1","TCP","45","49692  >  49691 [PSH, ACK] Seq=36 Ack=1 Win=8442 Len=1"
"344","6.719010","127.0.0.1","127.0.0.1","TCP","44","49691  >  49692 [ACK] Seq=1 Ack=37 Win=8280 Len=0"
"345","6.719297","127.0.0.1","127.0.0.1","TCP","45","49689  >  49690 [PSH, ACK] Seq=36 Ack=1 Win=8442 Len=1"
"346","6.719306","127.0.0.1","127.0.0.1","TCP","44","49690  >  49689 [ACK] Seq=1 Ack=37 Win=8279 Len=0"
"347","6.719396","127.0.0.1","127.0.0.1","TCP","45","49692  >  49691 [PSH, ACK] Seq=37 Ack=1 Win=8442 Len=1"
"348","6.719421","127.0.0.1","127.0.0.1","TCP","44","49691  >  49692 [ACK] Seq=1 Ack=38 Win=8280 Len=0"
"349","6.719515","127.0.0.1","127.0.0.1","TCP","45","49689  >  49690 [PSH, ACK] Seq=37 Ack=1 Win=8442 Len=1"
"350","6.719521","127.0.0.1","127.0.0.1","TCP","44","49690  >  49689 [ACK] Seq=1 Ack=38 Win=8279 Len=0"
"351","6.719702","127.0.0.1","127.0.0.1","TCP","45","49692  >  49691 [PSH, ACK] Seq=38 Ack=1 Win=8442 Len=1"
"352","6.719722","127.0.0.1","127.0.0.1","TCP","44","49691  >  49692 [ACK] Seq=1 Ack=39 Win=8280 Len=0"
"353","6.720026","127.0.0.1","127.0.0.1","TCP","45","49689  >  49690 [PSH, ACK] Seq=38 Ack=1 Win=8442 Len=1"
"354","6.720037","127.0.0.1","127.0.0.1","TCP","44","49690  >  49689 [ACK] Seq=1 Ack=39 Win=8279 Len=0"
"355","6.720219","127.0.0.1","127.0.0.1","TCP","45","49692  >  49691 [PSH, ACK] Seq=39 Ack=1 Win=8442 Len=1"
"356","6.720254","127.0.0.1","127.0.0.1","TCP","44","49691  >  49692 [ACK] Seq=1 Ack=40 Win=8280 Len=0"
"357","6.720747","127.0.0.1","127.0.0.1","TCP","45","49689  >  49690 [PSH, ACK] Seq=39 Ack=1 Win=8442 Len=1"
"358","6.720762","127.0.0.1","127.0.0.1","TCP","44","49690  >  49689 [ACK] Seq=1 Ack=40 Win=8279 Len=0"
"359","6.877252","127.0.0.1","127.0.0.1","TCP","2648","49709  >  52453 [PSH, ACK] Seq=73294 Ack=893 Win=8401 Len=2604"
"360","6.877286","127.0.0.1","127.0.0.1","TCP","44","52453  >  49709 [ACK] Seq=893 Ack=75898 Win=8258 Len=0"
"361","6.883739","127.0.0.1","127.0.0.1","TCP","74","52453  >  49709 [PSH, ACK] Seq=893 Ack=75898 Win=8258 Len=30"
"362","6.883764","127.0.0.1","127.0.0.1","TCP","44","49709  >  52453 [ACK] Seq=75898 Ack=923 Win=8401 Len=0"
"363","6.889248","127.0.0.1","127.0.0.1","TCP","61","49709  >  52453 [PSH, ACK] Seq=75898 Ack=923 Win=8401 Len=17"
"364","6.889296","127.0.0.1","127.0.0.1","TCP","44","52453  >  49709 [ACK] Seq=923 Ack=75915 Win=8258 Len=0"
"365","7.081255","127.0.0.1","127.0.0.1","TCP","2649","49709  >  52453 [PSH, ACK] Seq=75915 Ack=923 Win=8401 Len=2605"
